video_id,last_trending_date,publish_date,publish_hour,category_id,channel_title,views,likes,dislikes,comment_count,comments_disabled,ratings_disabled,tag_appeared_in_title_count,tag_appeared_in_title,title,tags,description,trend_day_count,trend.publish.diff,trend_tag_highest,trend_tag_total,tags_count,subscriber
kJ18whKduFo,2017-12-11,2017-12-04,22,27,CrashCourse,48033,1732,145,227,False,False,3,True,Age & Aging: Crash Course Sociology #36,John Green|Hank Green|vlogbrothers|Crash Course|crashcourse|education|sociology|social sciences|age stratification|demographics|us census|aging|senescence,"People are getting older – not just in the individual sense, but the human population itself. Today we’re going to explore those shifting patterns and their implications. We’ll go over the biological, psychological, and cultural aspects of aging, including some of the particular challenges that older individuals face.\n\nCrash Course is made with Adobe Creative Cloud. Get a free trial here: https://www.adobe.com/creativecloud/catalog/desktop.html\n\n***\n\nReferences:\nSociology by John J. Macionis, 15th edition (2014)\n\nUN World Population Prospects, 2015 Revision https://esa.un.org/unpd/wpp/publications/files/key_findings_wpp_2015.pdf\n\nDemographic Trends in the 20th Century, US Census https://www.census.gov/prod/2002pubs/censr-4.pdf\n\n2010 Census Shows Nation's Population is Aging https://www.census.gov/newsroom/releases/archives/2010_census/cb11-cn147.html\n\nThe Decline in US Fertility, Population Reference Bureau http://www.prb.org/Publications/Datasheets/2014/2014-world-population-data-sheet/us-fertility-decline-factsheet.aspx\n\nNational Vital Statistics Report, CDC https://www.cdc.gov/nchs/data/nvsr/nvsr66/nvsr66_01.pdf\n\nPercent of U.S. Adults 55 and Over with Chronic Conditions, CDC https://www.cdc.gov/nchs/health_policy/adult_chronic_conditions.htm\n\nFacts for Features: Older Americans Month: May 2017, US Census https://www.census.gov/newsroom/facts-for-features/2017/cb17-ff08.html\n\n***\n\nCrash Course is on Patreon! You can support us directly by signing up at http://www.patreon.com/crashcourse\n\nThanks to the following Patrons for their generous monthly contributions that help keep Crash Course free for everyone forever:\n\nMark Brouwer, Nathan Taylor, Divonne Holmes à Court, Brian Thomas Gossett, Khaled El Shalakany, Indika Siriwardena, Robert Kunz, SR Foxley, Sam Ferguson, Yasenia Cruz, Daniel Baulig, Eric Koslow Caleb Weeks, Tim Curwick, Jessica Wode, Cami Wilson, Eric Prestemon, Evren Türkmenoğlu, Alexander Tamas, Justin Zingsheim, D.A. Noe, Shawn Arnold, Tom Trval, mark austin, Ruth Perez, Malcolm Callis, Kathrin Janßen, Ken Penttinen, Advait Shinde, Cody Carpenter, Annamaria Herrera, William McGraw, Bader AlGhamdi, Vaso, Melissa  Briski, Joey Quek, Andrei Krishkevich, Rachel Bright, Alex S, Mayumi Maeda, Kathy & Tim Philip, Montather, Jirat, Eric Kitchen, Moritz Schmidt, Ian Dundore, Chris Peters, Sandra Aft, Jason A Saslow, Steve Marshall\n--\n\nWant to find Crash Course elsewhere on the internet?\nFacebook - http://www.facebook.com/YouTubeCrashCourse\nTwitter - http://www.twitter.com/TheCrashCourse\nTumblr - http://thecrashcourse.tumblr.com \nSupport Crash Course on Patreon: http://patreon.com/crashcourse\n\nCC Kids: http://www.youtube.com/crashcoursekids",6,7,69,114,13,7348299.0
hKqzBGE5w-0,2017-12-10,2017-12-04,4,24,National Geographic,75312,1585,152,105,False,False,5,True,Morgan Freeman Hosts the Breakthrough Prize | Nat Geo Live,nat geo live|national geographic live|national geographic|nat geo|natgeo|science|culture|live|photographers|scientists|morgan freeman|morgan freeman breakthrough prize|morgan freeman nat geo|the story of us|breakthrough prize|Wiz Khalifa|mila kunis|ashton kutcher|kerry washington|ron howard|nana ou-yang|john urschel|miss usa kara mccullough|mark zuckerberg|sergey bring|yuri milner|julia milner|priscilla chan|anne qojcicki|nat geo breakthrough,"Hosted by Morgan Freeman and with live performance by hip hop artist Wiz Khalifa, the Breakthrough Prize honors top achievements in the fields of physics, life sciences and mathematics.  \n➡ Subscribe: http://bit.ly/NatGeoSubscribe\n➡ Watch all Nat Geo Live clips here: http://bit.ly/WatchNatGeoLive\n➡ Get More Nat Geo Live: http://bit.ly/MoreNatGeoLive\n\nAbout Nat Geo Live (National Geographic Live):\nThe National Geographic Live series brings thought-provoking presentations by today’s leading explorers, scientists, photographers, and performing artists right to you. Each presentation is filmed in front of a live audience at National Geographic headquarters in Washington, D.C.\n\nGet More National Geographic:\nOfficial Site: http://bit.ly/NatGeoOfficialSite\nFacebook: http://bit.ly/FBNatGeo\nTwitter: http://bit.ly/NatGeoTwitter\nInstagram: http://bit.ly/NatGeoInsta\n\nAbout National Geographic:\nNational Geographic is the world's premium destination for science, exploration, and adventure. Through their world-class scientists, photographers, journalists, and filmmakers, Nat Geo gets you closer to the stories that matter and past the edge of what's possible.\n\nMorgan Freeman hosts the Breakthrough Prize | Nat Geo Live\nhttps://www.youtube.com/watch?v=hKqzBGE5w-0\n\nNational Geographic\nhttps://www.youtube.com/natgeo",5,6,140,359,30,7552015.0
MDsJ9hheH30,2017-12-07,2017-11-30,15,24,Bravo,53415,222,10,83,False,False,4,True,"Vanderpump Rules: Lisa Confronts Sandoval for Talking Crap (Season 6, Episode 1) | Bravo",rich|wealthy|reality|drama|show|program|lifestyle|style|beverly hills|exclusive|Vanderpump Rules|restaurant|staff|Bravo|Bravo TV|Reality Television|Full Episodes|Sneak Peeks|Clips|Bravo Show|Lisa Vanderpump|Ariana Madix|Jax Taylor|Katie Maloney|Kristen Doute|Scheana Shay|James Kennedy|Tom Sandoval|beverly hills restaurants|real housewives of beverly hills|RHOBH|Tom Schwartz|Sur Restaurant|Sur-vers|PL-nJHoTivBRQOrCNmPsGep35Ihxa-dU8-|Confronts|Talking Crap,"Is Lisa done with Tom Tom? Watch new episodes of Vanderpump Rules, Mondays at 9/8c, only on Bravo! #PumpRules\n►►Subscribe to Bravo on YouTube: http://bravo.ly/Subscribe\n\nOfficial Site: http://bravo.ly/VanderpumpRules\nFull Episodes & Clips: http://bravo.ly/VanderpumpRulesVideos\nFacebook: http://bravo.ly/VanderpumpRulesFacebook\n\n\nThis season, Lisa forges ahead with her plan to add another restaurant to her growing empire but when her new partners Tom Sandoval and Tom Schwartz show their inexperience, the veteran restaurateur butts heads with them every step of the way. Newly single and nearly divorced, Scheana finds herself at the center of the SUR gossip when rumors about her new relationship begin to swirl. Ariana and Tom face one of the biggest fights of their relationship, as Tom’s loyal dedication to his friends makes Ariana feel like an afterthought. When Lala convinces Lisa to give her one last chance at SUR, the former outcast finds herself in an unlikely new role of peacekeeper, which complicates her friendship with James as he deals with a shocking rumor about his sex-life. Stassi tries to salvage her four-year relationship with Patrick, while Kristen devotes her energy to breaking up Jax and Brittany rather than focusing on her own relationship. Jax finds himself faced with a shocking accusation that could risk losing the best relationship he's ever had. Brittany wonders whether or not to stand by her man and the SUR gang is torn down the middle as they must decide where their loyalties lie. \n\nGet More Bravo:\nBravo Youtube: http://www.youtube.com/videobybravo\nFollow Bravo: http://bravo.ly/Twitter\nLike Bravo: http://bravo.ly/Facebook\nPin Bravo: http://bravo.ly/Pinterest\nBravo Instagram: http://bravo.ly/Instagram\nBravo Tumblr: http://bravo.ly/Tumblr\n\nBravo Media is the premiere lifestyle and entertainment brand that drives the cultural conversation around its high-quality, interactive original content that focuses on the network’s passion points of food, fashion, beauty, design, digital and pop culture. The network’s diversified slate includes Bravo’s first scripted series “Girlfriends’ Guide to Divorce,” scripted comedy “Odd Mom Out,” and unscripted favorites such as Emmy award-winning “Top Chef,” “Vanderpump Rules,” “Below Deck,” “Southern Charm” and the popular “Million Dollar Listing” and “The Real Housewives” franchises as well as the only live late-night talk show, “Watch What Happens Live.” \n\nVanderpump Rules: Lisa Confronts Sandoval for Talking Crap (Season 6, Episode 1) | Bravo",2,7,124,423,37,154612.0
QbDuBTWrU-o,2017-12-12,2017-12-06,2,28,William Osman,1087385,78398,1257,16646,False,False,2,True,My House Burned Down,laser cutter|william osman|crappy science|house burned down|fire|house fire|thomasfire|thomas|thomas fire|burned down|help me,GoFundMe: https://www.gofundme.com/osmans-fire-relief\nMassive wild fire burned my house down. We lost pretty much everything.\n\nMore Info: http://www.readyventuracounty.org/\n\nSupport us on Patreon: https://www.patreon.com/williamosman\nWebsite: http://www.williamosman.com/\nFacebook: https://www.facebook.com/williamosmanscience/\nInstaHam: https://www.instagram.com/crabsandscience/\nCameraManJohn: http://www.johnwillner.com/,6,6,30,90,11,417019.0
qLVZiKDNxtw,2017-12-07,2017-12-06,13,24,Watch What Happens Live with Andy Cohen,99577,969,197,223,False,False,6,True,Is Sam Smith Team Kim Kardashian Or Team Taylor Swift? | Plead The Fifth | WWHL,What What Happens live|reality|interview|fun|celebrity|Andy Cohen|talk|show|program|Bravo|Watch What Happens Live|WWHL|bravo andy|Watch|What|Happens|Singer|Sam Smith|plays|Plead the Fifth|pal|Kim Kardashian|singer Taylor Swift|Taylor Swift|feud|pop star|team Taylor or team Kim|Camilla|fifth harmony|Sam Smith plead the fifth|Sam Smith wwhl|Sam Smith watch what happens live|plead the fifth wwhl|Kim Kardashian wwhl|Kardashian|Kim Kardashian and Taylor Swift,"Singer Sam Smith plays Plead the Fifth and says what he thinks of pal Kim Kardashian and singer Taylor Swift’s feud and is also asked to name a pop star who has been awful to him.\n►► Subscribe To WWHL: http://bravo.ly/WWHLSub\n\nWatch WWHL Sun-Thu 11/10c:\nWWHL Website: http://www.bravotv.com/watch-what-happens-live\nFollow WWHL: https://twitter.com/BravoWWHL\nLike WWHL: https://www.facebook.com/WatchWhatHappensLive\nWWHL Tumblr: http://bravowwhl.tumblr.com/\n\n'Watch What Happens: Live' is Bravo's late-night, interactive talk show that features guests from the world of entertainment, politics, and pop culture. Hosted by Andy Cohen, the series includes lively debates on everything from fashion, the latest on everyone's favorite Bravolebrities, and what celebrity is making headlines that week. Past guests who have joined Cohen in the Bravo Clubhouse include Sarah Jessica Parker, Tina Fey, Khloe Kardashian, Jennifer Lopez, Liam Neeson, Kelly Ripa, Jimmy Fallon, Anderson Cooper, Jennifer Lawrence, and Lance Bass.\n\nWatch More Bravo:\nBravo Website: http://www.bravotv.com/\nBravo Youtube: http://www.youtube.com/videobybravo\nFollow Bravo: http://www.twitter.com/bravotv\nLike Bravo: https://www.facebook.com/BRAVO\nPin Bravo: http://www.pinterest.com/bravobybravo\nBravo Instagram: http://www.instagram.com/bravotv\nBravo Tumblr: http://bravotv.tumblr.com/\n\nIs Sam Smith Team Kim Kardashian Or Team Taylor Swift? | Plead The Fifth | WWHL",1,1,165,1022,36,348382.0
5wKYV-9Tq1o,2017-12-12,2017-12-05,19,24,Tyler Oakley,278795,18390,198,1491,False,False,2,True,Grinch Holiday Humming Challenge (ft. Grace Helbig),tyler oakley|tyleroakley|youtuber|vlog|vlogger|lgbtq|lgbt|gay|vlogging|upload|Q&A|question|answer|funny|lol|cc|captioned|grace helbig|the grinch|christmas|holidays|humming challenge|hanukkah|chanukkah|christmas music|christmas carols|carol of the bells|jingle bells|jingle bell rock|mean girls|mean girls the musical|how the grinch stole christmas|cindy lou who|frosty the snowman,"Get a free 30 day trial of Audible: http://bit.ly/Audible2017Tyler \nHope y'all enjoy, thanks for sponsoring this video, Audible!\n\nIt's finally December - which means snow, Christmas cheer, and of course... ICONIC holiday tunes. I thought there was no better was to celebrate the start of the season than with a makeover for the ages - as the Grinch! Join me + my who-pal, Grace Helbig as we do a special Holiday edition of the Humming Challenge!  Comment below with your FAVORITE Holiday song!\n\nWatch the video we made on Grace's channel: https://youtu.be/v_CMMWCN5nQ\n\nCheck out my last video where Joe Sugg & I try out 90's nostalgic toys: https://youtu.be/nVrkQyLS4oE\n\nSpecial Thanks to the Cinema Make Up School + Robert A. Lindsay for my fantastic Grinch makeover!\n\nCinema Makeup School\nhttps://www.cinemamakeup.com/\nhttps://www.facebook.com/CinemaMakeupSchoolFanPage\nhttps://www.instagram.com/cinemamakeupschool/\n\nRobert A. Lindsay\nhttps://www.instagram.com/Robertlindsayfx\nhttp://www.twitter.com/MMMutant\nhttps://www.youtube.com/user/Multimediamutant\n\nFind Grace:\nVideos: http://youtube.com/itsgrace\nTwitter: http://www.twitter.com/gracehelbig\nInstagram : http://instagram.com/gracehelbig\n\nMore silly collabs with Grace:\nhttps://youtu.be/lfnA8x1DNwg\nhttps://youtu.be/C13V46DLneI\nhttps://youtu.be/JGZhxfTfa10\nhttps://youtu.be/d1eECK33EtE\nhttps://youtu.be/4djqqzeHnLY\nhttps://youtu.be/JgYfZAjOgEM\n\nJoin our Twitter family: http://twitter.com/tyleroakley\nBinge (book): http://amazon.com/dp/1501117696\nSnervous (documentary): http://bit.ly/SnervousiTunes\nPsychobabble (podcast): http://itunes.com/psychobabble\nWatch the podcast: http://fullscreen.com/psychobabble\nUse promo code Psychobabble for a free 30 day trial! \n\nFind Tyler:\nSnapchat: snaptyleroakley\nVideos: http://youtube.com/tyleroakley\nBonus Videos: http://youtube.com/extratyler\nTwitter: http://twitter.com/tyleroakley\nTumblr: http://tyleroakley.tumblr.com\nFacebook: http://facebook.com/thetyleroakley\nT-Shirts: http://districtlines.com/tyleroakley\nInstagram: http://instagram.com/tyleroakley",6,7,488,1013,34,7833372.0
6mDsa-AqNcQ,2017-12-12,2017-12-05,15,27,Wendover Productions,718220,24687,1469,6007,False,False,4,True,India's Geography Problem,india|geography|problem|geopolitics|politics|issue|power|geo|water|borders|china|tibet|nepal|bhutan|bangladesh|indian|pakistan|east pakistan|british empire|britain|british|partition|international relations|wendover productions|wendover|half as interesting|hai|explained|interesting|animated|international|defense|human|people|countries,"Build your website for 10% off by going to http://squarespace.com/wendover\n\nSubscribe to Half as Interesting (The other channel from Wendover Productions): https://www.youtube.com/halfasinteresting\n\nCheck out my podcast with Brian from Real Engineering:\nhttps://itunes.apple.com/us/podcast/showmakers/id1224583218?mt=2 (iTunes link)\nhttps://www.youtube.com/channel/UC_10vJJqf2ZK0lWrb5BXAPg (YouTube link)\n\nSupport Wendover Productions on Patreon: https://www.patreon.com/wendoverproductions\n\nGet a Wendover Productions t-shirt for $20: \nhttps://store.dftba.com/products/wendover-productions-shirt\n\nYoutube: http://www.YouTube.com/WendoverProductions\nTwitter: http://www.Twitter.com/WendoverPro\nEmail: WendoverProductions@gmail.com\nReddit: http://Reddit.com/r/WendoverProductions\n\nAnimation by Josh Sherrington (https://www.youtube.com/heliosphere)\nSound by Graham Haerther (http://www.Haerther.net)\nThumbnail by Joe Cieplinski (http://joecieplinski.com/)\n\nMusic: So Far Away by Riot, Lithium By Kevin MacLeod, Hydra by Huma Huma, Namaste by Audionautix, and Raw Deal by Gunnar Olsen\n\nBig thanks to Patreon supporters: M, Pete, Ken Lee, Victor Zimmer, Paul Jihoon Choi, Dylan Benson, Etienne Dechamps, Donald, Chris Allen, Abil Abdulla, Anson Leng, Johnn & Becki Johnston, Connor J Smith, Arkadiy Kulev, Hagai Bloch Gabot, William Chappell, Eyal Matsliah, Joseph Bull, Marcelo Alves Vieira, Hank Green, Plinio Correa, Brady Bellini",6,7,86,381,35,1120982.0
__4c1JCHvaQ,2017-12-12,2017-12-07,16,26,First We Feast,3645622,188490,3598,20594,False,False,3,True,Logic Solves a Rubik's Cube While Eating Spicy Wings | Hot Ones,First we feast|fwf|firstwefeast|food|food porn|cook|cooking|chef|kitchen|recipe|cocktail|bartender|craft beer|complex|complex media|Cook (Profession)sean evans|logic|hot ones|sean evans|rapper|interview|hot sauce|spicy wings|hot wing challenge|hot food|the last dab|hot ones hot sauce|rubik's cube|10 questions|10 wings|1-800 logic|food challenge,"Rap phenom Logic spreads peace, love, and positivity wherever he goes. But how is he with hot food? Find out as the hyper-talented emcee battles through the wings of death, discussing his relationship with Neil deGrasse Tyson and challenging Vince Staples to a Playstation showdown along the way. Don't miss the fireworks at the end—in the words of Sean Evans, Probably the most challenging wing 10 we've ever had.  \n\nSubscribe to First We Feast on YouTube: http://goo.gl/UxFzhK\nCheck out more of First We Feast here:\nhttp://firstwefeast.com/\nhttps://twitter.com/firstwefeast\nhttps://www.facebook.com/FirstWeFeast\nhttp://instagram.com/firstwefeast\n\n\nFirst We Feast videos offer an iconoclastic view into the culinary world, taking you behind-the-scenes with some of the country's best chefs and finding the unexpected places where food and pop culture intersect.",5,5,165,975,32,2871344.0
iU4J2FF23Do,2017-12-09,2017-12-07,20,24,Saturday Night Live,368166,3175,2352,581,False,False,5,True,SNL Invisible Box Challenge,snl|saturday night live|invisible box challenge|chris redd|melissa villasenor|kyle mooney|beck bennett|alex moffat|s43|live|new york|comedy|sketch|funny|hilarious|late night|host|music|guest|laugh|impersonation|actor|improv|musician|challenge|Chris Redd|Melissa Villaseñor|Kyle Mooney|box|box challenge|step challenge|invisible step challenge|bts,"Chris Redd, Melissa Villaseñor, Kyle Mooney and more SNL cast members attempt the invisible box challenge.\n\n#SNL #SNL43\n\nGet more SNL: http://www.nbc.com/saturday-night-live\nFull Episodes: http://www.nbc.com/saturday-night-liv...\n\nLike SNL: https://www.facebook.com/snl\nFollow SNL: https://twitter.com/nbcsnl\nSNL Tumblr: http://nbcsnl.tumblr.com/\nSNL Instagram: http://instagram.com/nbcsnl \nSNL Pinterest: http://www.pinterest.com/nbcsnl/",2,2,488,2040,33,5292034.0
yyr51Kznab4,2017-12-13,2017-12-06,17,22,MoorInfo,178900,4152,578,1254,False,False,0,False,MUST WATCH!! Viewer calls News Anchor the NWORD LIVE: How the news anchor responds priceless!,tariq nasheed|tommy sotomayor|problack|alex jones|republican|democrat|blm|black lives matter|sjw|social justice warrior|fox news|fake news|all lives matter|antifa|internet nutrality|corey holcomn|wille d|dr umar johnson|dl hughley|conscious community|its okay to be white|roy moore|liberal|alex jones fake news cnn|professor griff|higher learning|michael rapaport|remy|david banner|corey holcomb|stephan a smith|keisha bottoms|damn album,FOLLOW ALL FOR MOOR INFO\n\n✅INSTAGRAM: https://www.instagram.com/moorinformation/\n\n✅FACEBOOK: https://m.facebook.com/moorinformation/\n\n✅TWITTER: https://twitter.com/moorinformation?lang=en\n\n✅SECOND CHANNEL: https://m.youtube.com/channel/UCEp48k_IDDHIGa-wYVjO5Eg\n\n✅SHIRTS(BUY BLACK): https://www.olmecian.com\n\nhttps://www.moorinfo.com\n______________________________________________________\n\nMoor Info does not claim to OWN every content submitted to this page! For Credit or Take-downs \nSimply Email Us: moorinformation@yahoo.com,6,7,17,86,33,
ZZE1_maXiAI,2017-12-13,2017-12-07,22,24,E! Entertainment,40258,189,90,49,False,False,1,True,WAGS Atlanta First Look | E!,E! Entertainment|E!|E! Online|Keeping up with the Kardashians|celebrities|gossip|entertainment news|pop culture|scripted|exclusive|events|top stories|reality|reality TV|red carpet|drama|New Season|Kim Kardashian|E! Entertainment Schedule|Kourtney Kardashian|Celebrity|Celeb Gossip|Celeb News|E! News|E! News Now|Chelsea Handler|The Soup|Celebrity News|Celebrity Pictures|Giuliana Rancic|Chelsea Lately|Comedians|Comedy|WAGS Atlanta,"Check out what's to come this season on WAGS Atlanta! Don't miss the series premiere Wednesday, January 3 at 10|9c on E!\n\nSUBSCRIBE: http://bit.ly/Eentsub\n\nAbout E! Entertainment:\nE! is on the Pulse of Pop Culture, bringing fans the very best original content including reality series, scripted programming, exclusive specials, breaking entertainment news, streaming events and more. Passionate viewers can’t get enough of our Pop Culture hits including Keeping Up with the Kardashians,” “Fashion Police,” “The Royals,” Total Divas” and “Botched.” And with new original programming on the way, fans have even more to love.\n\nConnect with E! Entertainment:\nVisit the E! WEBSITE: http://eonli.ne/1iX6d8n \nLike E! on FACEBOOK: http://eonli.ne/facebook\nCheck out E! on INSTAGRAM: http://eonli.ne/IG\nFollow E! on TWITTER: http://eonli.ne/twitter\nFollow E! on Spotify: http://eonli.ne/spotify\n\nWAGS Atlanta First Look | E!\nhttp://www.youtube.com/user/Eentertainment",6,6,441,1355,34,906208.0
xkYpO9ATUT0,2017-12-08,2017-12-07,6,24,The CW Television Network,61121,2469,68,420,False,False,4,True,Riverdale | Mad World | The CW,The CW|The CW Network|television|shows|TV|episodes|network|drama|Magic|Thriller|Heaven|Hell|Series|Show|Trailer|Episode|2015|CW|Television|Riverdale|Archie Comics|Archie|Jason Blossom|Archie Andrews|Jughead Jones|Betty Cooper|Veronica Lodge|Cheryl Blossom|Mad World|music,"Riverdale is new Wednesdays at 8/7c only on The CW, and available next day on The CW App: http://go.cwtv.com/genRVRyt\n \nSUBSCRIBE: http://go.cwtv.com/YTSubscribe\n \nAbout RIVERDALE:\nAs a new school year begins, the town of Riverdale is reeling from the recent, tragic death of high school golden boy Jason Blossom — and nothing feels the same. Archie Andrews (KJ Apa) is still the all-American teen, but the summer’s events made him realize that he wants to pursue a career in music and not follow in his dad’s footsteps despite the sudden end of his forbidden relationship with Riverdale’s young music teacher, Ms. Grundy (Sarah Habel). Now Archie has no one to mentor him, certainly not singer Josie McCoy (Ashleigh Murray), who is only focused on her band, the soon-to-be-world-famous Pussycats. It’s all weighing heavily on Archie’s mind — as is his fractured friendship with budding writer and fellow classmate Jughead Jones (Cole Sprouse). \n\nMeanwhile, girl-next-door Betty Cooper (Lili Reinhart) is anxious to see her crush Archie after being away all summer, but she’s not quite ready to reveal her true feelings to him. And Betty’s nerves, which are hardly soothed by her overbearing mother Alice (Mädchen Amick), aren’t the only thing holding her back. When a new student, Veronica Lodge (Camila Mendes), arrives in town from New York with her mother Hermione (Marisol Nichols), there’s an undeniable spark between Veronica and Archie, even though Veronica doesn’t want to risk her new friendship with Betty by making a play for Archie. And then there’s Cheryl Blossom (Madelaine Petsch)... Riverdale’s Queen Bee is happy to stir up trouble amongst Archie, Betty and Veronica, but Cheryl is keeping secrets of her own. What, exactly, is she hiding about the mysterious death of her twin brother, Jason? Riverdale may look like a quiet, sleepy town, but there are dangers in the shadows. \nBased on the characters from Archie Comics, RIVERDALE is from Warner Bros. Television and CBS Television Studios, in association with Berlanti Productions, with executive producers Roberto Aguirre-Sacasa (“Supergirl,” “Glee”), Greg Berlanti (“Arrow,” “The Flash,” “Supergirl,” “DC’s Legends of Tomorrow”), Sarah Schechter (“Arrow,” “The Flash,” “Supergirl,” “DC’s Legends of Tomorrow”) and Jon Goldwater (Archie Comics).\n\nConnect with RIVERDALE Online:\nLearn more about RIVERDALE : http://cwtv.com/shows/riverdale\nLike RIVERDALE on FACEBOOK:https://www.facebook.com/CWRiverdale\nFollow RIVERDALE on TWITTER: https://twitter.com/CW_Riverdale\nFollow RIVERDALE on INSTAGRAM: https://www.instagram.com/thecwriverdale/\n\nAbout The CW:\nOfficial YouTube Channel for the CW Television Network featuring the hit series Riverdale, as well as The Flash, Arrow, Supergirl, DC’s Legends of Tomorrow, Dynasty, Valor, Supernatural, Jane The Virgin, Crazy Ex-Girlfriend, The Originals, The 100, iZombie, Black Lightning, and Life Sentence.\n\nConnect with The CW Online:\nVisit The CW WEBSITE: http://on.cwtv.com/home\nLike The CW on FACEBOOK: http://www.facebook.com/thecw\nFollow The CW on TWITTER: http://twitter.com/thecw \nFollow The CW on INSTAGRAM: http://instagram.com/thecw\nFollow The CW on TUMBLR: http://cwnetwork.tumblr.com\nAdd The CW on GOOGLE+: http://plus.google.com/+thecw\nFollow The CW on PINTEREST: https://www.pinterest.com/thecw\n \nRiverdale | Mad World | The CW\nhttp://www.youtube.com/user/CWtelevision",1,1,171,1053,30,1012324.0
