video_id,last_trending_date,publish_date,publish_hour,category_id,channel_title,views,likes,dislikes,comment_count,comments_disabled,ratings_disabled,tag_appeared_in_title_count,tag_appeared_in_title,title,tags,description,trend_day_count,trend.publish.diff,trend_tag_highest,trend_tag_total,tags_count,subscriber
5qpjK5DgCt4,2017-11-20,2017-11-12,19,23,Rudy Mancuso,5315471,187303,7278,9990,False,False,8,True,"Racist Superman | Rudy Mancuso, King Bach & Lele Pons",racist superman|rudy|mancuso|king|bach|racist|superman|love|rudy mancuso poo bear black white official music video|iphone x by pineapple|lelepons|hannahstocking|rudymancuso|inanna|anwar|sarkis|shots|shotsstudios|alesso|anitta|brazil|Getting My Driver's License | Lele Pons,WATCH MY PREVIOUS VIDEO ▶ \n\nSUBSCRIBE ► https://www.youtube.com/channel/UC5jkXpfnBhlDjqh0ir5FsIQ?sub_confirmation=1\n\nTHANKS FOR WATCHING! LIKE & SUBSCRIBE FOR MORE VIDEOS!\n-----------------------------------------------------------\nFIND ME ON: \nInstagram | http://instagram.com/rudymancuso\nTwitter | http://twitter.com/rudymancuso\nFacebook | http://facebook.com/rudymancuso\n\nCAST: \nRudy Mancuso | http://youtube.com/c/rudymancuso\nLele Pons | http://youtube.com/c/lelepons\nKing Bach | https://youtube.com/user/BachelorsPadTv\n\nVideo Effects: \nCaleb Natale | https://instagram.com/calebnatale\n\nPA:\nPaulina Gregory\n\n\nShots Studios Channels:\nAlesso | https://youtube.com/c/alesso\nAnitta | http://youtube.com/c/anitta\nAnwar Jibawi | http://youtube.com/c/anwar\nAwkward Puppets | http://youtube.com/c/awkwardpuppets\nHannah Stocking | http://youtube.com/c/hannahstocking\nInanna Sarkis | http://youtube.com/c/inanna\nLele Pons | http://youtube.com/c/lelepons\nMaejor | http://youtube.com/c/maejor\nMike Tyson | http://youtube.com/c/miketyson \nRudy Mancuso | http://youtube.com/c/rudymancuso\nShots Studios | http://youtube.com/c/shots\n\n#Rudy\n#RudyMancuso,7,8,68,426,23,4191209.0
puqaWrEC7tY,2017-11-20,2017-11-13,11,24,Good Mythical Morning,913268,16729,1386,2988,False,False,3,True,Nickelback Lyrics: Real or Fake?,rhett and link|gmm|good mythical morning|rhett and link good mythical morning|good mythical morning rhett and link|mythical morning|Season 12|nickelback lyrics|nickelback lyrics real or fake|nickelback|nickelback songs|nickelback song|rhett link nickelback|gmm nickelback|lyrics (website category)|nickelback (musical group)|rock|music|lyrics|chad kroeger|music (industry)|mythical|gmm challenge|comedy|funny|the betrayal|the betrayal act III|how you remind me,Today we find out if Link is a Nickelback amateur or a secret Nickelback devotee. GMM #1218\nDon't miss an all new Ear Biscuits: https://goo.gl/xeZNQt\nWatch Part 4: https://youtu.be/MhCdiiB8CQg | Watch Part 2: https://youtu.be/7qiOrNao9fg\nWatch today's episode from the start: http://bit.ly/GMM1218\n\nPick up all of the official GMM merch only at https://mythical.store\n\nFollow Rhett & Link: \nInstagram: https://instagram.com/rhettandlink\nFacebook: https://facebook.com/rhettandlink\nTwitter: https://twitter.com/rhettandlink\nTumblr: https://rhettandlink.tumblr.com\nSnapchat: @realrhettlink\nWebsite: https://mythical.co/\n\nCheck Out Our Other Mythical Channels:\nGood Mythical MORE: https://youtube.com/goodmythicalmore\nRhett & Link: https://youtube.com/rhettandlink\nThis Is Mythical: https://youtube.com/thisismythical\nEar Biscuits: https://applepodcasts.com/earbiscuits\n\nWant to send us something? https://mythical.co/contact\nHave you made a Wheel of Mythicality intro video? Submit it here: https://bit.ly/GMMWheelIntro\n\nIntro Animation by Digital Twigs: https://www.digitaltwigs.com\nIntro & Outro Music by Jeff Zeigler & Sarah Schimeneck https://www.jeffzeigler.com\nWheel of Mythicality theme: https://www.royaltyfreemusiclibrary.com/\nAll Supplemental Music fromOpus 1 Music: https://opus1.sourceaudio.com/\nWe use ‘The Mouse’ by Blue Microphones https://www.bluemic.com/mouse/,7,7,488,1246,28,13186408.0
39idVpFF7NQ,2017-11-18,2017-11-12,5,24,Saturday Night Live,2688797,19042,3059,2689,False,False,4,True,Roy Moore & Jeff Sessions Cold Open - SNL,SNL|Saturday Night Live|SNL Season 43|Episode 1730|Tiffany Haddish|Roy Moore|Mikey Day|Mike Pence|Beck Bennett|Jeff Sessions|Kate McKinnon|s43|s43e5|episode 5|live|new york|comedy|sketch|funny|hilarious|late night|host|music|guest|laugh|impersonation|actor|improv|musician|comedian|actress|If Loving You Is Wrong|Oprah Winfrey|OWN|Girls Trip|The Carmichael Show|Keanu|Taylor Swift|Reputation|Look What You Made Me Do|ready for it?|cold open,Embattled Alabama Senate candidate Roy Moore (Mikey Day) meets with Vice President Mike Pence (Beck Bennett) and Attorney General Jeff Sessions (Kate McKinnon).\n\n#SNL #SNL43\n\nGet more SNL: http://www.nbc.com/saturday-night-live\nFull Episodes: http://www.nbc.com/saturday-night-liv...\n\nLike SNL: https://www.facebook.com/snl\nFollow SNL: https://twitter.com/nbcsnl\nSNL Tumblr: http://nbcsnl.tumblr.com/\nSNL Instagram: http://instagram.com/nbcsnl \nSNL Pinterest: http://www.pinterest.com/nbcsnl/,5,6,488,2216,42,5292034.0
jr9QtXwC9vc,2017-11-15,2017-11-13,14,1,20th Century Fox,2671756,12699,505,1010,False,False,6,True,The Greatest Showman | Official Trailer 2 [HD] | 20th Century FOX,Trailer|Hugh Jackman|Michelle Williams|Zac Efron|Zendaya|Rebecca Ferguson|pasek and paul|la la land|moulin rouge|high school musical|hugh jackman musical|zac efron musical|musical|the greatest showman|greatest showman|Michael Gracey|P.T. Barnum|Barnum and Bailey|Barnum Circus|Barnum and Bailey Circus|20th century fox|greatest showman trailer|trailer|official trailer|the greatest showman trailer|logan|Benj Pasek|Justin Paul,"Inspired by the imagination of P.T. Barnum, The Greatest Showman is an original musical that celebrates the birth of show business & tells of a visionary who rose from nothing to create a spectacle that became a worldwide sensation.\n\nIn Theaters This Christmas\n\nDirected By Michael Gracey\nCast: Hugh Jackman, Michelle Williams, Zac Efron, Zendaya, Rebecca Ferguson\n\nSUBSCRIBE: http://bit.ly/FOXSubscribe\n\n\nVisit the Official Site Here: http://www.foxmovies.com/movies/the-greatest-showman\nLike The Greatest Showman on FACEBOOK: http://fox.co/GreatestShowmanFB\nFollow The Greatest Showman on TWITTER: http://fox.co/GreatestShowmanTW\nFollow The Greatest Showman on INSTAGRAM: http://fox.co/GreatestShowmanIG\n\n#GreatestShowman\n\nAbout 20th Century FOX:\nOfficial YouTube Channel for 20th Century Fox Movies. Home of Avatar, Aliens, X-Men, Die Hard, Deadpool, Ice Age, Alvin and the Chipmunks, Rio, Peanuts, Maze Runner, Planet of the Apes, Wolverine and many more.\n\nConnect with 20th Century FOX Online:\nVisit the 20th Century FOX WEBSITE: http://bit.ly/FOXMovie\nLike 20th Century FOX on FACEBOOK: http://bit.ly/FOXFacebook\nFollow 20th Century FOX on TWITTER: http://bit.ly/TwitterFOX\n\nThe Greatest Showman | Official Trailer 2 [HD] | 20th Century FOX\nhttp://www.youtube.com/user/FoxMovies",2,2,151,458,28,2453494.0
5E4ZBSInqUU,2017-11-20,2017-11-13,17,10,marshmello,5468928,247884,5025,14903,False,False,3,True,Marshmello - Blocks (Official Music Video),marshmello|blocks|marshmello blocks|blocks music video|marshmello music video|roblox bully story|marshmello alone|roblox|cuphead|marshmello nightcore|marshmello musically|music for kids|happy music|videos that make you happy|childrens music|joytime|marshmello joytime|frat bro|band|high school|crush|mellogang|marshmallow|noviembre 2017|musik elektronik|billboard|november 2017|musica electronica 2017|edm 2017|best music 2017|lego|mtv hits 2017|video,"WATCH SILENCE MUSIC VIDEO ▶ https://youtu.be/Tx1sqYc3qas\nWATCH YOU & ME MUSIC VIDEO ▶ https://youtu.be/fiusxyygqGk\nWATCH FIND ME MUSIC VIDEO ▶ https://youtu.be/ymq1WdGUcw8\nWATCH MOVING ON MUSIC VIDEO ▶ https://youtu.be/yU0tnrEk8H4\nWATCH SUMMER MUSIC VIDEO ▶ https://youtu.be/2vMH8lITTCE\nWATCH ALONE MUSIC VIDEO ▶ https://youtu.be/ALZHF5UqnU4\nWATCH KEEP IT MELLO MUSIC VIDEO ▶ https://youtu.be/_J_VpmXAzqg\n\nSUBSCRIBE HERE ▶ http://www.youtube.com/marshmellomusic?sub_confirmation=1\n\nMARSHMELLO: \nSpotify | http://spoti.fi/2lxqzzm\nSoundCloud | http://soundcloud.com/marshmellomusic\nInstagram | http://instagram.com/marshmellomusic\nTwitter | http://twitter.com/marshmellomusic\nFacebook | http://facebook.com/marshmellomusic\nMerch | https://shop.marshmellomusic.com/\n\nCREDITS:\nAgency: MGX Creative\nDirector: Daniel Burke\nCreative Directors: Daniel Malikyar, Karam Gill\nExecutive Producer: Ryan Huffman\nProducer: Andrew Chennisi\nDP: Ian Quill\nProduction Designer: John Richoux\nEditor: Karl Jungquist\nColorist: Tyler Roth",7,7,158,248,33,11146743.0
B5HORANmzHw,2017-11-15,2017-11-12,22,27,SciShow,286577,9606,248,1196,False,False,1,True,Founding An Inbreeding-Free Space Colony,SciShow|science|Hank|Green|education|learn|stefan chin|mars|colony|genetic diversity|founder effect|alleles|effective population size|mutations|interstellar mission|acta astronautica|Founding An Inbreeding-Free Space Colony,"Thanks to 23AndMe for supporting SciShow. These kits make great gifts, so check out https://23AndMe.com/SciShow\n\nHow much genetic diversity would we need to found a colony on another planet?\n\nHosted by: Stefan Chin\n----------\nSupport SciShow by becoming a patron on Patreon: https://www.patreon.com/scishow\n----------\nDooblydoo thanks go to the following Patreon supporters: KSam Lutfi, Kevin Knupp, Nicholas Smith, Inerri, D.A. Noe, alexander wadsworth,\nسلطان الخليفي, Piya Shedden, KatieMarie Magnone, Scott Satovsky Jr, Bella Nash, Charles Southerland, Bader AlGhamdi, James Harshaw, Patrick Merrithew, Patrick D. Ashmore, Candy, Tim Curwick, charles george, Saul, Mark Terrio-Cameron, Viraansh Bhanushali, Kevin Bealer, Philippe von Bergen, Chris Peters, Fatima Iqbal, Justin Lentz\n----------\nLooking for SciShow elsewhere on the internet?\nFacebook: http://www.facebook.com/scishow\nTwitter: http://www.twitter.com/scishow\nTumblr: http://scishow.tumblr.com\nInstagram: http://instagram.com/thescishow\n----------\nSources:\nhttps://www.newscientist.com/article/dn1936-magic-number-for-space-pioneers-calculated/ \nhttp://www.popularmechanics.com/space/deep-space/a10369/how-many-people-does-it-take-to-colonize-another-star-system-16654747/ \nhttp://www.sciencedirect.com/science/article/pii/S0094576513004669 \nhttps://geneticliteracyproject.org/2016/07/05/mars-colonists-need-bring-earth-large-gene-pool/ \nhttps://www.salon.com/2015/04/12/there_will_be_sex_in_space_mars_science_and_the_dictates_of_biology_and_human_culture/\nhttps://www.britannica.com/science/minimum-viable-population\nhttps://www.nature.com/scientificamerican/journal/v308/n1/full/scientificamerican0113-38.html \nhttp://bio.classes.ucsc.edu/bio107/Class%20pdfs/W05_lecture8.pdf\nhttp://news.nationalgeographic.com/news/2002/02/0220_0220_wirelifeinspace_2.html\nhttps://www.ncbi.nlm.nih.gov/pmc/articles/PMC1276087/\nhttps://www.ncbi.nlm.nih.gov/pmc/articles/PMC2752555/\nhttps://www.genome.gov/27561444/iceland-study-provides-insights-into-disease-paves-way-for-largescale-genomic-studies/\nhttps://www.researchgate.net/publication/19535182_Observing_the_founder_effect_in_human_evolution\nhttps://www.pbs.org/wgbh/evolution/library/06/3/l_063_03.html\nhttps://investigativegenetics.biomedcentral.com/articles/10.1186/s13323-015-0028-9\nhttps://www.karger.com/Article/Abstract/90545\nhttps://www.ncbi.nlm.nih.gov/pmc/articles/PMC2987173/\nhttps://www.nature.com/hdy/journal/v100/n4/full/6801083a.html\nhttp://onlinelibrary.wiley.com/doi/10.1046/j.1469-1809.2003.00046.x/abstract\nhttps://nctc.fws.gov/courses/csp/csp3157/content/resources/pop_viability.pdf\nhttps://arxiv.org/pdf/1708.08649.pdf\nhttps://www.theatlantic.com/health/archive/2014/10/how-icelands-genealogy-obsession-leads-to-scientific-breakthroughs/381097/\nhttps://www.usatoday.com/story/tech/2013/04/18/new-app-helps-icelanders-avoid-accidental-incest/2093649/\n\nImages:\nhttps://commons.wikimedia.org/wiki/File:Founder_effect_Illustration.jpg\nhttps://commons.wikimedia.org/wiki/File:Amish_farm_morristown_new_york.jpg\nhttps://commons.wikimedia.org/wiki/File:Ingolf_by_Raadsig.jpg",2,3,140,311,17,4853444.0
e_7zHm7GsYc,2017-11-19,2017-11-13,15,10,Hunter Hayes,112866,3643,112,137,False,False,6,True,Hunter Hayes - You Should Be Loved (Part One Of Pictures),Hunter|Hayes|you should be loved|the shadowboxers|pictures|part one|official|music video|trilogy|hunter hayes|wanted|i want crazy|storm warning,You Should Be Loved (feat. The Shadowboxers) Available Now! Download or stream it here: https://HunterHayes.lnk.to/ysbl\n\nLike what you heard? Download or stream more songs by Hunter: \niTunes: http://smarturl.it/hunterhayes_itunes\nSpotify: http://smarturl.it/hunterhayes_sp\n\nStay in touch with Hunter! Follow him on social media: \nWebsite: http://smarturl.it/hunterhayes_site\nFacebook: http://smarturl.it/hunterhayes_fb \nTwitter: http://smarturl.it/hunterhayes_tw\nInstagram: http://smarturl.it/hunterhayes_ig\n\nMusic video by Hunter Hayes. ©2017 Atlantic Recording Corporation.,6,6,72,155,13,658161.0
0tO_l_Ed5Rs,2017-11-17,2017-11-11,16,10,MatthewSantoro,393265,16805,19201,8480,False,False,5,True,Matthew Santoro - FACTS (Official Music Video) f. Ellevan & Humble the Poet,matthew santoro facts|music video|matthew santoro|Ellevan|EllevanMusic|HumbleThePoet|Humble The Poet|FACTS|whats that facts,"LISTEN WITH HEADPHONES! 🎧. WATCH IN 4K! 👀\nProduced by Ellevan. Directed by Strø. Shot on RED.\nSpecial thanks to EllevanMusic and HumbleThePoet for their tireless hours put in helping to produce, perform in, and perfect this song! \nEllevan: \nhttp://youtube.com/ellevanmusic11\nhttp://instagram.com/ellevanmusic\nMore music: http://bit.ly/EllevanSpotify\nHumble:\nhttp://www.youtube.com/humblethepoet\nhttp://instagram.com/humblethepoet\nMore music: http://bit.ly/HumbleTPMusic\n\nHuge thanks to all these talented people who appeared in the video. They all do amazing things! FOLLOW THEM ON IG!\nStephen Spence @iamstevenspence\nJah'lon Wright @ijahlon\nSwoozie @swoozie\nAshley Kaltwasser @ashleykfit\nTim Brehmer @tim_brehmer\nJosh Lin @joshpalerlin\nSimmi Singh @simszter\nBrandon Dawson @bdizzlewitthestampinthemiddle\nTwan @twan\nRay Diaz @raydiaz\nLondon Shay @londonshaygoheen\nAdin Kolansky @adinkolansky\nBrittanie Nash @brittanie.nash\nTori Ross @itstoriross\nSabrina Manning @sabrina_nissa\nHuda Chay @hudachay\nMadeleine Rose @cheriemadeleine\nMarissa Gold @themarissagold\nAyla Marie @ayla_woodruff\nEmily Katz @emily_k8z\nMax Weisz @maxnosleeves\nKathryn Le @kathrynle_\nStrø @directedbystro\n\nOfficial album art: https://instagram.com/p/BbTfs-7AnrZ/\nvia http://instagram.com/jocktherock\n\nTwitter: http://twitter.com/MatthewSantoro\nFacebook: http://facebook.com/MatthewSantoro\nInstagram: http://instagram.com/MatthewSantoro\nSnapchat: http://snapchat.com/add/MatthewSantoro\n\nGet my book MIND = BLOWN here! http://bit.ly/MattsBook",4,6,57,77,9,5988586.0
w0XYVssCKjw,2017-11-17,2017-11-11,20,17,Kevin Durant,194930,6466,139,536,False,False,1,True,JaVale McGee's Parking Lot Chronicles: Episode 3,javale mcgee|golden state warriors|kevin durant|oakland|bay area|san francisco|oracle arena|e40|e-40|hip hop|rap|beats|beats by dre|life goes on|arthur|renowitzky|klay thompson|minnesota timberwolves|nick young|swaggy p,"The Parking Lot Chronicles return, coming at you on a rainy night in Oakland after the 11/8 win against the Timberwolves. Klay Thompson and Bay Area legend E-40 stop by, plus special guest Arthur Renowitzky tells his story and talks about his Life Goes On Foundation (http://www.lgof.org).\n\nWho do you wanna see on the next episode? Leave JaVale a note in the comments!\n\nExecutive Producers: JaVale McGee & Aloni Ford in conjunction with Thirty Five Media\n\nWatch JaVale's new music video: http://bit.ly/2yulAD1\nSubscribe for more: http://bit.ly/2tXIGi7",4,6,44,131,20,620050.0
MNiweoKXwfg,2017-11-16,2017-11-13,17,24,INSIDER,20529,318,11,41,False,False,1,True,Watch Norman Reedus Come Face to Face with his ‘Walking Dead’ Double,AMC|Norman Reedus|The Walking Dead|Ride With Norman Reedus|Daryl|behind the scenes|INSIDER|pop culture,AMC shared an exclusive clip from Monday night's Ride with Norman Reedus with INSIDER. The Walking Dead star Norman Reedus stops by the workshop of the show's executive producer and special FX make-up designer Greg Nicotero where he takes a look at crushed in zombie heads and takes a selfie with his double.\n\nRead more about clip on INSIDER: http://www.thisisinsider.com/norman-reedus-walking-dead-bust-2017-11  \n\nRide with Norman Reedus airs Monday at 9 p.m. on AMC.,3,3,25,90,8,1461545.0
arJ5h2TY3I4,2017-11-16,2017-11-10,17,24,SUPERFRUIT,1233722,115781,1615,9706,False,False,5,True,FANTASY (feat. Amber Liu) by SUPERFRUIT,superfruit|super|fruit|scott|hoying|mitch|grassi|fcute|weekly|obsessions|everyone|heres|good|song|dont|listen|to|anything|else|today|future|friends|amber liu|f(x)|kpop|fantasy,"Thanks to Amber Liu for being in this video!\n\nFUTURE FRIENDS\nTHE ALBUM - OUT NOW!\nhttp://smarturl.it/FutureFriends?IQid=yt\n\n“FANTASY” Directed by Scott Hoying, Mitch Grassi, Lindsey Blaufarb, Crag Hollamon\nFeaturing Amber Liu\nChoreographed by Lindsey Blaufarb and Craig Hollamon\nStyled by Candice Lambert\nHMU by Genevieve Lamb\n\nFUTURE FRIENDS TRACK LIST:\n1. IMAGINARY PARTIES\n2. BAD 4 US\n3. WORTH IT (PERFECT)\n4. VACATION\n5. SEXY LADIES\n6. HEARTTHROB\n7. FUTURE FRIENDS\n8. HOW YOU FEELING?\n9. HURRY UP!\n10. DENY U\n11. GOODBYE FROM LONELY\n12. GUY.EXE\n13. FANTASY featuring Amber Liu\n14. KEEP ME COMING\n15. EVERYTHING featuring Inara George\n16. FUTURE FRIENDS (Brian Robert Jones Choir Remix)\n\nNEW FF MERCHANDISE!!!\nhttps://sup3rfruitstore.com\n\nMORE WAYS TO GET FUTURE FRIENDS - THE ALBUM\nAmazon (Physical Album): http://smarturl.it/FutureFriendsAmz?IQid=yt\niTunes: http://smarturl.it/FutureFriends/itunes?IQid=yt\nAmazon Music: http://smarturl.it/FutureFriends/amazon?IQid=yt\nGoogle Play: http://smarturl.it/FutureFriends/googleplay?IQid=yt\n\nFUTURE FRIENDS PART ONE AVAILABLE NOW!\nGET IT EVERYWHERE:\niTunes http://smarturl.it/FutureFriendsPart1?IQid=yt\nApple Music http://smarturl.it/SFFutureFriendsPart1?IQid=yt\nAmazon http://smarturl.it/FutureFriendsPart1Am?IQid=yt\nSpotify http://smarturl.it/FutureFriendsPart1Sp?IQid=yt\nGoogle Play http://smarturl.it/FutureFriendsPart1GP?IQid=yt\n\nFUTURE FRIENDS PART TWO AVAILABLE NOW!\nGET IT EVERYWHERE:\niTunes http://smarturl.it/FutureFriendsPart2?IQid=sf\nApple Music  http://smarturl.it/FutureFriendsPart2ap?IQid=sf\nAmazon http://smarturl.it/FutureFriendsPart2Az?IQid=sf\nSpotify  http://smarturl.it/FutureFriendsPart2Sp?IQid=sf\nGoogle Play http://smarturl.it/FutureFriendsPart2GP?IQid=sf\n\nSNAPCHAT\n@scotthoying https://www.snapchat.com/add/scotthoying\n@mitchgrassi https://www.snapchat.com/add/mitchgrassi\n\nFACEBOOK\nhttps://www.facebook.com/Scomiche\n\nTWITTER\n@sup3rfruit https://twitter.com/sup3rfruit\n@scotthoying https://twitter.com/scotthoying\n@mitchgrassi https://twitter.com/mitchgrassi\n\nINSTAGRAM\n@sup3rfruit https://www.instagram.com/sup3rfruit\n@scotthoying https://www.instagram.com/scotthoying\n@mitchgrassi https://www.instagram.com/mitchgrassi\n\nBUSINESS INQUIRES: \nJonathan Kalter\njk3000@me.com\n\nLOVE YALL! STAY FCUTE!",3,6,44,273,26,2545188.0
RkHuWjiR-LM,2017-11-16,2017-11-10,18,10,Hopeless Records,241314,15071,186,1011,False,False,2,True,Neck Deep - Parachute (Official Music Video),Hopeless Records|neck deep|parachute|the peace and the panic|in bloom|tpatp|neckdeepuk|ben barlow|dani washington|fil thorpe evans|sam bowden|matt west|pop punk,"The official music video for Parachute, from the new album The Peace and The Panic out now on Hopeless Records!\n\n►Buy The Peace And The Panic for only $5 now! http://smarturl.it/TPATPIT\n►Check out new Neck Deep merch: neckdeepmerch.com\n►Listen to Parachute + more on Apple Music: http://smarturl.it/TPATPam\n►Get your tickets to catch Neck Deep on their US Headliner: http://bit.ly/2fyuUkA\n\n---\n\nDirected by Lewis Cater\n\n---\n\nLyrics:\n\nIt’s another day, wanna get away from here\nThere’s a plane out on a runway,\nGonna run away from here.\nCuz the rain is so terribly dull,\nAnd it bores me,\nMisery adores me.\nI wanna break out and get away.\nI wanna just try and live for me.\nCuz if we don’t try then we won’t believe that we could’ve had it.\nI wanna let go and fall for you,\nAnd when it gets rough be your parachute\nI wanna do the things that you only read about,\nAre you ready?\nI’m done with small town politics,\nI need to make my way to where the action is.\nI’m done with it, so the question is - are you coming with?\nCuz’ baby if you like I’ll take you there,\nImagine all the places we could go to disappear.\nOr we can turn the light off and go back to bed,\nStare at the stars on your ceiling and pretend that we’re somewhere else.\nWe don’t need a God to take a leap of faith;\nListen when I say,\nThat if we don’t try, then we won’t believe.\n\n---\n\nFollow Neck Deep on social media!\n\n►Twitter: https://twitter.com/NeckDeepUK\n►Facebook: https://www.facebook.com/neckdeepuk/\n►Instagram: https://www.instagram.com/neckdeepuk/\n\n---\n\nSubscribe to our channel for more videos!\n\nhttp://hopel.es/1SLT7uw\n\nFollow Hopeless Records on social media!\n\n► Twitter: http://twitter.com/hopelessrecords\n► Facebook: http://facebook.com/hopelessrecords\n► Instagram: http://instagram.com/hopelessrecords\n► Tumblr: http://tumblr.com/hopelessrecords\n► Snapchat: @hopelessrecords\n\nhttp://www.neckdeepuk.com\nhttp://hopelessrecords.com",3,6,3,16,13,941941.0
DIU3xPdhCBI,2017-11-16,2017-11-09,22,10,BBC Music,1262652,28119,1047,1113,False,False,4,True,Sam Smith surprises brides at their wedding! (At The BBC),bbc|music|bbc music|Sam Smith|Wedding|Sam Smith At The BBC|At the BBC,"You have to watch this! Sam serenades a couple at their wedding, and it is beautiful.\n\nSubscribe now: http://bit.ly/2fKbxWg \nWatch more: http://www.bbc.co.uk/programmes/b09f47wy",3,7,171,237,7,645538.0
xg9ebVTL9yE,2017-11-15,2017-11-10,5,10,empireofthesunvevo,178313,9072,98,656,False,False,7,True,Empire Of The Sun - Way To Go,Empire|Of|The|Sun|Way|To|Go|EMI|Alternative|eots|waay|too|goo|emipre of the sun|son|electronic|edm|australian|adm|aussie music. triplej|like a version|two leaves|flume|alison wonderland|cut copy|pnau|mgmt|hot chip|the presets|phoenix|hermitude|Nobumichi Asai|Ryo Kitabatake,"Download or stream “Way to Go” by Empire of the Sun: https://EmpireOfTheSun.lnk.to/OnOurWayHome \n\nConnect with Empire of the Sun: \nhttps://www.facebook.com/empireofthesun/\nhttps://twitter.com/EmpireOfTheSun\nhttps://www.instagram.com/empireofthesunsound/\n\nCreative Director: Nobumichi Asai [WOW inc.]\nDirector: Ryo Kitabatake [WOW inc.]\nCG Designer: Tsutomu Miyajima [WOW inc.]\nCG Designer: Daisuke Morikawaki [WOW inc.]\nCG Designer: Shota Oga [WOW inc.]\nTechnical Director: Nobumichi Asai [WOW inc.]\nProducer: Nobumichi Asai [WOW inc.]\nAssistant Producer: Ayaka Motoyoshi [WOW inc.]\n\nCamera: Kimihiro Morikawa\nLighting Director: Ryu Shima [NAGAIHOSHI Co.,Ltd.]\nHair&Make-up: Ina\nStylist: DAN\n\nCompositor & Colourist: Akio Sakamaki [jitto inc.]\n\nDigital Humans & Performance Capture: [ZUKUN LABORATORY]\n\nProducer: Kazuhiko Mino\nMotion Capture Supervisor: Kenya Miki\nFacial Capture Supervisor: Hiromu Kinoshita\nDigital Artist: Tomoya Tanaka\nDigital Artist: Deng Xiaohui\nDigital Artist: Cheng Ze\nDigital Artist: Satoko Itakura\nMotion Capture Specialist: Yuuka Tomita\nMotion Capture Specialist: Kouta Isomura\nMotion Capture Specialist: Kazuya Takahashi\nMotion Capture Specialist: Riku Okada\nMotion Capture Specialist: Rina Sawada\nFacial Capture Specialist: Taisei Kurita\nFacial Capture Specialist: Manami Kira\nFacial Capture Specialist: Diogo Ribeiro\nCG Project Manager: Yuko Sadaki\nCG Producer: Sawami Takahashi\nProduction Supervisor: Ayumu Kasai\n\n【Special Thanks】\nTranslator: Mika Iwasaka \nTranslator: Michiru Sasaki  [WOW inc.]\nTranslator: Sumiko Shiraishi [F.O.A. Inc.]\n\nLyrics: \n\nsurfing the snow\nare you ready for \na revolution to show the way \nseven more weeks until the day\n\nbecause heart breaks come in an bend us the wrong way \nplaces memory are changing into all things\n\ndoesn’t matter whats tripping you out theres ways to go\nthis is where we get carried away enough to start again\n\nwhat I see\nis nothing like before\ndreaming is the home of the brave \nfuture is the healing of pain\n\nbecause heart breaks come in an bend us the wrong way \nplaces memory are changing into all things\n\ndoesn’t matter whats tripping you out theres ways to go\nthis is where we get carried away enough to start again\ndoesn’t matter whats tripping you out theres ways to go\nthis is where we get carried away enough to start again \n\nlike a cannonball\nshot across the floor\nwe have found a way through the darkest hour\nlike a cannonball\nshot across the floor\nwe have little time for worry\n\ndoesn’t matter whats tripping you out theres ways to go\nthis is where we get carried away enough to start again\ndoesn’t matter whats tripping you out theres ways to go\nthis is where we get carried away enough to start again \ndoesn’t matter whats tripping you out theres ways to go\nthis is where we get carried away enough to start again \n\n© 2016 The Sleepy Jackson Pty Ltd and Nick Littlemore, under exclusive licence to Universal Music Australia Pty Ltd",2,5,67,267,33,252011.0
