video_id,last_trending_date,publish_date,publish_hour,category_id,channel_title,views,likes,dislikes,comment_count,comments_disabled,ratings_disabled,tag_appeared_in_title_count,tag_appeared_in_title,title,tags,description,trend_day_count,trend.publish.diff,trend_tag_highest,trend_tag_total,tags_count,subscriber
6dGqZmvDElA,2018-02-06,2018-01-31,18,25,Beme News,188158,7726,344,778,False,False,2,True,"Many Japanese Wear Face Masks, Should You?",Bejing pollution|smog|face mask|fashion|Asia|Sars outbreak|air pollution|global warming|Korea|Japan|Flu season|influenza|Tokyo|China|Bejing|K-pop|surgical masks|cute|surgical masks asia|3M|Sars|cdc|H1N1|beme|bemenews|casey neistat|news|youtube casey neistat|casey neistat beme|casey neistat cnn,"It's flu season. Lou doesn't want the flu - which got him thinking, should he be wearing a face mask?\n\nSources/Learn More:\n\nMitsutoshi Horii -  http://chaucercollege.academia.edu/MitsutoshiHorii\n\nThe Use of Facemasks to Prevent Respiratory Infection -  https://www.ncbi.nlm.nih.gov/pmc/articles/PMC4293989/\n\nClinical Trial of Mark Use in Households to Prevent Respiratory Virus Transmission - http://www.ijidonline.com/article/S1201-9712(08)01008-4/pdf\n\nWhy do Japanese Wear Masks? - http://www.japanesestudies.org.uk/ejcjs/vol14/iss2/horii.html\n\nCDC Influenza Report - https://www.cdc.gov/flu/weekly/index.htm\n\nCDC Everyday Preventative Actions - https://www.cdc.gov/nonpharmaceutical-interventions/personal/index.html\n\n1918 Influenza - https://www.ncbi.nlm.nih.gov/pmc/articles/PMC3291398/\n\n\nSign up for Beme Panels on Google Play and the App Store:\n https://play.google.com/store/apps/details?id=com.beme.app.android \n https://itunes.apple.com/us/app/beme-panels/id1274516645\n\nFollow Beme on Twitter: https://twitter.com/bemeapp \nFacebook: https://www.facebook.com/officialbeme/ \nInstagram: https://www.instagram.com/beme/ \nBeme: https://beme.com/",5,6,183,459,30,284533.0
ugdgAifIOBA,2018-02-06,2018-02-01,5,10,Atlantic Records,689209,35407,613,4744,False,False,8,True,Why Don't We - Trust Fund Baby (Official Audio),music|official|music video|atlantic|records|why don't we|trust fund baby|why don't we - trust fund baby|why don't we - trust fund baby (official audio)|why don't we trust fund baby|trust fund baby why don't we|trust fund baby - why don't we|audio|why|don't|we|trust|fund|baby|trust fund baby (official audio)|trust fund baby audio|wmg|atlantic records|these girls|something different|tfb|wdw tfb|wdw|whydontwe,'Trust Fund Baby' Out Now:\nhttps://Atlantic.lnk.to/TFBAY\n\nFollow Why Don't We\nhttps://Twitter.com/WhyDontWeMusic\nhttps://www.Instagram.com/WhyDontWeMu...\nhttps://www.Facebook.com/WhyDontWeMus...\nSnapchat: @WhyDontWeMusic\nMusical.ly: @WhyDontWeMusic,5,5,171,446,29,7296670.0
DhEjpq88wGw,2018-02-05,2018-01-31,12,24,Lip Sync Battle,699104,12224,326,680,False,False,7,True,Fifth Harmony’s Normani Kordei Performs 'Bootylicious' by Destiny's Child  | Lip Sync Battle Preview,Singing|Lip Sync Battle|Dancing|Lip Syncing|LL|Cool|Chrissy Teigen|Music|Comedy|lip sync|battle|dance|Lip Sync Show|lsb|Fifth Harmony|Normani Kordei|Beyoncé|Destiny's Child|Bootylicious|preview|Lauren Jauregui|pop group|pop|singer|Ally Brooke|Camila Cabello|Dinah Jane|twerk,"We don’t think we can handle this! Fifth Harmony’s Normani Kordei pulls out all the stops as Beyoncé for the Destiny's Child hit 'Bootylicious.'\n\nLip Sync Battle, Thursdays at 10/9c on Paramount Network.\n\n#ParamountNetwork  #LipSyncBattle #LSB #FifthHarmony #NormaniKordei #Beyoncé #DestinysChild #Bootylicious\n\nSubscribe to Lip Sync Battle: http://bit.ly/17wiz6n\n\nFollow Lip Sync Battle!\nFacebook: https://www.facebook.com/lipsyncbattle\nTwitter: @LSB https://twitter.com/LSB \nInstagram: @LipSyncBattle https://instagram.com/LipSyncBattle\nOfficial Playlist on Spotify: http://spoti.fi/1EvIXgh\nGiphy: http://giphy.com/lipsyncbattle\nTumblr: http://lipsyncbattle.tumblr.com\n\nFollow Paramount Network!\nWebsite: http://www.paramountnetwork.com\nYouTube: http://bit.ly/2G3Bo3w\nFacebook: @ParamountNetwork\nInstagram: @ParamountNetwork\nTwitter: @ParamountNet\n\nLip Sync Battle is back for another season of epic performances from the hottest stars on the planet! Each week, A-list celebrities go toe to toe, syncing contemporary hits and classic tracks, all for the ultimate bragging rights: the title of Lip Sync Battle Champion. Hosted by LL Cool J and Chrissy Teigen.",4,5,441,1102,28,2459221.0
-NEhvlJA5q8,2018-02-06,2018-01-31,17,25,MSNBC,330827,1255,436,2334,False,False,3,True,Amtrak Train Carrying Republican Lawmakers To A Retreat Hits Garbage Truck | Velshi & Ruhle | MSNBC,MSNBC|news channel|news station|newspaper|breaking news|us news|world news|politics|current events|top stories|pop culture|business|health|liberal|progressive|cable|cable news|Velshi & Ruhle|Ali Velshi|Stephanie Ruhle|MSNBC LIVE|chartered amtrak train crash|amtrak train hits trash truck|amtrak train west virginia|amtrak|west virginia|train carrying republicans|gop train|gop train hits trash truck|garbage truck|gop train hits garbage truck,"A chartered Amtrak train carrying Republican lawmakers to a retreat in West Virginia hit a garbage truck Wednesday morning. Initial reports from the scene indicate there were no serious injuries. NBC's Garrett Haake reports.\n\n» Subscribe to MSNBC: http://on.msnbc.com/SubscribeTomsnbc\n\nAbout: MSNBC is the premier destination for in-depth analysis of daily headlines, insightful political commentary and informed perspectives. Reaching more than 95 million households worldwide, MSNBC offers a full schedule of live news coverage, political opinions and award-winning documentary programming -- 24 hours a day, 7 days a week.\n\nConnect with MSNBC Online\nVisit msnbc.com: http://on.msnbc.com/Readmsnbc\nFind MSNBC on Facebook: http://on.msnbc.com/Likemsnbc\nFollow MSNBC on Twitter: http://on.msnbc.com/Followmsnbc\nFollow MSNBC on Google+: http://on.msnbc.com/Plusmsnbc\nFollow MSNBC on Instagram: http://on.msnbc.com/Instamsnbc\nFollow MSNBC on Tumblr: http://on.msnbc.com/LeanWithmsnbc\n\nAmtrak Train Carrying Republican Lawmakers To A Retreat Hits Garbage Truck | Velshi & Ruhle | MSNBC",5,6,86,496,31,791390.0
E7zFj4iUn0U,2018-02-02,2018-01-30,18,24,TMZ,430321,7699,1169,1912,False,False,2,True,Logan Paul Says He's Still Learning From Suicide Forest Mistake | TMZ,TMZ|Hollywood|Celebrity|Entertainment|Famous|Hollywood News|Fame|Entertainment News|TMZ Sports|TMZ Live|TMZ TV|logan paul|logan paul interview|logan paul tmz|logan paul vlogs|logan paul video|logan paul youtube|logan paul controversial|logan paul jokes|logan paul diss|logan paul suicide|logan paul music|grammys|tmz 2018|tmz 2017|raw video,"Logan Paul has music on the brain after Sunday night's Grammys, but he's also not trying to hide from the heinous footage he posted of a suicide victim ... and the backlash that followed.\n\nSUBSCRIBE: http://po.st/TMZSubscribe\n\nAbout TMZ:\nTMZ has consistently been credited for breaking the biggest stories dominating the entertainment news landscape and changed the way the public gets their news. Regularly referenced by the media, TMZ is one of the most cited entertainment news sources in the world. \n\nSubscribe to TMZ on YouTube for breaking celebrity news/ gossip and insight from the newsroom staff (TMZ Chatter & TMZ News), the best clips from TMZ on TV, Raw & Uncut TMZ paparazzi video (from TMZ.com) and the latest video from TMZ Sports and TMZ Live! \n\nKeeping Up with Our YouTube Exclusive Content:\nTMZ Chatter: TMZ newsroom staff insight and commentary from stories/ photos/ videos on TMZ.com \nTMZ News: The latest news you need to know from TMZ.com\nRaq Rants: Raquel Harper talks to a celebrity guest with ties to the hip hop and R&B communities.\nBehind The Bar Podcast: TMZ's lawyers Jason Beckerman and Derek Kaufman loiter at the intersection of law and entertainment, where they look closely at the personalities, events and trends driving the world of celebrity — and how the law affects it all.\n\nWe love Hollywood, we just have a funny way of showing it.\n\nNeed More TMZ?\nTMZ Website: http://po.st/TMZWebsite\nLIKE TMZ on Facebook! http://po.st/TMZLike\nFOLLOW TMZ on Twitter! http://po.st/TMZFollow\nFOLLOW TMZ on Instagram! http://po.st/TMZInsta\nTMZ on TV & TMZ Sports on FS1 Tune In Info: http://po.st/TMZOnAir\nTMZ is on iOS! http://po.st/TMZiOS\nTMZ is on Android! http://po.st/TMZonAndroid\n\nGot a Tip?\nContact TMZ: http://po.st/TMZTip\n\nCheck out TMZ Live, TMZ Sports and toofab!\nTMZ Live: http://po.st/TMZLiveWebsite\nSubscribe! TMZ Live: http://po.st/TMZLiveSubscribe\nTMZ Sports: http://po.st/TMZSportsWebsite\nSubscribe! TMZ Sports: http://po.st/TMZSportsSubscribe\nToofab: http://po.st/toofabWebsite\nSubscribe! toofab: http://po.st/toofabSubscribe\n\nhttps://www.youtube.com/c/TMZ",1,3,164,612,26,2786000.0
WwyqQ-o6zHA,2018-02-04,2018-01-30,11,1,Izac Less,99509,3378,74,267,False,False,2,True,Pop Culture Typography,pop culture|typography|madeon|animation|design|references|text|font|style|motion graphics,"This reference riddled project has been in the works for almost a year.\nIf you can't quite figure out where something is from, a labelled version of the video is available here: https://youtu.be/SGdnN8W30ho\n\nSong: Pop Culture - Madeon\nAnimation: Isaac Moores\n\nCreated in After Effects\nhttps://twitter.com/izacless\n\nOriginal song: https://youtu.be/lTx3G6h2xyA\nAdditional portrait art and style by: Glenn Patton",3,5,71,175,10,4119.0
1WRUGR-glbQ,2018-02-04,2018-01-30,11,26,Man About Cake,123452,5730,78,342,False,False,2,True,ROCK ON! Anti-Valentine's Day Cake | Man About Cake Modeling Chocolate Sculpting,man about cake|joshua john russell|craftsy|modeling chocolate sculpting|antivalentines day cake|chocolate funfetti cake|chocolate sprinkle cake|caramel|popcorn|peanut butter|mousse|realistic chocolate sculpting|galentines day|lonely hearts club|cake stencil|food stencil|petal dust stencil|cake tutorial|valentines cake ideas|candy bar cake|anatomical cake|uses for petal dust|easiest cake stenciling,"This Valentine's Cake is fit for two...or one. Your choice. 😉  Get the recipes for this incredible chocolate-peanut butter-caramel corn combo below, PLUS tutorials + supplies! Links here👇 👇\n\nStart your FREE trial of Craftsy Unlimited and binge endless cake videos: http://craftsy.me/2FrkzyC\n\nMaster modeling chocolate with Rachel Teufel's tutorial --- http://craftsy.me/2GrxEcm\n\nVanilla Cake Recipe (just add chocolate sprinkles): http://craftsy.me/2DUDRiz\nPeanut Butter Mousse: http://craftsy.me/2DOuj9B\nChocolate Ganache: http://craftsy.me/2Gs7why\nChocolate Buttercream: http://craftsy.me/2DIf1iM\n\nCheck out the stencil Joshua uses --- http://craftsy.me/2nmvgvP\n\nCheck out Joshua's sculpting hook by Lauren Kitchens --- http://craftsy.me/2Ft4Y1o\n\nFOLLOW\nhttps://www.facebook.com/ManAboutCakeShow\nhttps://www.instagram.com/manaboutcake/\nhttps://www.pinterest.com/Craftsy/man-about-cake/\n\nAbout this show\n-----------------\nSink your teeth into current cake decorating trends! In the Man About Cake series, you'll pick up incredible tips for creating modern masterpieces from cake designer Joshua John Russell. Each week, he decorates an original cake, shares his favorite recipes and gives pointers for designing like a pro.\n\nAbout Joshua John Russell\n------------------\nCake artist Joshua John Russell knows there's more to a gorgeous cake than meets the eye — and he's ready to share his secrets. He may be known for cracking jokes in the kitchen, but he's serious about showing you how to build beautiful cakes. From towering tiers to delicate details, his smart tips and pulse on cake trends will have you inspired to try out these techniques in your own kitchen!\n\nAbout Craftsy\n-------------------\nUnleash the maker in you! Join more than 10 million passionate makers on Craftsy, where you can access expert instruction, supplies, patterns, and endless inspiration to help you make more of what you love.",3,5,3,32,23,333471.0
w7HJZPlJn_U,2018-02-05,2018-01-30,17,10,Choir! Choir! Choir!,113584,1905,32,101,False,False,3,True,Choir! Choir! Choir! Epic! Nights: David Byrne + NYC sing HEROES,Choir Choir Choir|Choir! Choir! Choir!|C!C!C!|DABU|Nobu Adilman|Daveed Goldman|Arts & Crafts|Jason Burns|Cover Song|David Byrne|Talking Heads|Public Theater|under the radar festival|frame discreet|justin lovell|iron bay|iron bay media|ZERO11ZERO|byron kent wong|Jordan Holt|Breania Smith|David Bowie|Heroes|Choir|toronto|music|music video|new music video|new choir video|david byrne choir|heroes choir|heros|under the radar choir|canada|hallelujah,"Choir! Choir! Choir! teamed up with David Byrne and a TON of singers in the Ford Foundation lobby of the Public Theater during the Under the Radar Festival to sing 'Heroes' written by David Bowie and Brian Eno\n\nIt was magical + powerful. \n\nIf we ever needed a message to be our own heroes, right now is the time. \nThrow on some headphones + sing along. \n#WeCanBeHeroes",4,6,171,299,35,85317.0
_UrDtPZHlqc,2018-02-04,2018-01-30,20,10,Kat Cunning,28256,105,15,12,False,False,2,True,Kat Cunning - Wild Poppies [Official Video],kat cunning|wild poppies|baby,The official video for Kat Cunning's Wild Poppies. \n\nListen to Wild Poppies on Spotify: http://spoti.fi/2A6ZWcm\nWatch Wild Poppies on Apple Music: https://apple.co/2njXzLl\n\nSubscribe: http://youtube.com/katrinacunningham \n\nConnect with Kat:\nhttp://instagram.com/katcunning\nhttp://twitter.com/katcunningmusic\nhttp://facebook.com/katcunningmusic\nhttp://soundcloud.com/katcunningmusic\n\n_____________\n\nD.K.Dennison   Director & Cinematographer   \nMatilda Gaona   Director & Production Designer   \nOliver Finley    Producer\nRobbie Lemieux   Producer\nTilly Evans-Krueger Dance Captain      \nJasmine Hearn  Dancer\nMichele Lee   Dancer       \nNicholas Katen   Dancer\nRyan Redmond  Dancer\nSarah Stanley   Dancer\nSteven Trumon Gray  Dancer       \nTyler Phillips   Dancer\nEditor Name  Editor\nOmar Nasr    Gaffer\nJohn Ward    Key Grip\nColton Huynh   1st AC\nCassady Rose Bonjo  Wardrobe Supervisor     \nJessica Padilla   Makeup Artist\nNoël Jacoboni   Hairstylist & Assistant Makeup Artist   \nManana Saralidze  Assistant Makeup Artist\nMickey Vershbow 2nd AD\nHui Wei            Art Assistant\nGuillermo Barreira Driver & Production Assistant\nMatthew Thompson Production Assistant\nBrandon Herman  Production Assistant\nBrandon Boruch  Production Assistant\nAndré Vauthey  Production Assistant\nLys Obsidian   Production Assistant,3,5,28,30,3,424.0
tEnCoocmPQM,2018-02-09,2018-02-02,15,10,HalseyVEVO,6595340,308698,5220,14711,False,False,2,True,Halsey - Sorry,Halsey|Sorry|Astralwerks|(ASW)|Alternative|hopeless fountain kingdom|hfk|astralwerks|ballad|piano|sorry to my unknown lover|someone will love you|greg kurstin|sing j lee|music video|official video|halsy|love song,"listen to Sorry on Apple Music: http://www.iamhalsey.com/insidemyheadapple\nlisten to “Sorry” on Spotify: http://www.iamhalsey.com/insidemyhead\norder deluxe box set, limited edition vinyl & more in the official store: http://www.iamhalsey.com/store\norder album on iTunes: http://www.iamhalsey.com/hfkitunes\nsave hopeless fountain kingdom on Spotify: http://www.iamhalsey.com/hfkpresave\norder deluxe edition CD on Target.com: http://www.iamhalsey.com/hfktarget \norder Urban Outfitters exclusive red-splattered clear vinyl: http://www.iamhalsey.com/hfkuovinyl\n\nFollow Halsey\nhttp://iamhalsey.com\nhttp://twitter.com/halsey\nhttps://www.facebook.com/HalseyMusic\nhttp://instagram.com/iamhalsey\nInside My Head playlist: http://www.iamhalsey.com/insidemyhead\nSpotify: http://www.iamhalsey.com/spotify\nMailing list: http://www.iamhalsey.com/mailinglist\n\nDirector: Sing J Lee & Halsey\nExecutive Producer: Laura Jones @ Partizan\nProducer: Laure Salgon & Targa Sahyoun\nLine Producer, Mexico: Fuad Abed Dalton\nCinematographer: Kristof Brandl\nProduction Designer: Fernanda Guerrero\nEditor: Ryan Beck @ Final Cut\n\nColorist: Houmam Abdallah @ MPC\nVFX: Absolute Post\nSound Design: Patrick Navarre @ Barking Owl\n\nMusic video by Halsey performing Sorry. (C) 2018 Astralwerks\n\nhttp://vevo.ly/REm1hG",7,7,57,163,18,3087452.0
h33u2eeVqXo,2018-02-09,2018-02-02,3,24,Jeopardy!,816594,7290,183,1325,False,False,0,False,Talkin' Football | JEOPARDY!,Alex Trebek (TV Personality)|double jeopardy!|exclusive jeopardy|Jeopardy questions|think music|Jeopardy! best moments|tv program|Merv Griffin|Official Jeopardy!|let's play|Game Show (TV Genre)|reality games|play jeopardy|Jeopardy! (TV Program)|jeopardy!,"Our contestants know a lot, but sometimes they fumble for the correct response.\n\nSubscribe for More: http://bit.ly/JSubscribe_YT \nFind Your Station: http://bit.ly/2BIOtxc \nPlay J!6: http://bit.ly/2AtJVdT\nPlay JEOPARDY! World Tour on Google Play: https://t.co/J2P6b0JLdT \nPlay JEOPARDY! World Tour on iTunes: http://apple.co/2ASWeU1\nMore from JEOPARDY!: https://www.jeopardy.com/\n\nJEOPARDY! ON SOCIAL:\nLike JEOPARDY! on Facebook: http://bit.ly/2AuJ6kX \nFollow JEOPARDY! on Twitter: http://bit.ly/2kjdBq8 \nHeart JEOPARDY! on Instagram: http://bit.ly/2AKTpnq \n\nJEOPARDY! provides a test of knowledge across a variety of interesting subjects such as literature, history, science, the arts, and pop culture.\n\nFor the latest news and editorial features from JEOPARDY! go to https://www.jeopardy.com/jbuzz/ \n\nABOUT JEOPARDY!\n\nJEOPARDY!, America’s Favorite Quiz Show®, and its host, Alex Trebek, began their 34th season in syndication on September 11, 2017. With 23 million viewers each week, JEOPARDY! is the top-rated quiz show on television, and has won many awards and distinctions over the course of its 30+ years on the air, including the 2017 Emmy for Outstanding Game Show. The show holds a Guinness World Records® record for the most Emmy® Awards won by a TV game show (34 Emmys). In 2014, JEOPARDY! won the inaugural Writers Guild of America award for Outstanding Writing for a Quiz and Audience Participation Show; it is also the recipient of a 2011 Peabody Award. JEOPARDY! is produced by Sony Pictures Television, a Sony Pictures Entertainment Company; it is distributed domestically by CBS Television Distribution and internationally by CBS Television International, both units of CBS Corp.",7,7,2,30,15,12873.0
v0TiqC_C8wI,2018-02-06,2018-02-02,5,23,Late Night with Seth Meyers,562298,9988,398,901,False,False,4,True,Seth and Kelly Clarkson Go Day Drinking,Late Night|Seth Meyers|Seth and Kelly|Go Day Drinking|NBC|NBC TV|television|funny|talk show|comedy|humor|stand-up|parody|snl seth meyers|host|promo|seth|meyers|weekend update|news satire|satire|Kelly Clarkson|pop|Stronger|Breakaway|alcohol|bars|Since U Been Gone|Because of You|Already Gone,"Seth and Kelly Clarkson spend a day drinking at the Top of the Standard, where they do things like make a drink called The Blake Shelton, take Trump's cognitive test and drunkenly sing Since U Been Gone.\n» Subscribe to Late Night: http://bit.ly/LateNightSeth\n» Get more Late Night with Seth Meyers: http://www.nbc.com/late-night-with-seth-meyers/\n» Watch Late Night with Seth Meyers Weeknights 12:35/11:35c on NBC.\n\nLATE NIGHT ON SOCIAL\nFollow Late Night on Twitter: https://twitter.com/LateNightSeth\nLike Late Night on Facebook: https://www.facebook.com/LateNightSeth\nFind Late Night on Tumblr: http://latenightseth.tumblr.com/\nConnect with Late Night on Google+: https://plus.google.com/+LateNightSeth/videos\n\nLate Night with Seth Meyers on YouTube features A-list celebrity guests, memorable comedy, and topical monologue jokes.\n\nNBC ON SOCIAL \nLike NBC: http://Facebook.com/NBC\nFollow NBC: http://Twitter.com/NBC\nNBC Tumblr: http://NBCtv.tumblr.com/\nNBC Pinterest: http://Pinterest.com/NBCtv/\nNBC Google+: https://plus.google.com/+NBC\nYouTube: http://www.youtube.com/nbc\nNBC Instagram: http://instagram.com/nbctv\n\nSeth and Kelly Go Day Drinking- Late Night with Seth Meyers\nhttps://youtu.be/v0TiqC_C8wI\n\n\nLate Night with Seth Meyers\nhttp://www.youtube.com/user/latenightseth",4,4,488,2306,30,1968678.0
SDGHRQyZKes,2018-02-05,2018-02-02,13,23,The Tonight Show Starring Jimmy Fallon,669789,15530,311,592,False,False,3,True,Sam Smith Will Only Do Karaoke to Fifth Harmony,The Tonight Show|Jimmy Fallon|Sam Smith|Karaoke|Fifth Harmony|NBC|NBC TV|Television|Funny|Talk Show|comedic|humor|snl|Fallon Stand-up|Fallon monologue|tonight|show|jokes|funny video|interview|variety|comedy sketches|talent|celebrities|video|clip|highlight|lay me down|stay with me|soul|pop|Writing's On The Wall|Spectre|The Thrill of It All|In the Lonely Hour,"Sam Smith chats about a wild night in Sydney, Australia, explains why karaoke doesn't work for him and admits Jimmy made him never want to sing Money on My Mind again.\n\nSubscribe NOW to The Tonight Show Starring Jimmy Fallon: http://bit.ly/1nwT1aN\n\nWatch The Tonight Show Starring Jimmy Fallon Weeknights 11:35/10:35c\nGet more Jimmy Fallon: \nFollow Jimmy: http://Twitter.com/JimmyFallon\nLike Jimmy: https://Facebook.com/JimmyFallon\n\nGet more The Tonight Show Starring Jimmy Fallon: \nFollow The Tonight Show: http://Twitter.com/FallonTonight\nLike The Tonight Show: https://Facebook.com/FallonTonight\nThe Tonight Show Tumblr: http://fallontonight.tumblr.com/\n\nGet more NBC: \nNBC YouTube: http://bit.ly/1dM1qBH\nLike NBC: http://Facebook.com/NBC\nFollow NBC: http://Twitter.com/NBC\nNBC Tumblr: http://nbctv.tumblr.com/\nNBC Google+: https://plus.google.com/+NBC/posts\n\nThe Tonight Show Starring Jimmy Fallon features hilarious highlights from the show including: comedy sketches, music parodies, celebrity interviews, ridiculous games, and, of course, Jimmy's Thank You Notes and hashtags! You'll also find behind the scenes videos and other great web exclusives.\n\nSam Smith Will Only Do Karaoke to Fifth Harmony\nhttp://www.youtube.com/fallontonight",3,3,488,2972,35,15769455.0
uz_JyfyowQE,2018-02-08,2018-02-02,2,20,Kotaku,131055,1689,216,508,False,False,3,True,Nintendo Labo: Hands-On,Kotaku|video game|Nintendo Labo|Labo|Hands-on with Labo|Labo demonstration|Labo Bike|Labo House|Labo Robot|Nintendo|Labo piano|What Is Nintendo Labo|Nintendo Switch|Nintendo Cardboard|Nintendo Contraptions|When is Is Nintendo Labo released|2018 Nintendo|low-tech|Nintendo Next|New Nintendo|Labo Hands On,"We went hands-on with 4 of the different cardboard constructs for Nintendo Labo: the house, the robot, the piano, and the bike. \n\nYou can read a lot more about our hands-on with Labo here: https://kotaku.com/we-tried-nintendo-labo-and-mostly-like-it-a-lot-1822648626",6,6,20,68,21,265701.0
-WedqN1iYbM,2018-02-07,2018-02-01,18,10,Beats 1 Radio,49638,633,19,58,False,False,3,True,Justin Timberlake and Zane Lowe on Beats 1 [Part 2],Justin Timberlake|Zane Lowe|Beats 1|Apple Music|Man of the Woods|Super Bowl|Beats Radio|Ebro Darden|Julie Adenuga|Matt Wilkinson|music interviews|apple|appl|beats by dre|Ebro|pop|hip hop|indie|grime|afrobeats|Say Some Thing,"Justin Timberlake's album 'Man of the Woods' is out Friday. He tells Zane Lowe about the project, the Super Bowl Halftime Show and family. Get the album here: http://apple.co/B1MOTW\n\nHear more on Apple Music. Cancel anytime: http://apple.co/Trial\nExplore Beats 1 for free: http://apple.co/B1\n\nAbout Beats 1:\nWorldwide. Always on. Listen for free on Apple Music or on demand with a subscription. \nSubscribe on YouTube: https://apple.co/B1YouTube\nFollow Beats 1 on Instagram: https://apple.co/B1Instagram\nFollow Beats 1 on Twitter : https://apple.co/B1Twitter\nLIKE Beats 1 on Facebook: https://apple.co/B1Facebook\nTumblr: https://apple.co/B1Tumblr\n\nAbout Apple Music:\nListen to over 45 million songs, online or off, totally ad-free. Plus create and share your own playlists, get exclusive content and personalized recommendations, and stream radio stations with unlimited skips. \nFollow Apple Music  on Instagram: http://apple.co/AMInstagram\nFollow Apple Music on Twitter: https://apple.co/AMTwitter\nLIKE Apple Music on Facebook: http://apple.co/AMFacebook\n\nJustin Timberlake and Zane Lowe on Beats 1 [Part 2]\nhttps://www.youtube.com/user/officialbeatsmusictv",5,6,124,319,21,172987.0
QS8bma7LRX4,2018-02-04,2018-02-04,5,24,Saturday Night Live,39720,4800,165,530,False,False,1,True,Natalie's 2nd Rap - SNL,SNL|Saturday Night Live|SNL Season 43|Episode 1738|Natalie Portman|Beck Bennett|Andy Samberg|s43|s43e13|episode 13|live|new york|comedy|sketch|funny|hilarious|late night|host|music|guest|laugh|impersonation|actor|improv|musician|natalie portman|natalie raps|black swan|jackie|annihilation|the death and life of john f. donovan|thor|dua lipa|new rules|be the one|scared to be lonely,Natalie Portman shares what's new in her life.\n\n#SNL #SNL43\n\nGet more SNL: http://www.nbc.com/saturday-night-live\nFull Episodes: http://www.nbc.com/saturday-night-liv...\n\nLike SNL: https://www.facebook.com/snl\nFollow SNL: https://twitter.com/nbcsnl\nSNL Tumblr: http://nbcsnl.tumblr.com/\nSNL Instagram: http://instagram.com/nbcsnl \nSNL Pinterest: http://www.pinterest.com/nbcsnl/,1,0,488,2013,36,5292034.0
