video_id,last_trending_date,publish_date,publish_hour,category_id,channel_title,views,likes,dislikes,comment_count,comments_disabled,ratings_disabled,tag_appeared_in_title_count,tag_appeared_in_title,title,tags,description,trend_day_count,trend.publish.diff,trend_tag_highest,trend_tag_total,tags_count,subscriber
3yt4JsB9psg,2017-12-11,2017-12-06,14,25,MSNBC,162868,1966,933,1055,False,False,5,True,Time Names Its 2017 Person Of The Year: Silence Breakers | Morning Joe | MSNBC,Morning Joe|Joe Scarborough|Mika Brzezinski|Willie Geist|MSNBC|MSNBC news|MSNBC live|MSNBC TV|news|breaking news|current events|US news|politics|politics news|political news|elections|time 2017 person of the year silence breakers|time magazine|assault|harassment|violence against women|time|sexual harassment|person of the year|harvey weinstein|me too|#metoo|time person of the year 2017|silence breakers|rose mcgowan|time person of the year,"Time Magazine has announced its 2017 Person of the Year is the 'Silence Breakers,' the ones 'giving voice to open secrets.' Included in the list are Ashley Judd, Taylor Swift, Uber engineer Susan Fowler and more.\n\n» Subscribe to MSNBC: http://on.msnbc.com/SubscribeTomsnbc\n\nAbout: MSNBC is the premier destination for in-depth analysis of daily headlines, insightful political commentary and informed perspectives. Reaching more than 95 million households worldwide, MSNBC offers a full schedule of live news coverage, political opinions and award-winning documentary programming -- 24 hours a day, 7 days a week.\n\nConnect with MSNBC Online\nVisit msnbc.com: http://on.msnbc.com/Readmsnbc\nFind MSNBC on Facebook: http://on.msnbc.com/Likemsnbc\nFollow MSNBC on Twitter: http://on.msnbc.com/Followmsnbc\nFollow MSNBC on Google+: http://on.msnbc.com/Plusmsnbc\nFollow MSNBC on Instagram: http://on.msnbc.com/Instamsnbc\nFollow MSNBC on Tumblr: http://on.msnbc.com/LeanWithmsnbc\n\nTime Names Its 2017 Person Of The Year: Silence Breakers | Morning Joe | MSNBC",4,5,183,577,31,791390.0
3L_a9HxXzS0,2017-12-12,2017-12-06,18,10,melodysheep,36535,2773,38,161,False,False,3,True,THE FORCE:  A musical tribute to Princess Leia,princess|leia|carrie|fisher|remix|tribute|song|melodysheep|john|boswell|star|wars,"A superchill tribute to Carrie Fisher, the galaxy's favorite princess.  Rest in Peace.",5,6,34,119,12,376970.0
vn9mMeWcgoM,2017-12-15,2017-12-08,1,24,Universal Pictures,38070298,550348,27824,50935,False,False,2,True,Jurassic World: Fallen Kingdom - Official Trailer [HD],Jurassic World|Fallen Kingdom|Jurassic Park|T-Rex|Dinosaur|J.A. Bayona|Steven Spielberg|Colin Trevorrow|Chris Pratt|Bryce Dallas Howard|BD Wong|James Cromwell|Ted Levine|Justice Smith|Geraldine Chaplin|Daniella Pineda|Toby Jones|Jeff Goldblum|Rafe Spall|Derek Connolly|Isla Nublar|Raptor,"Jurassic World: Fallen Kingdom\nIn Theaters June 22, 2018 \n\nhttps://www.jurassicworld.com\n\nIt’s been four years since theme park and luxury resort Jurassic World was destroyed by dinosaurs out of containment.  Isla Nublar now sits abandoned by humans while the surviving dinosaurs fend for themselves in the jungles.\n\nWhen the island’s dormant volcano begins roaring to life, Owen (Chris Pratt) and Claire (Bryce Dallas Howard) mount a campaign to rescue the remaining dinosaurs from this extinction-level event.  Owen is driven to find Blue, his lead raptor who’s still missing in the wild, and Claire has grown a respect for these creatures she now makes her mission.  Arriving on the unstable island as lava begins raining down, their expedition uncovers a conspiracy that could return our entire planet to a perilous order not seen since prehistoric times.\n\nWith all of the wonder, adventure and thrills synonymous with one of the most popular and successful series in cinema history, this all-new motion-picture event sees the return of favorite characters and dinosaurs—along with new breeds more awe-inspiring and terrifying than ever before.  Welcome to Jurassic World: Fallen Kingdom.  \n\nStars Pratt and Howard return alongside executive producers Steven Spielberg and Colin Trevorrow for Jurassic World: Fallen Kingdom.  They are joined by co-stars James Cromwell, Ted Levine, Justice Smith, Geraldine Chaplin, Daniella Pineda, Toby Jones, Rafe Spall and Isabella Sermon, while BD Wong and Jeff Goldblum reprise their roles.\n\nDirected by J.A. Bayona (The Impossible), the epic action-adventure is written by Jurassic World’s director, Trevorrow, and its co-writer, Derek Connolly.  Producers Frank Marshall and Pat Crowley once again partner with Spielberg and Trevorrow in leading the filmmakers for this stunning installment.  Belén Atienza joins the team as a producer.",7,7,11,93,22,1446544.0
Bs5Ml7_2wT0,2017-12-14,2017-12-08,8,20,thegameawards,1500852,28017,1658,1816,False,False,1,True,"The Game Awards - Full Show with Death Stranding, Zelda and More",the game awards|game awards 2017|videogame awards|video game awards|geoff keighley|game awards live|livestream|playstation|xbox|nintendo|best games of 2017|best videogames 2017|gameplay|trailers|world premiere|gaming awards|TGA|announcement,"Awards, world premieres and new game announcements -- video game's biggest night live from Los Angeles in 4K on YouTube.\n\nSubscribe Now to Watch The Game Awards: http://bit.ly/thegameawards17\n\nCelebrate the best video games, esports and gamers of 2017, and get a sneak preview of what's next. The Game Awards is the video game industry's annual awards show.\n\nFollow Geoff Keighley on Twitter: http://www.twitter.com/geoffkeighley",6,6,20,77,18,88587.0
dyBFAX4SDEc,2017-12-13,2017-12-08,2,20,Nintendo,1833398,49538,986,7122,False,False,4,True,The Legend of Zelda: Breath of the Wild - Expansion Pass: DLC Pack 2 The Champions’ Ballad Trailer,nintendo|play|play nintendo|game|gameplay|fun|video game|kids|action|adventure|rpg|nintendo switch|pro controller|joy con|awards|award show|video game awards|tga|the game awards|video game industry|game of the year|Best Game Direction|Best Art Direction|The Game Awards 2017|breath of the wild|the legend of zelda|dlc|dlc 2|the champions ballad|motorcycle|lozbotw|expansion pass|revali|mipha|urbosa|daruk|shrine|equips|kass|champions' ballad|ancient,"Revali, Mipha, Daruk, and Urbosa fell 100 years ago in an attempt to defend the homes they love. You must rise today. The next installment of The Legend of Zelda: Breath of the Wild Expansion Pass: The Champions' Ballad is here. The exhilarating adventure continues!\n\nLearn more about DLC Pack 2 The Champions’ Ballad! https://goo.gl/AZHQe3\n\n#NintendoSwitch #TheGameAwards2017 #LegendofZelda #BreathoftheWild\n\nSubscribe for more Nintendo fun! https://goo.gl/09xFdP\n\nVisit Nintendo.com for all the latest! http://www.nintendo.com/\n\nLike Nintendo on Facebook: http://www.facebook.com/Nintendo\nFollow us on Twitter: http://twitter.com/NintendoAmerica\nFollow us on Instagram: http://instagram.com/Nintendo\nFollow us on Pinterest: http://pinterest.com/Nintendo\nFollow us on Google+: http://google.com/+Nintendo",5,5,93,554,41,3766915.0
Sqbv7cCM5AI,2017-12-12,2017-12-08,15,10,Björk,462066,16375,1114,2068,False,False,1,True,björk: utopia,utopia|björk|Alternative|Indie Pop|bjork|official video|nick and warren|Warren Du Preez|Nick Thornton Jones,"the official video for utopia, taken from björk's new studio album.\n\nutopia is out now. listen here: https://bjork.lnk.to/utopiaYT\n\nVideo Credits:\n\nDirected by  Warren Du Preez and Nick Thornton Jones\n\nCreative Direction by Björk\n\nSilicone prosthetics, braid jewellery and flutes by James Merry \n\nExecutive Producer - Campbell Beaton / Immortal Productions \n\nDirector of Photography - Daniel Landin \n\nCGI Design and VFX Supervisor - Matt Chandler @ Analog\n\nChoreography - Margret Bjarnadottir\n\nProduction Designer - Heimir Sverrisson\n\nMake Up Artist - Hungry\n\nHair Stylist - Raphael Salley \n\nStylist - Edda Gudmundsdóttir\n\nFlutists costume - threeasfour \n\nProps & set decoration - Hrafnhildur Hólmgeirsdóttir\n\nWith thanks to Remi Paringaux \n\nEditor - Owen Oppenheimer @ The Quarry \n\nColourist - Jessica Vile @ Framestore \n\nGrade Producer - Chris Anthony @ Framestore\n\nOnline Producer - Matt Shannon @ Analog\n\nLead 2D retouch - Duncan Horn @ nineteentwenty\n\nAssistant 2D retouch - Rob Lilley @ nineteentwenty\n\nLead 2D Artist - Fabio Zaveti @ Analog\n\nCompositors - Igor Gama, Andre Dias, & Alessandro Melillo @ Analog\n\nLead 3D Artist - Matt Chandler @ Analog\n\n3D Artists - Maurizio De Angelis, Tim Woods, & Gustav Larsson @ Analog\n\n3D Animation - Julien Loth @ Analog\n\nTypography by M/M (Paris)\n\nConcept Drawings - Alex Noble\n\nAssistant to James Merry - Mao Alheimsdottir  \n\nFlutists -\n\nBerglind María Tómasdóttir\nBjörg Brjánsdóttir\nMelkorka Ólafsdóttir\nEmilía Rós Sigfúsdóttir\nÁshildur Haraldsdóttir\nÞuríður Jónsdóttir\nSteinunn Vala Pálsdóttir\nDagný Marinósdóttir\nSigríður Hjördís Indriðadóttir\nSólveig Magnúsdóttir\nHafdís Vigfúsdóttir\n\nKimono Co-ordinator - Kenshi Ohkubo\n\nKimono Stylist - Chiaki Ruri\n\nIceland Service Producer - Rafnar Hermannsson @ TruNorth\n\nEdit Producer - Charlie Morris\n\nUK Production Manager - Sam Jackson\n\nIceland Co-ordinator - Gudrun L Magnusdottir\n1st AD - Gagga JonsDottir\n1 AC - Snorri Fairweather\n2 AC - Brynja Dogg Fridriksdottir\nKey Grip - Sigurgeir Thordarsson\nCrane Tech - Viktor David Johannsson\nGaffer - Finnur Thor Gudjonsson\n\nBest Boy - Valdmar Johannsson\n\nElectricians - Maria Run Johannsdottir & Eythor Ingvarsson\n\nDimmer Board Op - Agnar Hermannsson\n\nSet Decorator - Hrafnhildur Holmgeirsdottir\n\nProps - Victor Petur\n\nVTR - Rutur Skaeringur\n\nCatering - Erla Asmundsdottir\n\nKey PA - Tindur Karasson\n\nRunner - Thelma Torfadottir\nLead Hair assistant - Sigurbjorg Iris Holmgeirsdottir\nHair Assistants - Audur Birna Gudnadottir & Kristofer Thorri Haraldsson\n\nLead MU asttstant - Frida Maria Hardardottir\n\nMU assistants - Flors Karitas Bueno & Sigrun Sig\n\n\n\nclick here to subscribe to the official björk channel: http://bit.ly/subscribetobjork\n\nhttp://www.bjork.com/\nhttps://www.facebook.com/bjork\nhttps://twitter.com/bjork",4,4,43,92,9,238394.0
8KaKWPJq5dY,2017-12-14,2017-12-07,23,20,DanAndPhilGAMES,722812,86588,272,7927,False,False,7,True,OUR SECRET FAN FICTIONS?! - Truth Bombs #2!,dan and phil|dan and phil games|danisnotonfire|amazingphil|phil lester|dan howell|gaming channel|games|truth bombs|truth|bombs|board game|board|game|pj|kickthepj|sophie|our secret fan fictions|tiny|macro|uncle|dan|internet support group|secret|fan|fiction|wattpad|funny|best|2017|table|top|tabletop|card|party|christmas|gift|family|banter|roasting|youtuber|play|booster|pack|expansion|big|potato|shop|awkward|moments|forever,Buy Truth Bombs to play for Christmas!!\nUK: http://amzn.to/2gp3QVO USA: http://amzn.to/2AEkwhL\nGet the Dan and Phil themed booster pack: UK - https://www.danandphilshop.com/collections/books/products/truth-bombs-booster-pack\nUSA - https://us.danandphilshop.com/collections/books/products/truth-bombs-booster-pack\n\nSubscribe for a free tiny Phil: http://www.youtube.com/subscription_center?add_user=DanAndPhilGAMES\n\nOur glamorous guests:\n\nhttp://youtube.com/kickthepj\nhttp://twitter.com/kickthepj\nhttps://youtube.com/SophieIsOdd\nhttp://twitter.com/SophieNewt\n\nDAN\nVideos: http://youtube.com/danisnotonfire\nTwitter: http://twitter.com/danielhowell\nInstagram: http://instagram.com/danielhowell\nTumblr: http://danielhowell.tumblr.com\nFacebook: http://facebook.com/danisnotonfire\nMerch: http://danandphilshop.com \n\nPHIL\nVideos: http://youtube.com/AmazingPhil\nTwitter: http://twitter.com/AmazingPhil\nTumblr: http://AmazingPhil.tumblr.com\nFacebook: http://facebook.com/AmazingPhil\nInstagram: http://instagram.com/AmazingPhil\nMerch: http://danandphilshop.com,6,7,488,1338,51,3102660.0
LiXQFixzqJ4,2017-12-12,2017-12-06,21,1,SR Trailers and Interviews,33459,634,7,117,False,False,4,True,Star Wars: The Last Jedi Interview - Adam Driver,movies|star wars|last jedi|adam driver|kylo ren|interview|screen rant,We interview Star Wars: The Last Jedi star Adam Driver about his role in the film.\n\nhttp://screenrant.com/\nhttps://www.facebook.com/ScreenRant\nhttps://twitter.com/screenrant,4,6,165,364,7,0.0
PXWlnc-Qcwg,2017-12-09,2017-11-18,17,22,CIRCUITBEARD,3114,14,0,4,False,False,2,True,Google AIY Robot Conversion,raspberrypi|tomy|hardwarehacks|retro|80s|electronics|robot|googleaiy|ai,Turned an 80s Tomy Mr Money into a little Google AIY / Raspberry Pi based assistant.,1,21,18,55,9,221.0
bo8OYPYRTIY,2017-12-15,2017-12-09,17,23,Awkward Puppets,645532,32580,527,2553,False,False,14,True,Hailee Steinfeld Won't Let Me Go | Awkward Puppets,hailee steinfeld wont let me go|awkward|puppets|hailee|steinfeld|wont|let|me|go|best floyd mayweather interview|how to be honest|i am diego new album coming soon official trailer|lelepons|hannahstocking|rudymancuso|inanna|anwar|sarkis|shots|shotsstudios|alesso|anitta|awkward puppets|awkwardpuppets|diegoshow|Hailee Steinfeld Won't Let Me Go|Hailee|Steinfeld|Won't|Let|Me|Go|Let Me Go|Alesso|Florida Georgia Line|watt,Let Me Go (Spotify) ► http://spoti.fi/2iFNEgj\n\nLet Me Go (Apple Music) ► http://apple.co/2y8FWR7\n\nLet Me Go (Everywhere) ► https://republic.lnk.to/LetMeGoYD\n\nSUBSCRIBE ► http://youtube.com/channel/UCQG4cX86zZ51IU2cerZgPSA?sub_confirmation=1\n\nOUR LAST VIDEO ► https://youtu.be/CsdzflTXBVQ\n\nTHANKS FOR WATCHING! :) LIKE & SUBSCRIBE FOR MORE VIDEOS!\n--------------------------------------------------------------------\n\nFIND US ON:\nInstagram | http://instagram.com/awkwardpuppets\nTwitter | http://twitter.com/awkwardpuppets\nVine | http://vine.co/awkwardpuppets\n\nHAILEE STEINFELD:\nInstagram | https://instagram.com/haileesteinfeld\nSpotify | http://spoti.fi/2AIZYqc\nTwitter | https://twitter.com/haileesteinfeld\nFacebook | https://facebook.com/haileesteinfeld\n\nVOICES: \nDiego | Rudy Mancuso http://youtube.com/rudymancuso\nSam | Rudy Mancuso http://youtube.com/rudymancuso\nBenita | Lele Pons http://youtube.com/lelepons\nTwon | King Bach http://youtube.com/channel/UCC8GmS2p3YZq8-RO8sU6fJg\nSarah | Maia Mitchell http://instagram.com/maiamitchell\nCarl & Carl | Lucas Bros http://twitter.com/lucasbros\n\nShots Studios Channels:\nAlesso | https://youtube.com/c/alesso\nAnitta | http://youtube.com/c/anitta\nAnwar Jibawi | http://youtube.com/c/anwar\nAwkward Puppets | http://youtube.com/c/awkwardpuppets\nHannah Stocking | http://youtube.com/c/hannahstocking\nInanna Sarkis | http://youtube.com/c/inanna\nLele Pons | http://youtube.com/c/lelepons\nMaejor | http://youtube.com/c/maejor\nMike Tyson | http://youtube.com/c/miketyson\nRudy Mancuso | http://youtube.com/c/rudymancuso\nShots Studios | http://youtube.com/c/shots\n\n#Awkward\n#AwkwardPuppets\n#Diego\n#HaileeSteinfeld,6,6,30,411,36,709409.0
mQ8sFRuDyiU,2017-12-14,2017-12-08,16,24,The Unipiper,100896,2618,82,161,False,False,0,False,How to Take Out AT-ATs - EASY METHOD EXPLAINED!!,Unipiper|Portlandia|Keep Portland Weird|Unicycle|Bagpipes|portland|oregon|star wars|the last jedi|AT-AT|hoth|luke skywalker,unipiper@gmail.com\n\nhttp://www.unipiper.com\n\n\nhttp://www.facebook.com/theunipiper\n\nOfficial Unipiper Store - get t-shirts and more!!!! http://www.unipiper.com/shop,5,6,73,149,12,17190.0
cSp1dM2Vj48,2017-12-13,2017-12-10,18,24,Warner Bros. Pictures,9523267,154281,7854,29706,False,False,1,True,READY PLAYER ONE - Official Trailer 1 [HD],ready player one|ready player one movie|rpo|rp1 movie|ernest cline|tye sheridan|steven spielberg|dan farah|olivia cooke|oasis|vr|vr goggles|virtual reality|avatar|avatar creator|gunter|anorak|anorak's announcement|james halliday|jade key|copper key|crystal key|quest|sci-fi|simon pegg|tj miller|warner bros pictures|wb pictures|wb|amblin entertainment,"http://readyplayeronemovie.com\nhttp://facebook.com/readyplayerone\nhttp://twitter.com/readyplayerone\nhttp://instagram.com/readyplayerone\n\n-- \n\nFrom filmmaker Steven Spielberg comes the science fiction action adventure “Ready Player One,” based on Ernest Cline’s bestseller of the same name, which has become a worldwide phenomenon.  \n\nThe film is set in 2045, with the world on the brink of chaos and collapse.  But the people have found salvation in the OASIS, an expansive virtual reality universe created by the brilliant and eccentric James Halliday (Mark Rylance).  When Halliday dies, he leaves his immense fortune to the first person to find a digital Easter egg he has hidden somewhere in the OASIS, sparking a contest that grips the entire world.  When an unlikely young hero named Wade Watts (Tye Sheridan) decides to join the contest, he is hurled into a breakneck, reality-bending treasure hunt through a fantastical universe of mystery, discovery and danger.\n\nSpielberg directed the film from a screenplay by Zak Penn and Ernest Cline.  The film was produced by Donald De Line, Spielberg, Kristie Macosko Krieger and Dan Farah; with Adam Somner, Daniel Lupi, Chris deFaria and Bruce Berman serving as executive producers.  \n\n“Ready Player One” stars Tye Sheridan (“X-Men: Apocalypse,” “Mud”), Olivia Cooke (“Me and Earl and the Dying Girl,” “Bates Motel”), Ben Mendelsohn (“Rogue One – A Star Wars Story,” “Bloodline”) and T.J. Miller (“Deadpool,” “Silicon Valley”), with Simon Pegg (the “Star Trek” movies, the “Mission: Impossible” movies) and Oscar winner Mark Rylance (“Bridge of Spies,” “Dunkirk”).  \n\nBehind the scenes, three-time Oscar winner Spielberg (“Schindler’s List,” “Saving Private Ryan”) reunited his creative team from “Bridge of Spies,” including Oscar-winning director of photography Janusz Kaminski (“Schindler’s List,” “Saving Private Ryan”), Oscar-winning production designer Adam Stockhausen (“The Grand Budapest Hotel”), Oscar-winning editor Michael Kahn (“Saving Private Ryan,” “Raiders of the Lost Ark”) and Sarah Broshar (“The Post”), and costume designer Kasia Walicka-Maimone (“Moonrise Kingdom”).  The music is by Oscar-nominated composer Alan Silvestri (the “Back to the Future” films, “Forrest Gump”).\n\nWarner Bros. Pictures and Amblin Entertainment present, in association with Village Roadshow Pictures, an Amblin Production, a De Line Pictures Production, a Steven Spielberg Film, “Ready Player One.”\n\nSlated for release on March 30, 2018, the film will be distributed by Warner Bros. Pictures, a Warner Bros. Entertainment Company, and in select territories by Village Roadshow Pictures.",3,3,20,155,30,5029965.0
X3gKYTc6lbw,2017-12-13,2017-12-09,23,23,jacksfilms,1119418,59772,1035,6734,False,False,2,True,INFINITY WAR QUOTES (YIAY #382),jacksfilms|yiay|thanos|infinity war|avengers|marvel|ironman|iron man|thor|captain america|film|movie,"Use my code, JACK, or go to http://www.daily-harvest.com/jack  to get 3 FREE SOUPS!\nPREVIOUS YIAY ► https://www.youtube.com/watch?v=BOZngVYS04s&index=1&list=PLiWL8lZPZ2_k1JH6urJ_H7HzH9etwmn7M\nSUBSCRIBE ► http://bit.ly/1A0Crdb\nMERCH ► http://www.crowdmade.com/collections/jacksfilms\nTWITTER ► http://www.twitter.com/jacksfilms\nLIVE CHAT ► http://www.younow.com/jacksfilms\nSNAPCHAT ► realjacksfilms\nFACEBOOK ► http://www.facebook.com/jacksfilmsfans",3,4,98,285,12,3947725.0
QsLmJq8cHlA,2017-12-13,2017-12-09,20,24,IGN,508137,15166,479,608,False,False,1,True,James Franco Reads Bad Video Game Lines as Tommy Wiseau - Up At Noon Live!,PC|DC|IGN|PS3|PS4|GBC|SEGA|Vita|movie|games|Comedy|Capcom|Switch|Konami|Wii U|Shenmue|Destiny|Nintendo|Fighting|Xbox One|Xbox 360|Activision|Fallout 4|James Franco|Resident Evil|Mortal Kombat|Bungie Software|The Disaster Artist|Bethesda Softworks|NetherRealm Studios|Super Mario 3D World|Bethesda Game Studios,We asked James Franco to recite some iconic lines from video games.  The results are magical.\n\nWatch the full episode here!\nhttps://www.youtube.com/watch?v=WsjZC6SzXYA\n\nSubscribe to IGN for more!\nhttp://www.youtube.com/user/IGNentertainment?sub_confirmation=1\n\n------------------------------­----\nFollow IGN for more!\n------------------------------­----\n\nYOUTUBE: https://www.youtube.com/user/ignentertainment?sub_confirmation=1\nIGN OFFICIAL APP: http://www.ign.com/mobile\nFACEBOOK: https://www.facebook.com/ign\nTWITTER: https://twitter.com/ign\nINSTAGRAM: https://instagram.com/igndotcom/?hl=en\nWEBSITE: http://www.ign.com/\nGOOGLE+: https://plus.google.com/+IGN,3,4,441,750,32,9401388.0
r3d2alzgjKc,2017-12-13,2017-12-04,14,28,dekuNukem,1638,7,1,1,False,False,1,True,exixe clock in action,STM32|exixe|nixie tube|nixie|hardware|arduino|gps|gnss|raspberry pi|hacker|IN-14|IN-12,https://github.com/dekuNukem/exixe\nhttps://github.com/dekuNukem/exixe_clock,3,9,17,33,12,5135.0
UH0nTHb6OdY,2017-12-15,2017-12-11,18,24,WIRED,3313280,80589,2549,11178,False,False,5,True,The Last Jedi Cast Answers the Web's Most Searched Questions | WIRED,autocomplete|autocomplete interview|finn|john boyega|laura dern|mark hamill|star wars|wired autocomplete interview|last jedi cast|star wars cast|star wars the last jedi|kelly marie tran|the last jedi|the last jedi cast|the last jedi autocomplete|the last jedi wired|mark hamill interview|mark hamill autocomplete|luke skywalker|mark hamill joker|joker voice|last jedi autocomplete|daisy ridley|starwars|jed|wired|wired.com,"Star Wars: The Last Jedi stars Mark Hamill, Laura Dern, John Boyega, Daisy Ridley, Domhnall Gleeson and Kelly Marie Tran take the WIRED Autocomplete Interview and answer the Internet's most searched questions about Star Wars and themselves. Can Jedi choose their lightsaber color? Is General Hux Luke's son? Is Mark Hamill related to Dorothy Hamill?\n\nStill haven’t subscribed to WIRED on YouTube? ►► http://wrd.cm/15fP7B7 
\n
\n
\nABOUT WIRED
\nWIRED is where tomorrow is realized. Through thought-provoking stories and videos, WIRED explores the future of business, innovation, and culture.\n\nThe Last Jedi Cast Answers the Web's Most Searched Questions | WIRED",4,4,73,292,27,1866109.0
3UoKswz6OQc,2017-12-17,2017-12-11,3,24,amc,515555,5599,1064,4856,False,False,3,True,(SPOILERS) Mid-Season Finale Talked About Scene | The Walking Dead,The Walking Dead|12/10_TWD|Featured|sewers|bite|bitten|mid-season finale|finale|zombies|all out war|war|walkers|the kingdom|the saviors|Rick|Rick Grimes|Negan|Ezekiel|Daryl|Michonne|Morgan|Carl|Dwight|Jeffrey Dean Morgan|Andrew Lincoln|Norman Reedus|Danai Gurira|Lennie James|robert kirkman|scott m. gimple|apocalypse|season|season 8|alexandria|AMC|tv|tv show|television,"Rick reunites with Carl and the others in the sewers below Alexandria. \n\n#TheWalkingDead #TWD #AllOutWar\n\nFor more The Walking Dead videos: http://goo.gl/qJOZ6n\n\n(SPOILERS) Talked About Scene from The Walking Dead: Season 8, Episode 8\n\nSubscribe to the AMC YouTube Channel : http://goo.gl/qSMzej\nThe Walking Dead: https://goo.gl/jzTTCb\nSign Up for the The Walking Dead Newsletter : http://www.amc.com/shows/the-walking-dead/exclusives/newsletter-subscription\nThe Walking Dead on Facebook: https://www.facebook.com/TheWalkingDeadAMC/ \nThe Walking Dead on Twitter: https://twitter.com/WalkingDead_AMC \nSign Up for the AMC Newsletter : http://www.amc.com/newsletter-subscription\nAMC : http://www.amc.com/\nAMC on Facebook : https://www.facebook.com/amc\nAMC on Twitter : http://twitter.com/AMC_TV",6,6,150,399,38,657573.0
