video_id,last_trending_date,publish_date,publish_hour,category_id,channel_title,views,likes,dislikes,comment_count,comments_disabled,ratings_disabled,tag_appeared_in_title_count,tag_appeared_in_title,title,tags,description,trend_day_count,trend.publish.diff,trend_tag_highest,trend_tag_total,tags_count,subscriber
-p2lhxUqMMQ,2018-02-02,2018-01-27,18,27,Extra Credits,398058,17874,257,1831,False,False,4,True,Cheng I Sao - Pirate Queen - Extra History,extra history|extra credits|james portnow|daniel floyd|history|documentary|study|educational|history lesson|world history|extra credits history|study history|learn history|chinese history|chinese pirates|pirate queen|cheng i sao|opium wars|pirate confederation|cheng the first|cheung po|real life pirates|china pirates|bai ling|madam cheng|cheng shih|female pirates|women pirates,"She was the most ferocious pirate China had ever known. She was a powerful fleet commander, a sharp businesswoman, and a consummate strategist. She was Cheng I Sao, leader of the Pirate Confederation, and she lived her life on her terms.\nCORRECTION: This episode's script is brought to you by Rob Rath!\nSupport us on Patreon! http://bit.ly/EHPatreon (--More below)\n\nGrab your Extra Credits gear at the store! http://bit.ly/ExtraStore\nSubscribe for new episodes every Saturday! http://bit.ly/SubToEC\n\nPlay games with us on Extra Play! http://bit.ly/WatchEXP\n\nTalk to us on Twitter (@ExtraCreditz): http://bit.ly/ECTweet\nFollow us on Facebook: http://bit.ly/ECFBPage\nGet our list of recommended games on Steam: http://bit.ly/ECCurator\n____________\n\n♪ Get the intro music here!\nhttp://bit.ly/1EQA5N7\n   *Music by Demetori: http://bit.ly/1AaJG4H\n\n♪ Get the outro music here!\nhttp://bit.ly/23isQfx\n   *Music by Sean and Dean Kiner: http://bit.ly/1WdBhnm",6,6,91,189,28,1374020.0
JqIkzS2wSz8,2018-02-01,2018-01-26,15,24,Popcorn with Peter Travers,112034,3970,36,470,False,False,3,True,'Call Me by Your Name' star Timothee Chalamet on the time he embarrassed himself with Saoirse Ronan,Call me by your name|Armie Hammer|Timothee chalamet|Saoirse Ronan|Oscar nominee|Oscars|Academy Awards,The Oscar-nominated star of Call Me by Your Name talks about his plan for longevity and working with Saoirse Ronan in Lady Bird on ABC News' Popcorn With Peter Travers.,5,6,19,60,7,16391.0
7YibRBd46oo,2018-01-29,2018-01-29,2,24,The Late Late Show with James Corden,27666,1606,131,146,False,False,3,True,James Corden Leads 'Subway Karaoke' During The 2018 GRAMMY Awards,grammy|grammys|grammy awards|grammy award|music|the grammys|Tyler Oakley|grammy winners|music videos|music clips|music video|top songs|pop music|top music|all music|music search|bands|band|singers|musician|music news|grammies|grammy award winners|grammys winners|red carpet|fashion|carpet|red dresses|red carpet dresses”|celebrity dresses|grammy red carpet|dress|dresses|celebrity|CBS|news,"GRAMMY Awards host James Corden invites Sting and Shaggy for a New York-edition of Carpool Karaoke on the subway and the trio learns New York City audiences can be pretty tough, even the GRAMMYs.",1,0,183,941,36,13608050.0
IIyZuKN2j7U,2018-02-03,2018-01-28,5,10,Billboard,522522,9297,1216,3415,False,False,4,True,"Cardi B Talks Grammy Nomination, JAY-Z, Engagement at Clive Davis' Pre-Grammy Gala | Billboard",Billboard|billboard channel|official|billboard magazine|music|official billboard channel|cardi b|grammys|interviews|Grammys 2018|Grammy Awards|Grammy Award Show|Grammy Red Carpet|Grammy Red Carpet 2018|clive davis|Clive Davis' Pre-Grammy Gala|pre-grammy gala|offset|cardi|cardi b interview|bodak yellow|cardi b bodak yellow|bodak yellow cardi b|jay-z|chelsea briggs|2018,"Subscribe for The Latest Hot 100 Charts & ALL Music News! ►► https://bitly.com/BillboardSub\nBillboard News: New Channel, Same Awesome ►► http://bit.ly/DailyMusicNews\n\nCardi B discusses being nominated for a Grammy, her engagement to Offset and her favorite JAY-Z track at Clive Davis' Pre-Grammy Gala 2018.\n\nVisit our website for the latest charts and all things music: https://www.billboard.com/\nLike us on Facebook: https://www.facebook.com/Billboard\nFollow us on Twitter: https://twitter.com/billboard \nFollow us on Instagram: https://www.instagram.com/billboard/",6,6,171,543,26,1315462.0
S_HixQBiVH0,2018-02-04,2018-01-29,2,24,CBS,30066,486,92,88,False,False,0,False,"John Legend And Tony Bennett Sing 'New York, New York'",grammy|grammys|grammy awards|grammy award|music|the grammys|Tyler Oakley|grammy winners|music videos|music clips|music video|top songs|pop music|top music|all music|music search|bands|band|singers|musician|music news|grammies|grammy award winners|grammys winners|red carpet|fashion|carpet|red dresses|red carpet dresses”|celebrity dresses|grammy red carpet|dress|dresses|celebrity|CBS|news,The duo does an impromptu duet before announcing the award for Best Rap/Sung Performance. Stream the 60th Annual GRAMMY Awards on CBS All Access.,7,6,183,941,36,927345.0
xJrOUJpCxOE,2018-02-02,2018-01-26,18,23,Lele Pons,7418792,324091,14954,13461,False,False,9,True,Dating the Popular Guy | Lele Pons,dating the popular guy|lele|pons|dating|the|popular|guy|im a baby|worst fortune teller ever|spying on your boyfriend|Dating the Popular Guy | Lele Pons|lelepons|hannahstocking|rudymancuso|inanna|anwar|sarkis|shots|shotsstudios|alesso|anitta|brazil,WATCH MY PREVIOUS VIDEO ▶ https://youtu.be/g9_DMwbPzxw\n\nSUBSCRIBE HERE ▶ http://www.youtube.com/channel/UCi9cDo6239RAzPpBZO9y5SA?sub_confirmation=1\n\nTHANKS FOR WATCHING! :) LIKE & SUBSCRIBE FOR MORE VIDEOS!\n-----------------------------------------------------------\nFIND ME ON:\nInstagram | http://instagram.com/lelepons\nTwitter | http://twitter.com/lelepons\nFacebook | http://facebook.com/lele\nSnapchat | http://snapchat.com/add/lelepons \n\nCAST: \nLele Pons | http://youtube.com/c/lelepons\nTwan Kuyper | https://instagram.com/twan\nGabriel Zamora | https://instagram.com/gabrielzamora\nChas Laughlin | https://instagram.com/chaslaughlinoutloud\nKrystaalized | https://instagram.com/krystaalized\nTonio Skits | https://youtube.com/user/TonioSkits\nIsabella Thomas | https://instagram.com/isabellajunethomas\nCharlotte Bowles | https://instagram.com/cbcbowles\nVictoria Vanna | https://instagram.com/victoriavanna\n\n\nShots Studios Channels:\nAlesso | https://youtube.com/c/alesso\nAnitta | http://youtube.com/c/anitta\nAnwar Jibawi | http://youtube.com/c/anwar\nAwkward Puppets | http://youtube.com/c/awkwardpuppets\nHannah Stocking | http://youtube.com/c/hannahstocking\nInanna Sarkis | http://youtube.com/c/inanna\nLele Pons | http://youtube.com/c/lelepons\nMaejor | http://youtube.com/c/maejor\nMike Tyson | http://youtube.com/c/miketyson \nRudy Mancuso | http://youtube.com/c/rudymancuso\nShots Studios | http://youtube.com/c/shots\n\n#Lele\n#LelePons,5,7,67,437,23,8499294.0
__Wd-iOZQ6k,2018-02-02,2018-01-26,19,23,Anwar Jibawi,1757705,69586,1142,4034,False,False,8,True,Being a Sore Loser | Anwar Jibawi,being a sore loser|anwar|jibawi|being|sore|loser|the friend zone|the greatest bowler ever bobby pinz|i cant let go|Being a Sore Loser | Anwar Jibawi|lelepons|hannahstocking|rudymancuso|inanna|sarkis|shots|shotsstudios|alesso|anitta|brazil,SUBSCRIBE ► https://www.youtube.com/channel/UCEr55381WIqO1w_IzgcI5DQ?sub_confirmation=1\n\nWATCH MY PREVIOUS VIDEO ▶ https://youtu.be/jwkNAJBwoEA\n\nTHANKS FOR WATCHING! LIKE & SUBSCRIBE FOR MORE VIDEOS!\n-----------------------------------------------------------\nFIND ME ON: \nInstagram | http://instagram.com/anwar\nSnapchat | http://snapchat.com/add/anwar\nTwitter | http://twitter.com/anwar\n\nCAST:\nAnwar Jibawi | http://youtube.com/c/anwar\nChloe Carabasi | http://instagram.com/ccarabasi\n\nShots Studios Channels:\nAlesso | https://youtube.com/c/alesso\nAnitta | http://youtube.com/c/anitta\nAnwar Jibawi | http://youtube.com/c/anwar\nAwkward Puppets | http://youtube.com/c/awkwardpuppets\nHannah Stocking | http://youtube.com/c/hannahstocking\nInanna Sarkis | http://youtube.com/c/inanna\nLele Pons | http://youtube.com/c/lelepons\nMaejor | http://youtube.com/c/maejor\nMike Tyson | http://youtube.com/c/miketyson \nRudy Mancuso | http://youtube.com/c/rudymancuso\nShots Studios | http://youtube.com/c/shots\n\n#Anwar\n#AnwarJibawi,5,7,30,339,21,2613499.0
woDDGmpV2KE,2018-01-29,2018-01-27,2,10,Recording Academy / GRAMMYs,60857,932,145,695,False,False,4,True,Who's Performing at the 2018 GRAMMYs?,Grammy|Grammys|Performances|Speech|Interviews|Awards|Red carpet|Full|Show|Highlights|Music|Album|Record|Song|Producer|Artist|Nomination|Nominee|Pop|Hip-hop|Country|Jazz|Indie|Rock|The Recording Academy|2018|2018 grammys|60th grammys|performers|who is performing grammys|kesha|elton john|miley cyrus|sza|logic|U2|bruno mars|childish gambino|rihanna|lady gaga|kendrick lamar,"FOR A FULL LIST OF PERFORMERS VISIT GRAMMY.COM\nhttp://bit.ly/2ngbj9C\n\nTUNE IN\nThe 60th GRAMMY Awards will take place at Madison Square Garden in New York on Jan. 28, 2018, airing live on CBS from 7:30–11 p.m. ET/4:30–8 p.m. PT.\n\nWATCH MORE \nRecord Of The Year  Nominees | 60th GRAMMYs\n►http://bit.ly/2Bx94Vh\nSong Of The Year Nominees | 60th GRAMMYs\n►http://bit.ly/2jtejgq\nBest Pop Vocal Album Nominees | 60th GRAMMYs\n►http://bit.ly/2zNQCdO\n\nAbout the Recording Academy / GRAMMYs: \nRecording Academy is the world's leading society of musical professionals, and is dedicated to celebrating, honoring, and sustaining music's past, present and future. \n\nConnect with the Recording Academy / GRAMMYs: \nWEBSITE: http://www.grammy.com\nFACEBOOK: http://grm.my/2gcTcMk \nTWITTER: http://grm.my/2gDUHUD  \nINSTAGRAM: http://grm.my/2gZGIvJ \n\nSubscribe NOW to the Recording Academy / GRAMMYs on YouTube: http://grm.my/1dTBF8H",1,2,171,1112,41,344462.0
WmQR7X9SdeU,2018-02-02,2018-01-27,16,24,Associated Press,26921,204,431,322,False,False,4,True,Cardi B wants a Grammy,bebe rexha|bruno|bruno mars|rihanna|bebe|ciara|cardi b|ashley graham|kelly clarkson|entertainment|arts and entertainment|award shows|music awards|music|grammy awards|pop music|celebrity fashion|fashion design|celebrity|cardi|wants|grammy,"Rapper Cardi B says all she's thinking about is winning an award at the Grammys, and looks forward to performing. (Jan. 27)\n\nSubscribe for more Arts and Entertainment News: http://smarturl.it/AssociatedPress
\n
\nGet fast, accurate coverage of every arts and entertainment story making headlines worldwide, from festivals and premieres to births, deaths, scandals and arrests, plus celebrity reactions to news events.
\n
\nThe Associated Press is the essential global news network, delivering fast, unbiased news from every corner of the world to all media platforms and formats.
\nAP’s commitment to independent, comprehensive journalism has deep roots. Founded in 1846, AP has covered all the major news events of the past 165 years, providing high-quality, informed reporting of everything from wars and elections to championship games and royal weddings. AP is the largest and most trusted source of independent news and information.
\nToday, AP employs the latest technology to collect and distribute content - we have daily uploads covering the latest and breaking news in the world of politics, sport and entertainment. Join us in a conversation about world events, the newsgathering process or whatever aspect of the news universe you find interesting or important. Subscribe: http://smarturl.it/AssociatedPress
\n
\nhttp://www.ap.org/
\nhttps://plus.google.com/+AP/
\nhttps://www.facebook.com/APNews
\nhttps://twitter.com/AP",5,6,171,567,22,793607.0
IzbcIFW1qB0,2018-02-01,2018-01-26,15,25,Inside Edition,20263,365,40,24,False,False,3,True,Celebs at Grammys to Wear White Roses in Solidarity with 'Times Up’ Movement,music|cat-entertainment|grammy awards|host|jay z|madison square garden|singers|music industry|ie celebrity|times up|ie entertainment|beyonce|women|white roses|inside edition|awards|red carpet|james cordon|new york city|grammy,"Just how will host James Cordon top that crazy moment from last year's Grammy Awards when he literally rolled down the stairs? He was wearing a protective suit to avoid injury, but it was still quite and entrance. Inside Edition caught up with Cordon at New York's Madison Square Garden where the award ceremony is being held Sunday night. As the big stars arrive, many will be wearing white roses to show their solidarity with the ‘Times Up’ movement.",4,6,171,436,20,2081261.0
DjbysQgJ64Y,2018-01-31,2018-01-29,3,24,The Late Late Show with James Corden,2393894,46472,36669,20572,False,False,2,True,"Hillary Clinton, Cardi B & More Audition for Fire & Fury - 2018 GRAMMYs",grammy|grammys|grammy awards|grammy award|music|the grammys|Tyler Oakley|grammy winners|music videos|music clips|music video|top songs|pop music|top music|all music|music search|bands|band|singers|musician|music news|grammies|grammy award winners|grammys winners|red carpet|fashion|carpet|red dresses|red carpet dresses”|celebrity dresses|grammy red carpet|dress|dresses|celebrity|CBS|news,"On the hunt for a spoken word GRAMMY Award, James Corden invites Cardi B, John Legend, DJ Khaled, Cher, Snoop Dogg and Hillary Clinton to audition to narrate Michael Wolff's best-selling account of President Donald Trump's White House, Fire & Fury.",2,2,183,941,36,13608050.0
TdcS2LMQ5Ck,2018-02-04,2018-01-29,6,10,Recording Academy / GRAMMYs,1383902,13688,3211,2143,False,False,8,True,Bruno Mars Wins Record Of The Year | Acceptance Speech | 60th GRAMMYs,Grammy|2018|Grammys|Performances|Speech|Interviews|Awards|Red carpet|Full|Show|Highlights|Music|Album|Record|Song|Producer|Artist|Nomination|Nominee|Pop|Hip-hop|Country|Jazz|Indie|Rock|The Recording Academy|60th Grammys|bruno mars|record of the year|acceptance speech|bruno mars acceptance speech,"VIEW THE FULL 60th GRAMMYs WINNER’S LIST\nhttp://bit.ly/2GsJoLK\n\nWATCH MORE\nErika Ender | Songwriter | GRAMMY Song Of The Year Nominee \n►http://bit.ly/2FxpRsb\nJulia Michaels | Meet The Nominees \n►http://bit.ly/2E5gZ02\nSOJA Covers Prince/Sinéad O'Connor’s Nothing Compares 2 U   \n►http://bit.ly/2mJWwWW\n\nAbout the Recording Academy / GRAMMYs: \nRecording Academy is the world's leading society of musical professionals, and is dedicated to celebrating, honoring, and sustaining music's past, present and future. \n\nConnect with the Recording Academy / GRAMMYs: \nWEBSITE: http://www.grammy.com\nFACEBOOK: http://grm.my/2gcTcMk \nTWITTER: http://grm.my/2gDUHUD  \nINSTAGRAM: http://grm.my/2gZGIvJ \n\nSubscribe NOW to the Recording Academy / GRAMMYs on YouTube: http://grm.my/1dTBF8H",6,6,171,1020,31,344462.0
D-IkMEDaNQY,2018-02-04,2018-01-29,0,24,E! Live from the Red Carpet,1280410,23156,1336,2810,False,False,4,True,Cardi B Has Butterflies in Her Stomach & Where?! | E! Live from the Red Carpet,2018 Grammys|Red Carpet|Awards|Grammys|Cardi B|E! Live from the Red Carpet|Celebrity Gossip|Celebrity News|E! News|E! Entertainment|E!|Pop Culture|Live|Interviews|Award Show|Fashion|Beauty|Oscars|Golden Globes|Emmys,"The Motor Sport rapper opens up about being nervous and speaking her mind at the 2018 Grammys. Plus, is Cardi ready to clear up any rumors?\n\nFull Story: http://www.eonline.com/news/909698/cardi-b-says-she-has-butterflies-in-her-stomache-and-vagina-at-the-2018-grammys\n\nSubscribe: http://eonli.ne/RedCarpetSubscribe\n\nAbout E! Live from the Red Carpet:\nWho’s wearing what? Who’s dating who? We’re here to find out. Join E! Live from the Red Carpet at the Oscars, the Grammys, the Golden Globes, and more. Our correspondents are on the Red Carpet, ready to get the scoop from your favorite stars, musicians and personalities. Whether at a glamorous awards show, or the premiere of your favorite TV series, E! Live from the Red Carpet is the go to source for the latest beauty trends, the hottest red carpet fashion and exclusive celebrity interviews.\n\nConnect with E! Live from the Red Carpet and E! News:\nVisit the E! News WEBSITE: http://eonli.ne/enews\nFollow E! Live from the Red Carpet on TWITTER: http://eonli.ne/RedCarpetTwitter\nFollow E! News on TWITTER: http://eonli.ne/ENewsTW\nLike E! News on FACEBOOK: http://eonli.ne/ENewsFB\nCheck out E! News on INSTAGRAM: http://eonli.ne/ENewsIG\n\nCardi B Has Butterflies in Her Stomach & Where?! | E! Live from the Red Carpet\nhttps://www.youtube.com/channel/UCD-1jAmL42qnEszozefaa1g",6,6,126,550,20,99821.0
7cmzAjwmc5k,2018-02-04,2018-01-29,3,24,ET Canada,976652,5400,1660,1428,False,False,3,True,Kesha Performs Praying at 2018 Grammys,entertainment|news|et canada|kesha|praying|grammys|grammy awards|cyndi lauper|camila cabello|andra day|bebe rexha|julia michaels|time's up,"In a powerful performance, Kesha performs her Grammy-nominated hit Praying with Camila Cabello, Cyndi Lauper, Bebe Rexha, Andra Day, and Julia Michaels.\n\nSUBSCRIBE to our channel:\n\nhttps://www.youtube.com/user/ETCanadaOfficial\n\nFOLLOW us here:\n\nhttp://www.etcanada.com\n\nFacebook: https://www.facebook.com/etcanada\n\nTwitter: http://www.twitter.com/etcanada\n\nInstagram: http://www.instagram.com/etcanada\n\nSnapchat: https://www.snapchat.com/add/etcanada",6,6,183,381,13,0.0
1A_aWbz6D5A,2018-02-04,2018-01-29,5,24,Entertainment Tonight,412054,1655,1933,615,False,False,3,True,"The BIGGEST Moments From the 2018 Grammys: Kesha, Bruno Mars, Kendrick Lamar, & Hillary Clinton",grammys 2018 performances|grammys 2018|Grammys 2018|grammy awards|grammys hillary clinton|bruno mars|Entertainment Tonight|etonline|et online|celebrity|hollywood|news|trending|et|et tonight|cbs|nominee|producer|album of the year|red carpet|highlights|recording academy|performances|interviews|kesha|praying|kendrick lamar|damn|sza|cardi b|best new artist|record of the year|james corden|metoo|#metoo,"More from Entertainment Tonight: https://www.youtube.com/channel/UCdtXPiqI2cLorKaPrfpKc4g?sub_confirmation=1\nET's Denny Directo, Sophie Schillaci, and Lauren Zima bring you the BIGGEST moments from the 2018 Grammys with your favorites: Kendrick Lamar, Bruno Mars, Cardi B, SZA, and MORE!",6,6,183,1011,35,1006866.0
melV2fR6-T0,2018-02-04,2018-01-29,8,26,Clevver Style,622235,9843,1023,1442,False,False,4,True,Best & Worst Dressed Grammys 2018 (Dirty Laundry),grammys 2018|grammy awards|best and worst dressed|dirty laundry|clevver|clevver style|clevver news|best dressed grammys|red carpet|grammys|2018 grammys|miley cyrus|lady gaga|camila cabello|cardi b|hailee steinfeld|beyonce|rihanna|anna kendrick|childish gambino|nick jonas|kesha|pink|fashion|style|celebrity|entertainment|trophy life|newsfeed|awards|2018|grammys fashion,"SUBSCRIBE for MORE Dirty Laundry ►► http://bit.ly/SubClevverStyle\n\nMore Grammys 2018 Highlights ►► https://youtu.be/nRUrsaozqYM\n10 Best Moments from the 2018 GRAMMYS ►► https://youtu.be/tTMtafubPq0\n\nIt's the biggest night in music! Check out the best & worst red carpet fashion and celebrity looks from the 2018 Grammy Awards on Dirty Laundry.\n\nFeaturing: Miley Cyrus, Lady Gaga, Hailee Steinfeld, Cardi B, Rihanna, Anna Kendrick, Beyonce, Camila Cabello, Childish Gambino, Nick Jonas, Kesha, Jaden Smith, Pink, Tyler the Creator\n\nWatch MORE Clevver Style ►► \nVisiting Lush Factory - https://youtu.be/B0qyyvGzIPk\nCustom Clothes - https://youtu.be/8OFmXIIVPtw \nGuys Try Face Masks - https://youtu.be/m4SjCBSmxt8\n\nTalk to us about the episode!\nhttp://twitter.com/joslyndavis\nhttp://twitter.com/lily_marston\nhttp://twitter.com/erinrobinson \nhttp://twitter.com/drew__dorsey\nhttps://twitter.com/nazperezz\nhttps://twitter.com/tracistumpf\nhttps://twitter.com/LorynPowell\nhttps://twitter.com/vivianfabiolav\nhttps://twitter.com/reneeariel\nhttps://twitter.com/MiriamIsa\n\nFor More Clevver: http://www.clevver.com\nLike us on Facebook: http://facebook.com/Clevver\nFollow us on Twitter: http://twitter.com/ClevverTV\nKeep up with us on Instagram: http://instagr.am/Clevver\nAdd us to your circles on Google+: http://google.com/+ClevverTV\nFind us on Snapchat: ClevverTV",6,6,164,775,32,2603964.0
HkOLf9BMRZ4,2018-02-03,2018-01-29,14,28,The Verge,38307,768,69,54,False,False,1,True,Beauty gadgets of the future,makeup|beauty|neutrogena|henkel|schwarzkopf|hair|analysis|the verge|verge,"The beauty industry is experimenting with technology to give customers a more personalized experience. Companies have introduced augmented reality apps, gadgets, and custom products in an attempt to help buyers find the products most suited to them. Subscribe: https://goo.gl/G5RXGs\n\nCheck out our full video catalog: https://goo.gl/lfcGfq\nVisit our playlists: https://goo.gl/94XbKx\nLike The Verge on Facebook: https://goo.gl/2P1aGc\nFollow on Twitter: https://goo.gl/XTWX61\nFollow on Instagram: https://goo.gl/7ZeLvX\nRead More: http://www.theverge.com",5,5,92,221,9,1819334.0
RkU4WWEUj-Y,2018-02-01,2018-01-26,16,28,LGR,213749,9427,102,1751,False,False,3,True,Microsoft Bob Experience: Was It Really THAT Bad?,microsoft bob|review|lgr|lazy game reviews|bob|clippy|clippit|comic sans|history|overview|commentary|footage|gameplay|geosafari|classic|vintage|retro|90s|1995|windows 3.1|best|worst|software|shell|GUI|overlay|unboxing|demonstration|commercial|bill gates|windows 10|experience|kids|finance|computer|PC|1994|price|wiki|dog|assistant|office,"This is the infamous Microsoft Bob from 1995. Often ridiculed for being childish, overpriced, and introducing us to Comic Sans and Clippy. But was Bob truly as terrible as its reputation suggests?\n\n● Consider supporting LGR on Patreon:\nhttps://www.patreon.com/LazyGameReviews\n\n● Social links:\nhttps://twitter.com/lazygamereviews\nhttps://www.facebook.com/LazyGameReviews\n\n● Music used in order of appearance:\nDowntown Alley 1, All Is Good Again 2, Relaxation Station\nhttp://www.epidemicsound.com",3,6,113,493,42,818133.0
6Nr_xHolP1Q,2018-02-04,2018-01-29,17,23,Smosh,1642644,52190,2122,3606,False,False,3,True,EVERY ELEVATOR EVER,elevator|every blank ever|smosh|every ever|every elevator ever|elevator music|awkward small talk|awkward|overcrowded elevator|small talk|smosh every blank ever|smosh ebe|ebe|ian hecox|ianh|every elevator,"Elevators - whether it's awkward small talk, overcrowded spaces, or more, this is Every Elevator Ever!\n\nCAST \nIan Hecox \nNoah Grossman \nKeith Leak Jr. \nCourtney Miller \nOlivia Sui \nShayne Topp \n\nCREW \nDirected by Ryan Todd \nWritten by Ian Hecox, Courtney Miller, Monica Vasandani, Cole Hersch, and Ryan Finnerty \nSmosh Co-Founded by Ian Hecox & Anthony Padilla \nSmosh Creative Director: Joe Bereta \nDirector of Photography: Billy Yates \nEditor: Leonard Wilkes \nSenior Producer: Alex Hluch \nCo-Producer: Rebecca Doyle \nProducers: Garrett Palm & Ryan Todd\nAssociate Producer: Kristina Nikolic \nFirst Assistant Director: Tanner Risner \nProduction Manager: Daniel Kesner \nProduction Designer: Tayler Nicholson \nArt Director: Ian Matthews \nCamera: Brennan Iketani \nAssistant Camera: Nick Goto \nGaffer: Katie Eleneke \nKey Grip: Connor Bodell \nSound: Ivan Harder \nMakeup: Rachel Jenkins \nCostume Designer: Lindsay Hamilton \nProduction Assistant: Jake Sperling \nAssistant Editor: Matthew Duran \nPost-Production Supervisor: Reed Brice",5,6,10,53,16,22919161.0
V6wWKNij_1M,2018-02-06,2018-01-30,13,1,A24,2497708,16034,709,1528,False,False,5,True,Hereditary | Official Trailer HD | A24,a24|a24 films|a24 trailers|independent films|trailer|official|movie|a24 movies|oscar winner|academy award winner|Hereditary|Hereditary trailer|Hereditary 2018|Hereditary A24|a24 horror films|horror trailers|2018 horror trailers|horror movies|a24 hereditary|Ari Aster|Toni Collette|Gabriel Byrne|Alex Wolff|Milly Shapiro|thriller trailer|thriller films|Official Trailer|Hereditary Official Trailer|a24 Official Trailer|8_rTIAOohas|u7KZrt_cHH0,"SUBSCRIBE: http://bit.ly/A24subscribe\n\nFrom Ari Aster and starring Toni Collette, Gabriel Byrne, Alex Wolff, and Milly Shapiro – Coming June 8, 2018.\n\nRELEASE DATE: June 8, 2018\nDIRECTOR: Ari Aster\nCAST: Toni Collette, Gabriel Byrne, Alex Wolff, and Milly Shapiro\n\nVisit Hereditary WEBSITE: http://bit.ly/HereditaryMovie\nLike Hereditary on FACEBOOK: http://bit.ly/HereditaryFB\nFollow Hereditary on TWITTER: http://bit.ly/HereditaryTW\nFollow Hereditary on INSTAGRAM: http://bit.ly/HereditaryIG\n\n------\n\nABOUT A24:\nOfficial YouTube channel for A24, the studio behind Ex Machina, Amy, Room, The Witch, The Lobster, Moonlight, 20th Century Women & more.\n\nComing Soon: A Prayer Before Dawn, Lean on Pete, Slice\n\nSubscribe to A24's NEWSLETTER: http://bit.ly/A24signup\nVisit A24 WEBSITE: http://bit.ly/A24filmsdotcom\nLike A24 on FACEBOOK: http://bit.ly/FBA24\nFollow A24 on TWITTER: http://bit.ly/TweetA24\nFollow A24 on INSTAGRAM: http://bit.ly/InstaA24",7,7,151,391,31,189346.0
upt1wHntDws,2018-02-04,2018-01-29,23,1,Screen Junkies,221773,5433,695,1955,False,False,3,True,Screen Junkies 2017 Oscar Nominations: Our Academy Awards Picks,oscars|oscar 2018|oscars 2018|academy awards|academy awards 2018|academy awards 2017|oscar 2017|oscar nominations|oscars nominations|oscar noms|academy awards nominations|best picture|oscars best picture|get out|logan|logan oscars|planet of the apes|andy serkis|ingrid goes west|shape of water|ladybird|logan lucky|logan xmen|nomination snubs|oscars snubs|oscar snubs|screenjunkies|screen junkies|honest trailers|honest trailer,Our Screen Junkies crew break down our Academy Awards 2018 picks. Who should be Oscar nominated? Who was snubbed? We tell all! \n\nFeaturing:\nDan Murrell\nJoe Starr\nDanielle Radford\nSpencer Gilbert\nRoth Cornet\n\nHosted by:\nHal Rudnick ► http://twitter.com/halrudnick\n\nGot a tip? Email us ► tips@screenjunkies.com\nFollow us on Twitter ► http://twitter.com/screenjunkies\nLike us on Facebook ► http://www.fb.com/screenjunkies\nGet Screen Junkies Gear! ►► http://bit.ly/SJMerch,5,6,23,179,30,6366779.0
