video_id,last_trending_date,publish_date,publish_hour,category_id,channel_title,views,likes,dislikes,comment_count,comments_disabled,ratings_disabled,tag_appeared_in_title_count,tag_appeared_in_title,title,tags,description,trend_day_count,trend.publish.diff,trend_tag_highest,trend_tag_total,tags_count,subscriber
Uvh3v1BkJ-A,2018-01-09,2018-01-04,18,26,JerryRigEverything,531566,42326,728,3968,False,False,3,True,Smartphone DURABILITY Awards 2017!,SmartPhone awards|smartphone durability awards|best smartphone of the year|most durable smartphone|2017 smart phone awards|2017 durable smartphone|MKBHD|best smartphones|best phones|phone of the year|pixel 2|galaxy note 8|iphone x|iphone 8|iphone 8 plus|essential phone|HTC Sapphire edition|razer phone|smartphone|awards,"Its time for the smartphone durability awards for 2017. SO MANY AMAZING phones were released this year, it was fun to durability test and tear down every single one of them. Click *SEE MORE* for spoilers, and all of the individual phone videos linked right below this description. \n\nMost Repairable Smartphone of 2017\nGoogle Pixel 2 Teardown: https://youtu.be/Zq7nyzldgr4\nGoogle Pixel 2 Durability: https://youtu.be/BVKnt7H4zVc\n\nLeast Repairable Smartphone of 2017\niPhone X Teardown: https://youtu.be/c97ILI7Tsk4\niPhone X Durability: https://youtu.be/twY6zUj-t20\n\nMost Durable Phone of 2017:\nNokia 6 Teardown: https://youtu.be/0M3Budnl3aI\nNokia 6 Durability: https://youtu.be/_5aXkW0EFRI\n\nLeast Durable Smartphone of 2017\nHTC U11 Durability test: https://youtu.be/DdRxmu2jcMs\nHTC U11 Teardown: https://youtu.be/pWqPd6W7pNg\n\nMost improved smartphone of 2017:\nBlackBerry Key One: https://youtu.be/2J1UgMAPNtw\n\nMost Innovative Smartphone of 2017:\nHTC U Ultra Sapphire edition: https://youtu.be/yvlYOOLmxgw\n\nBest Budget Phone durability of 2017:\nOnePlus 5t Durability test: https://youtu.be/qv9Gt38LOKQ\nOnePlus 5t Teardown: https://youtu.be/Y1usMCRo108\n\nMKBHD's Smartphone Awards video: https://youtu.be/aMQbRpxgFvs\n\nAwesome iPhone Tool Kit: http://amzn.to/2idLGDi\nGreen Pry tool: http://amzn.to/1Tu57pI\nMetal phone opening tool: http://amzn.to/1WdOFv0\n\nThe camera I used to film this video: http://amzn.to/2p7GtkX\nThe Lens I used for this video: http://amzn.to/1QOXDw2\nWide angle lens: http://amzn.to/2qiYM4u\nAnd this Metabones adapter: http://amzn.to/2iZ67Ty\nThis is the drone I use: http://amzn.to/2joH00G\n\n*Follow me for updates!*\nInstagram: http://instagram.com/zacksjerryrig\nFacebook: http://on.fb.me/1U4bQqv\nTwitter: https://twitter.com/ZacksJerryRig\nSnapchat: http://bit.ly/1UAb2Fq\nGooglePlus: https://bit.ly/1YyKice\n\nTO SEND ME STUFF: See my P.0. Box on my 'About page': https://www.youtube.com/user/JerryRigEverything/about\n\nJerryRigEverything assumes no liability for property damage or injury incurred as a result of any of the information contained in this video.  JerryRigEverything recommends safe practices when working with power tools, automotive lifts, lifting tools, jack stands, electrical equipment, blunt instruments, chemicals, lubricants, expensive electronics, or any other tools or equipment seen or implied in this video.  Due to factors beyond the control of JerryRigEverything, no information contained in this video shall create any express or implied warranty or guarantee of any particular result.  Any injury, damage or loss that may result from improper use of these tools, equipment, or the information contained in this video is the sole responsibility of the user and not JerryRigEverything. Only attempt your own repairs if you can accept personal responsibility for the results, whether they are good or bad.",5,5,29,143,20,1689905.0
eIAtHvzjk98,2018-01-09,2018-01-03,18,24,Will Smith,540857,16578,459,1700,False,False,6,True,One Thing Arnold Schwarzenegger Told Me That I’ll Never Forget | Will Smith Vlogs,will smith|will|smith|smiths|willsmith|will smith youtube|youtube will smith|will smith channel|channel will smith|will youtube|youtube will|smith youtube|youtube smith|entertainment|comedy|arnold schwarzenegger|arnold|schwarzenegger|arnold schwarzenegger will smith|will smith arnold schwarzenegger|tom cruise|bruce willis|advice|will smith advice|advice will smith|press tour|press|interview|will smith interview|bright netflix|netflix bright|bright|netflix,"Arnold Schwarzenegger gave me the most powerful piece of advice. It’s time to get personal and share some press tour stories I’ve experienced with Tom Cruise, Arnold Schwarzenegger, Bruce Willis and more. Dive inside the way we do press tours to help launch the Netflix Original film Bright in Mumbai, India. SUBSCRIBE for more: https://goo.gl/BUjQW8\n\nSOCIALS:\nInstagram: https://goo.gl/8mBb1K\nFacebook: https://goo.gl/yzifAY\nWebsite: http://willsmith.com\n\nAll music provided by Trey AcE Smith\n\nTREY'S SOCIALS:\nInstagram: https://goo.gl/NCA2t8\nTwitter: https://goo.gl/Bnv6BS",5,6,441,915,33,1107952.0
3mB2fIt7vzw,2018-01-09,2018-01-04,14,20,IGN News,8493,309,17,203,False,False,4,True,Nintendo Switch Now the Fastest-Selling Home Console in US History - IGN News,IGN|games|Switch|Feature|Hardware|Nintendo|Nintendo Switch,The hybrid console sells 4.8 million units in 10 months - breaking Nintendo's own record.,5,5,81,143,7,344968.0
Q1INhRBrwKM,2018-01-09,2018-01-02,4,2,Street Speed 717,236036,9351,317,1153,False,False,0,False,I Said I Would NEVER Do This To My Truck... BIG MODS INCOMING!,tj hunt|tjhunt|salomondrin|doug demuro|tanner fox|cleetus|cleetus mcfarland|cleetusmcfarland|3d machines|3dmachines|jrgarage|jr garage|lance stewart|casey neistat|christian guzman|schmee 150|schmee150|1320 video|mr jww|jww|mightycarmods|mighty car mods|superspeedersrob,"CHECK OUT MY NEW SUNGLASSES!\nhttp://www.boostedshades.com/streetspeed717\nNEW KEY TAGS AVAILABLE HERE!!!\nhttps://motoloot.com/collections/street-speed-717-loot/products/street-speed-717-us-flag-keychain\n\nINSHANE DESIGNS MERCH AVAILABLE HERE!\nhttps://www.inshanedesigns.com\n\nKEY TAGS AVAILABLE HERE!\nhttps://motoloot.com/collections/street-speed-717-loot\nSHIRTS AVAILABLE HERE! https://www.inshanedesigns.com/product/streetspeed717-t-shirt/\nKEY TAGS AVAILABLE HERE!\nhttps://motoloot.com/collections/street-speed-717-loot\nhttps://motoloot.com/collections/diabloformularacing-loot\n\nCHECK OUT The Important Stuff!!! CLICK Show More Below!\nFOLLOW ME ON INSTAGRAM! https://www.instagram.com/streetspeed717/\nI Do not have a Facebook-\n\nWHERE TO BUY MY VINYL DECALS and POSTERS!!! Click The Link Below! \nhttp://inshanedesigns.com/\nhttps://www.inshanedesigns.com/product-category/vinyl-decals/\n\nSEND ME COOL SHIT! (If you want!)\nMike Streetspeed717\nP.O Box 126710\nHarrisburg PA, 17112\n\nSubscribe to the 717 Team!\nTroy's Channel! https://www.youtube.com/user/Trizzle126\nNick's Channel! https://www.youtube.com/user/gtrdude\nAndy's Channel! https://www.youtube.com/user/DiabloFormula\n\nHit Up Shane for Car Wraps!\nhttp://inshanedesigns.com/\nhttps://www.instagram.com/inshanedesigns/\n\nHit Up Andy for Performance Mods/Installs/and Tuning!\nhttps://www.youtube.com/user/DiabloFormula\nhttps://www.instagram.com/diabloformularacing/\n\nHit up Shane with Performance Diesel Warehouse for your truck Needs!\nHe's the guy who built my Duramax!\nAddress: 8211 Rabbit Ln, Grantville, PA 17028\nPhone: (717) 469-4378\n\nBig thank you to soundcloud artists! Music Info Below!\nhttps://pema.bandcamp.com/\nhttps://theartistunion.com/dyallas\nhttps://jordynedmonds.bandcamp.com/\nhttps://soundcloud.com/jordynedmonds",5,7,15,44,23,654874.0
TaldfjkrHy4,2018-01-09,2018-01-01,8,27,TurboTax,323160,7237,98,1707,False,False,2,True,TurboTax 2018 Commercial Closet (Official :60) TV ad,turbotax|turbo tax|turbotax video|turbo tax video|turbotax videos|turbo tax videos|taxes|tax filing|taxes 101|tax software|filing taxes|relax there's turbotax|scary knitted bear|slasher|nightmare|turbotax scary commercial|trapped in the closet|nothing to be afraid of|turbotax there's nothing to be afraid of|turbotax 2018 commercial|turbotax 2018 tv ad|turbotax dancing teddy bear|#dancingteddy|turbotax hiding in the dark commercial|turbotax teddy bear tv ad,https://turbotax.intuit.com Tiny knitted teddy bears. And taxes. Two things that aren’t as scary as you thought they were. TurboTax—there’s nothing to be afraid of. TurboTax 2018 Commercial Closet (Official :60) TV ad\n\nTurboTax Home:  https://turbotax.intuit.com\nTurboTax Support:  https://ttlc.intuit.com/\nTurboTax Blog:  http://blog.turbotax.intuit.com\n\nTurboTax Twitter:  https://twitter.com/turbotax\nTurboTax Facebook:  https://www.facebook.com/TurboTax\nTurboTax Instagram: https://www.instagram.com/turbotax/\nTurboTax Pinterest:  https://www.pinterest.com/turbotax/\nTurboTax Tumblr:  http://turbotax.tumblr.com/,5,8,5,43,25,30030.0
MdBr8xh1mrg,2018-01-08,2018-01-01,17,1,The CGBros,28630,926,39,43,False,False,2,True,**Multi-Award-Winning** CGI 3D Animated Short Film: HEY DEER! - by Örs Bárczy,TheCGBros|CG|3D|VFX|FX|Effects|Animation|Shorts|Motion|Multimedia|Conceptual|Art|Design|Rigging|Texture|Low|Poly|Modeling|Painting|Storyboarding|Compositing|Character|Graphics|Texturing|Special|Digital|Post|Production|Visual|GFX|Capture|MoCap|Computer|Realflow|Cinema|4D|Maya|Matchmover|pftrack|bojou|Nuke|Rotoscoping|Matte|Autodesk|Shake|Renderman|Camera|Projection|Particle|Mocha|Award Winning,"TheCGBros Presents - A Short Animated Film about an adorable, cocoa-drinking deer who is eager to tidy and shoveling in front of his house every day. However, there is a suspicious earthquake every night which causes the mess day by day and makes unbearable our fella’s life. Between two cups of cocoa, the amazing truth reveals which changes the deer’s life forever... \nA film by Örs Bárczy, created by talented artists, has been invited over 100+ film festivals around the world and won nearly 10 awards.\n\nhttp://www.heydeermovie.com/\n\n! © All rights reserved!\nFor screening/distributing purposes please always ask the authors, downloading and sharing the original movie file is strictly forbidden. Unauthorized duplication, distribution or exhibition may result in civil liability and criminal prosecution. For more info, please ask: barczyors@gmail.com\n\nTHE AMAZING TEAM:\nWritten and Directed by: Örs Bárczy\nCharacter Design: Zsolt Márton, Örs Bárczy\nCharacter Modelling: Zoltán Bogdán\nRigging: Dávid Lantos\nAnimation: Örs Bárczy, Enikő Kívés, Beáta Ujj, Zsuzsanna Rádóczy, Hajnalka Tóth\nSnow Simulation: Bertalan Szűcs\nProps Animation: Dániel Illés\nModelling: Dániel Illés, Bertalan Szűcs, Szabolcsa Kajati, Örs Bárczy, Erika Tóth\nAsset Fabrication: Nikoletta Bene\nLighting, Shading, Rendering, Grooming, Comp: Örs Bárczy\nMusic: Bertalan Szűcs\nSound Design: Péter Terner\nLive Action: Máté Papp, Sándor Nemes, Réka Bárczy\n\nMETU - Metropolitan University of Applied Sciences, Animation BA, 2015 - Head of Program: Éva M Tóth\n\nConsultants: Gábor Marinov, László Csáki, Áron Gauder, Árpád Hermán, Brigitta Bacskai, Ashraf Elsayed Hassan, Klára Muhi, Éva M Tóth, Andrea Szigetvári, Szabolcs Keresteš\n\nSpecial Thanks to: Our Family Member, Ashraf Elsayed Hassan, Gábor Marinov, Eörs Bárczy, Gabriella Bárczyné, János Kirch, János Száraz, Péter Várnai, Réka Bárczy, Levente Bárczy, Beáta Nedermann, John David Marte, Albert Lukács, Balázs Pataki, Máté Brauner, Máté Papp, Sánodr Nemes, Igor Bóka, Evelin Tóth Judit, Orsolya Skultéti, Anna Katona, Dávid Konsiczky, Roland Budai, Miklós Polgár, Holló-Leleszi Krisztina and Barkóczi Janka.\n\nStudios who helped us:\nPuppetworks Animation Studio (Budapest)\nKGB Studio (Budapest)\n\nThe Persons and Events in this motion picture are fictitious. Any similarities to actual persons or events is unintentional. This motion picture is protected under laws of Hungary and other countries. Unauthorized duplication, distribution or exhibition may result in civil liability and criminal prosecution.\n\nNo deer were harmed during the making of this film.\n\nMaking of: http://heydeermovie.com/behind_the_scenes.html\n\n————————————————————\n\nWHO EXACTLY ARE THECGBROS? - http://bit.ly/2bzGzYQ\n\n————————————————————\n\nThanks for SUBSCRIBING -http://bit.ly/2c8Fl8u\n\nTheCGBros Newsletter- http://tinyurl.com/j5njcxd\n\nWeb - TheCGBros http://www.thecgbros.com\nYouTube https://www.youtube.com/user/TheCGBro\nFacebook https://www.facebook.com/TheCGBro\nTwitter https://twitter.com/TheCGBros\nGoogle+ https://plus.google.com/104301021746334584641\nPinterest https://www.pinterest.com/TheCGBros/\nTumblr http://thecgbros.tumblr.com/\n\n————————————————————\nSpecial Thank's to formaDISSENY for making our logo intro animation!! http://www.formadisseny.com/en/\n————————————————————\n\nIf you’re a CGI ARTIST, ANIMATOR, FILM MAKER or STUDIO and would like your project showcased on our TheCGBros please visit http://bit.ly/2byguiS\n\n————————————————————\n\nTheCGBros have permission to broadcast this video and or it is part of Creative Commons the http://creativecommons.org/licenses/b.... If you believe this video should not be broadcasted on our channel, please contact legal@thecgbros.com to remedy the situation.\n\n————————————————————\n\n#VFX\n#CGI\n#TheCGBros\n#3D\n#Shortfilms\n#Breakdowns\n#Reels",4,7,71,316,51,1943512.0
JTof-eIChUA,2018-01-08,2018-01-01,19,20,Star Wars HQ,168969,3545,150,632,False,False,5,True,Matt the Radar Technician in Star Wars Battlefront 2!  New Battlefront 2 Mod Gameplay!,matt the radar technician|kylo ren saturday night live|snl skit kylo ren|starkiller base|Star Wars Battlefront 2|Star Wars Battlefront 2 gameplay|pc mods|Star Wars Battlefront 2 multiplayer gameplay|Battlefront 2 gameplay|Star Wars|Battlefront 2|EA Star Wars|Star Wars Battlefront 2 clone wars|Star Wars Battlefront 2 news|gameplay|Star Wars Battlefront ii|Star Wars HQ,"Matt The Radar Technician (aka Kylo Ren from Saturday Night Live's SNL Skit Undercover Boss) invades Star Wars Battlefront 2 (2017) to mop up Starkiller Base with his fire lightsaber!  New gameplay is on PC with the PC mods installed (not available on PS4 or Xbox One at this time).\n\nSaturday Night Live Skit:\nhttps://www.youtube.com/watch?v=FaOSCASqLsE\n\nMOD DOWNLOAD LINKS:\n\nMatt the Radar Technician (ARCADE ONLY!) by GameTSF:\nhttps://www.nexusmods.com/starwarsbattlefront22017/mods/119/?\n\nFire Saber Mod by DeadStrokeYT;\nhttp://www.mediafire.com/file/3ar152hhc5vxbte/FireSaber.rar\n\nAutumn Takodana by Spiffy: https://rd.nexusmods.com/starwarsbattlefront22017/mods/79\n\n►SUBSCRIBE to Star Wars HQ: http://bit.ly/2iE43Vi\n►SUPPORT and DONATE to Star Wars HQ: http://bit.ly/2tmXlmY\n►Join Our Discord Chat: https://discord.gg/starwarshq\n\n►More Star Wars Battlefront 2: http://bit.ly/2Bkp8MA\n\n►Support Star Wars HQ by checking out our Amazon Store: https://www.amazon.com/shop/starwarshq\n\n►Facebook: https://www.facebook.com/StarWarsHQ\n►Twitter: https://twitter.com/theStarWarsHQ\n►Instagram: http://www.instagram.com/starwarshq\n►Website: http://www.StarWarsHQ.com\n\nThanks for watching! Star Wars HQ provides daily Star Wars videos and is family friendly.  Have questions, or suggestions? Contact our business email on the about page on our YouTube channel.",4,7,73,106,17,719445.0
ctBVhyZxXYY,2018-01-09,2018-01-05,16,24,Netflix,1016525,7972,1351,1625,False,False,6,True,My Next Guest Needs No Introduction With David Letterman | Trailer [HD] | Netflix,Netflix|Trailer|Netflix Original Series|Netflix Series|television|movies|streaming|movies online|television online|documentary|comedy|drama|08282016NtflxUSCAN|watch movies|George Clooney|Malala Yousafzai|Jay-Z|Tina Fey|Howard Stern|Barack Obama|David Letterman|My Next Guest Needs No Introduction with David Letterman|PLvahqwMqN4M1gg7LSojjoCA9x3VvIf-d1|PLvahqwMqN4M1uQ5JITdkmNrxZnwtUG-DP|PLvahqwMqN4M0MGkARAHH7sCVVEepIBVYe|My Next Guest|no introduction,"David Letterman is out of retirement and returning to television with a six-episode, 60-minute Netflix series -- My Next Guest Needs No Introduction with David Letterman. The first episode will premiere on Friday, January 12, 2018 with each subsequent episode streaming monthly from February to June. Dave’s lineup of influential guests includes George Clooney, Malala Yousafzai, Jay-Z, Tina Fey, Howard Stern and President Barack Obama.\n\nWatch on Netflix Now: https://www.netflix.com/title/80209096\n\nSUBSCRIBE: http://bit.ly/29qBUt7\n\nAbout Netflix:\nNetflix is the world’s leading Internet television network with over 100 million members in over 190 countries enjoying more than 125 million hours of TV shows and movies per day, including original series, documentaries and feature films. Members can watch as much as they want, anytime, anywhere, on nearly any Internet-connected screen. Members can play, pause and resume watching, all without commercials or commitments.\n\nConnect with Netflix Online:\nVisit Netflix WEBSITE: http://nflx.it/29BcWb5\nLike Netflix Kids on FACEBOOK: http://bit.ly/NetflixFamily\nLike Netflix on FACEBOOK: http://bit.ly/29kkAtN\nFollow Netflix on TWITTER: http://bit.ly/29gswqd\nFollow Netflix on INSTAGRAM: http://bit.ly/29oO4UP\nFollow Netflix on TUMBLR: http://bit.ly/29kkemT\n\nMy Next Guest Needs No Introduction With David Letterman | Teaser [HD] | Netflix\nhttp://youtube.com/netflix",4,4,441,1428,27,3181914.0
dtdiFUwRQqM,2018-01-09,2018-01-04,21,25,CNBC,243553,1472,436,913,False,False,4,True,North Korea Accidentally Hit One Of Its Own Cities With A Ballistic Missile Last Year | CNBC,Bottom Line|CNBC|business news|finance|stock|stock market|news channel|news station|breaking news|us news|world news|cable|cable news|finance news|money|money tips|North Korea|North Korea Accidentally Hit One Of Its Own Cities|Ballistic Missile Last Year|April last year|North Korean ballistic missile|ballistic missile crashed|hit the urban city of Tokchon|two hours from Pyongyang|Diplomat reported|north korea missile launch|north korea nuclear war,"In April last year, a North Korean ballistic missile crashed and hit the urban city of Tokchon, roughly two hours from Pyongyang, The Diplomat reported.\n» Subscribe to CNBC: http://cnb.cx/SubscribeCNBC\n\nAbout CNBC: From 'Wall Street' to 'Main Street' to award winning original documentaries and Reality TV series, CNBC has you covered. Experience special sneak peeks of your favorite shows, exclusive video and more.\n\nConnect with CNBC News Online\nGet the latest news: http://www.cnbc.com/\nFind CNBC News on Facebook: http://cnb.cx/LikeCNBC\nFollow CNBC News on Twitter: http://cnb.cx/FollowCNBC\nFollow CNBC News on Google+: http://cnb.cx/PlusCNBC\nFollow CNBC News on Instagram: http://cnb.cx/InstagramCNBC\n\nNorth Korea Accidentally Hit One Of Its Own Cities With A Ballistic Missile Last Year | CNBC",4,5,57,280,27,230748.0
1mYB8onrPt0,2018-01-12,2018-01-05,22,24,Battle Universe!,948294,11103,1949,3474,False,False,1,True,NERF Putt-Putt Golf Challenge!,Battle Universe|Nerf Battle Universe|Nerf Challenge|epic nerf battle|nerf gun fight|nerf fight|team edge|hi5|high five|hi5 nerf|hi5 studios|hi 5 studios|matthias vlogs|nerf|nurf|nerf war|nerf battle|NERF attack|family friendly|no swearing|no cursing|Hi5 Network|NERF Putt Putt|NERF Golf,"Check out Matthias, Sam, & J-Fred in this NERF Putt-Putt Golf Challenge! They're using NERF blasters to putt their way to glory! Let us know what you think! Comment Below!\nThe Official NERF Robot Prison Escape Challenge Playlist!  ➡ https://www.youtube.com/watch?v=BOKM8UT6YsI&list=PL1ZA9hANtwbY8Hu8HetsGlHnVvopJ0ioT\n\nBattle Universe is on Twitter! ➡ http://www.twitter.com/battle_universe\n\nBattle Universe is on Instagram! ➡ http://www.instagram.com/itsbattleuniverse\n\nCheck out our other family friendly channels at Hi5 Studios below. \n\nMatthias ➡ http://www.youtube.com/matthiasiam\n\nMatthias Vlogs ➡ http://www.youtube.com/onetoomany\n\nMatt & Amanda ➡ http://www.youtube.com/matthiasarcade\n\nBattle Universe ➡ http://www.youtube.com/battleuniverse\n\nGet Good ➡ http://www.youtube.com/itswhateverok\n\nTeam Edge Gaming ➡ http://www.youtube.com/teamedgegaming\n\nREKT ➡ https://www.youtube.com/channel/UCETEqk3eDILFcu8p6YncjQw\n\nTeam Edge ➡ http://www.youtube.com/teamedgegames\n\nGet your own Battle Bunkerz and build your very own battlefield in your backyard! Check them out!\nwww.battlebunkerz.com",4,7,34,107,24,2103935.0
GdR0JlvbtWg,2018-01-12,2018-01-06,1,22,BuzzFeedVideo,560358,12793,1877,1659,False,False,3,True,Why Is Everyone Wearing Black At The Golden Globes?,BuzzFeed|BuzzFeedVideo|askhermore|golden globes|red carpet|who are you wearing|designer|fashion|celebrity|actress|sexual harrassment|timesup|times up|black|protest|dress|why|how|movie stars|the representation project|awards season|celebrities|awards show,"It's not who are you wearing? It's why are you wearing?\n\n#AskHerMore was started by nonprofit The Representation Project in 2014. See more information at: http://therepresentationproject.org/\n\nCheck out more awesome videos at BuzzFeedVideo!\nhttps://bit.ly/YTbuzzfeedvideo\nhttps://bit.ly/YTbuzzfeedblue1\nhttps://bit.ly/YTbuzzfeedviolet\n\nGET MORE BUZZFEED:\nhttps://www.buzzfeed.com\nhttps://www.buzzfeed.com/videos\nhttps://www.youtube.com/buzzfeedvideo\nhttps://www.youtube.com/boldly\nhttps://www.youtube.com/buzzfeedblue\nhttps://www.youtube.com/buzzfeedviolet\nhttps://www.youtube.com/perolike\nhttps://www.youtube.com/ladylike\n\nBuzzFeedVideo\nBuzzFeed Motion Picture’s flagship channel. Sometimes funny, sometimes serious, always shareable. New videos posted daily!\n\nMUSIC\nLicensed via Audio Network\n\nSTILLS\n58th Annual Golden Globe Awards\nNewsmakers/Getty Images/Getty Images\n88th Annual Academy Awards - Red Carpet\nChristopher Polk/Getty Images/Getty Images\n74th Annual Golden Globe Awards - Arrivals\nFrazer Harrison/Getty Images/Getty Images\nUS-ENTERTAINMENT-GOLDEN-GLOBE-ARRIVALS\nVALERIE MACON/AFP/Getty Images/Getty Images\n'The Prophet' Premiere - The 67th Annual Cannes Film Festival\nTim P. Whitby/Getty Images/Getty Images\n'The Prophet' Premiere - The 67th Annual Cannes Film Festival\nTimur Emek/Getty Images/Getty Images\nUS-GRAMMY-SHOW-MUSIC-PRETELECAST-ARRIVALS\nMARK RALSTON/AFP/Getty Images/Getty Images\nThe 59th GRAMMY Awards - Arrivals\nFrazer Harrison/Getty Images/Getty Images\n\nCredits: https://www.buzzfeed.com/bfmp/videos/43247",4,6,164,621,23,14889874.0
LaMxS5-4U-c,2018-01-08,2017-09-15,0,10,Benn and Gear,28781,515,12,59,False,False,6,True,"VCV - Open source, FREE modular software. First look and noob tutorial.",vcv|vcv rack|vcvrack|modular|daw|computer|virtual modular|modular software|software|open source|free|eurorack|clouds|mutable|elements|rings|emulator|simulator|emulation|simulation|benn on gear|benn jordan|the flashbulb,"Today we're checking out VCV Rack. Grab it here:  https://vcvrack.com\n\nWarning: If you're already someone using modular synths, this video may bore you to death. =)",2,115,12,57,23,4163.0
ss6qQM054B0,2018-01-08,2018-01-08,3,17,Pop & Sports HQ,305899,6967,494,1344,False,False,2,True,Oprah Winfrey Golden Globes Cecil B. DeMille Award Acceptance Speech,Oprah Winfrey|Golden Globes|Golden Globes Cecil B. DeMille Award,,1,0,23,35,3,15015.0
fN5HV79_8B8,2018-01-15,2018-01-08,4,24,NBC,8159690,142149,66251,26770,False,False,5,True,Oprah Winfrey Receives Cecil B. de Mille Award at the 2018 Golden Globes,golden globe awards|golden globes|2018 golden globes|75th annual golden globe award|cecil b de mille award|cecil b demille award|oprah winfrey|oprah|NBC|NBC network|tv|tv shows|2018|entertainment|episode|full episode|trailer|red nose day|comedy|free tv|watch tv|watch episodes,"Oprah Winfrey receives the Cecil B. de Mille Award at the 75th Annual Golden Globe Awards.\n» Subscribe for More: http://bit.ly/NBCSub\n» Watch Full Episodes Free of Your Favorite Shows: http://bit.ly/NBCFullEpisodes\n\nNBC ON SOCIAL:\nNBC YouTube: http://www.youtube.com/nbc\nLike NBC: http://Facebook.com/NBC\nFollow NBC: http://Twitter.com/NBC\nNBC Tumblr: http://NBCtv.tumblr.com/\nNBC Pinterest: http://Pinterest.com/NBCtv/\nNBC Google+: https://plus.google.com/+NBC\nNBC Instagram: http://instagram.com/nbc\n\nFind NBC trailers, full episode highlights, previews, promos, clips, and digital exclusives here. \n\nABOUT THE 2018 GOLDEN GLOBE AWARDS:\nSeth Meyers hosts the 75th annual Golden Globe Awards. The three-hour ceremony serves as the official kickoff to awards season, with winners in 25 categories - 14 in film and 11 in television.\n\nOprah Winfrey Receives Cecil B. de Mille Award at the 2018 Golden Globes\nhttps://youtu.be/fN5HV79_8B8\n\nNBC on Youtube\nhttp://www.youtube.com/user/nbc",6,7,441,1101,22,566908.0
9O4WaQ1zqUE,2018-01-13,2018-01-07,16,24,Entertainment Tonight,150991,746,758,522,False,False,5,True,Golden Globes 2018: What to Expect as Celebs Hit the Red Carpet in All Black,etonline|awards|entertainment news|golden globes 2018|et|hollywood|entertainment tonight|celebs|news|Golden globes|2018 golden globes|awards season|when are the golden globes|who is hosting the golden globes|nominees|presenters|who is Seth meyers|black dress|solidarity|sexual harassment|times up|black|red carpet black dress|fashion statement|protest|awareness|golden globes black|golden globes black dress|golden globes carpet|whywewearblack|timesup|metoo,More from Entertainment Tonight: https://www.youtube.com/channel/UCdtXPiqI2cLorKaPrfpKc4g?sub_confirmation=1\nHere's an inside look at what is expected to be the biggest fashion statement in Golden Globes history.,4,6,183,505,32,1006866.0
