video_id,last_trending_date,publish_date,publish_hour,category_id,channel_title,views,likes,dislikes,comment_count,comments_disabled,ratings_disabled,tag_appeared_in_title_count,tag_appeared_in_title,title,tags,description,trend_day_count,trend.publish.diff,trend_tag_highest,trend_tag_total,tags_count,subscriber
5qpjK5DgCt4,2017-11-20,2017-11-12,19,23,Rudy Mancuso,5315471,187303,7278,9990,False,False,8,True,"Racist Superman | Rudy Mancuso, King Bach & Lele Pons",racist superman|rudy|mancuso|king|bach|racist|superman|love|rudy mancuso poo bear black white official music video|iphone x by pineapple|lelepons|hannahstocking|rudymancuso|inanna|anwar|sarkis|shots|shotsstudios|alesso|anitta|brazil|Getting My Driver's License | Lele Pons,WATCH MY PREVIOUS VIDEO ▶ \n\nSUBSCRIBE ► https://www.youtube.com/channel/UC5jkXpfnBhlDjqh0ir5FsIQ?sub_confirmation=1\n\nTHANKS FOR WATCHING! LIKE & SUBSCRIBE FOR MORE VIDEOS!\n-----------------------------------------------------------\nFIND ME ON: \nInstagram | http://instagram.com/rudymancuso\nTwitter | http://twitter.com/rudymancuso\nFacebook | http://facebook.com/rudymancuso\n\nCAST: \nRudy Mancuso | http://youtube.com/c/rudymancuso\nLele Pons | http://youtube.com/c/lelepons\nKing Bach | https://youtube.com/user/BachelorsPadTv\n\nVideo Effects: \nCaleb Natale | https://instagram.com/calebnatale\n\nPA:\nPaulina Gregory\n\n\nShots Studios Channels:\nAlesso | https://youtube.com/c/alesso\nAnitta | http://youtube.com/c/anitta\nAnwar Jibawi | http://youtube.com/c/anwar\nAwkward Puppets | http://youtube.com/c/awkwardpuppets\nHannah Stocking | http://youtube.com/c/hannahstocking\nInanna Sarkis | http://youtube.com/c/inanna\nLele Pons | http://youtube.com/c/lelepons\nMaejor | http://youtube.com/c/maejor\nMike Tyson | http://youtube.com/c/miketyson \nRudy Mancuso | http://youtube.com/c/rudymancuso\nShots Studios | http://youtube.com/c/shots\n\n#Rudy\n#RudyMancuso,7,8,68,426,23,4191209.0
VifQlJit6A0,2017-11-19,2017-11-13,3,24,amc,230403,2413,581,2002,False,False,2,True,(SPOILERS) 'Shiva Saves the Day' Talked About Scene Ep. 804 | The Walking Dead,The Walking Dead|shiva|tiger|king ezekiel|episode 804|episode 4|some guy|sad|zombies|all out war|war|walkers|the kingdom|the saviors|Rick|Rick Grimes|Negan|Ezekiel|Daryl|Michonne|Morgan|Carl|Dwight|Jeffrey Dean Morgan|Andrew Lincoln|Norman Reedus|Danai Gurira|Lennie James|robert kirkman|scott m. gimple|apocalypse|season|season 8|alexandria|AMC|tv|tv show|television|11/12_TWD|Featured,"Shiva arrives just in time as King Ezekiel attempts to take out an army of walkers.\n\n#TheWalkingDead #TWD #AllOutWar\n\nFor more The Walking Dead videos: http://goo.gl/qJOZ6n\n\n(SPOILERS) Talked About Scene from The Walking Dead: Season 8, Episode 4\n\nSubscribe to the AMC YouTube Channel : http://goo.gl/qSMzej\nThe Walking Dead: https://goo.gl/jzTTCb\nSign Up for the The Walking Dead Newsletter : http://www.amc.com/shows/the-walking-dead/exclusives/newsletter-subscription\nThe Walking Dead on Facebook: https://www.facebook.com/TheWalkingDeadAMC/ \nThe Walking Dead on Twitter: https://twitter.com/WalkingDead_AMC \nSign Up for the AMC Newsletter : http://www.amc.com/newsletter-subscription\nAMC : http://www.amc.com/\nAMC on Facebook : https://www.facebook.com/amc\nAMC on Twitter : http://twitter.com/AMC_TV",6,6,150,407,40,657573.0
GgVmn66oK_A,2017-11-18,2017-11-12,14,25,NowThis World,789594,10203,1561,3551,False,False,2,True,Which Countries Are About To Collapse?,nowthis|nowthis world|world news|nowthis news|international news|countries|collapse|failing countries|war in the world|fragile states|the fragile states index|fund for peace|social|economic|political|which countries are failing|Central African Republic|CAR|countries that are sinking|countries that are dying|countries that are going to disappear|Somalia|colonization|dictatorship|south sudan,"The world at large is improving, but some countries and their governments are struggling to even function. Although disputed, to find out which three are the most likely to collapse, check out this video.\n» Subscribe to NowThis World: http://go.nowth.is/World_Subscribe\n» Follow us on Twitter: http://go.nowth.is/NowThisWorld_Twitter\n\nConnect with NowThis\n» Subscribe to NowThis News: http://go.nowth.is/News_Subscribe\n» Like us on Facebook: http://go.nowth.is/News_Facebook\n» Tweet us on Twitter: http://go.nowth.is/News_Twitter\n» Follow us on Instagram: http://go.nowth.is/News_Instagram\n» Find us on Snapchat Discover: http://go.nowth.is/News_Snapchat\n\nNowThis World is dedicated to bringing you topical explainers about the world around you. Check back in for new videos every Sunday, Tuesday, and Thursday at 9am ET.\n\nhttp://www.youtube.com/nowthisworld",5,6,49,115,25,1740822.0
e_7zHm7GsYc,2017-11-19,2017-11-13,15,10,Hunter Hayes,112866,3643,112,137,False,False,6,True,Hunter Hayes - You Should Be Loved (Part One Of Pictures),Hunter|Hayes|you should be loved|the shadowboxers|pictures|part one|official|music video|trilogy|hunter hayes|wanted|i want crazy|storm warning,You Should Be Loved (feat. The Shadowboxers) Available Now! Download or stream it here: https://HunterHayes.lnk.to/ysbl\n\nLike what you heard? Download or stream more songs by Hunter: \niTunes: http://smarturl.it/hunterhayes_itunes\nSpotify: http://smarturl.it/hunterhayes_sp\n\nStay in touch with Hunter! Follow him on social media: \nWebsite: http://smarturl.it/hunterhayes_site\nFacebook: http://smarturl.it/hunterhayes_fb \nTwitter: http://smarturl.it/hunterhayes_tw\nInstagram: http://smarturl.it/hunterhayes_ig\n\nMusic video by Hunter Hayes. ©2017 Atlantic Recording Corporation.,6,6,72,155,13,658161.0
w0XYVssCKjw,2017-11-17,2017-11-11,20,17,Kevin Durant,194930,6466,139,536,False,False,1,True,JaVale McGee's Parking Lot Chronicles: Episode 3,javale mcgee|golden state warriors|kevin durant|oakland|bay area|san francisco|oracle arena|e40|e-40|hip hop|rap|beats|beats by dre|life goes on|arthur|renowitzky|klay thompson|minnesota timberwolves|nick young|swaggy p,"The Parking Lot Chronicles return, coming at you on a rainy night in Oakland after the 11/8 win against the Timberwolves. Klay Thompson and Bay Area legend E-40 stop by, plus special guest Arthur Renowitzky tells his story and talks about his Life Goes On Foundation (http://www.lgof.org).\n\nWho do you wanna see on the next episode? Leave JaVale a note in the comments!\n\nExecutive Producers: JaVale McGee & Aloni Ford in conjunction with Thirty Five Media\n\nWatch JaVale's new music video: http://bit.ly/2yulAD1\nSubscribe for more: http://bit.ly/2tXIGi7",4,6,44,131,20,620050.0
t4YAyT4ihIQ,2017-11-17,2017-11-10,18,23,Lele Pons,3913682,129182,8991,5531,False,False,6,True,Getting My Driver's License | Lele Pons,getting my drivers license|lele|pons|getting|my|drivers|license|terrible soccer players|halloween costume contest|first time flying|how to not get bullied|lelepons|hannahstocking|rudymancuso|inanna|anwar|sarkis|shots|shotsstudios|alesso|anitta|brazil|Craziest Wisdom Teeth Removal Story | Hannah Stocking|| Hannah Stocking|Hannah Stocking,WATCH MY PREVIOUS VIDEO ▶ https://youtu.be/T8jBIVi6rrM\n\nSUBSCRIBE HERE ▶ http://www.youtube.com/channel/UCi9cDo6239RAzPpBZO9y5SA?sub_confirmation=1\n\nTHANKS FOR WATCHING! :) LIKE & SUBSCRIBE FOR MORE VIDEOS!\n-----------------------------------------------------------\nFIND ME ON:\nInstagram | http://instagram.com/lelepons\nTwitter | http://twitter.com/lelepons\nFacebook | http://facebook.com/lele\nSnapchat | http://snapchat.com/add/lelepons \n\nCAST: \nLele Pons | http://youtube.com/c/lelepons\nJustin Taite | https://instagram.com/justintaite\nKatherine Lucia | https://instagram.com/katherinelucia\nFiammetta Cavatorta | https://instagram.com/fi_cavatorta\nYoung Ezee | http://instagram.com/youngezee\nNatalie Odell | http://instagram.com/natalie.odell\n\nShots Studios Channels:\nAlesso | https://youtube.com/c/alesso\nAnitta | http://youtube.com/c/anitta\nAnwar Jibawi | http://youtube.com/c/anwar\nAwkward Puppets | http://youtube.com/c/awkwardpuppets\nHannah Stocking | http://youtube.com/c/hannahstocking\nInanna Sarkis | http://youtube.com/c/inanna\nLele Pons | http://youtube.com/c/lelepons\nMaejor | http://youtube.com/c/maejor\nMike Tyson | http://youtube.com/c/miketyson \nRudy Mancuso | http://youtube.com/c/rudymancuso\nShots Studios | http://youtube.com/c/shots\n\n#Lele\n#LelePons,4,7,30,373,27,8499294.0
AJYb0Yom5UQ,2017-11-16,2017-10-17,20,23,cocheusadoooo,172587,379,49,199,False,False,3,True,Howard Stern: George Takei Talks About Harvey Weinstein and Sexually Assault,Harvey Weinstein|Howard Stern|Howard Stern Show|Hollywood|casting couch|angie everhart|robin quivers|george takei|Star Terk|Star Trek|Gay|Homo|LBGT,While talking about Harvey Weinstein. George Takei talks about grabbing men's c***s. While he was on Star Trek.  OH MY!!!!,3,30,114,165,13,1409.0
pa_oUisZZy0,2017-11-16,2017-11-11,0,22,BuzzFeed Celeb,243412,7782,104,340,False,False,4,True,Mark Ruffalo Reads Hilarious Thirst Tweets,BuzzFeed|buzzfeed celeb|Mark Ruffalo|Thor|Ragnarok|funny|thirst|thirsty|tweet|celeb|celebrity|interview|surprise|flattered|embarrassing|embarrassed|hilarious|LOL|awkward|daddy|celebrities|entertainment,"I'm just...I'm flattered.\n\nCredits: https://www.buzzfeed.com/bfmp/videos/37156\n\nGET MORE BUZZFEED:\nhttps://www.buzzfeed.com\nhttps://www.buzzfeed.com/videos\nhttps://www.youtube.com/buzzfeedvideo\nhttps://www.youtube.com/boldly\nhttps://www.youtube.com/buzzfeedblue\nhttps://www.youtube.com/buzzfeedviolet\nhttps://www.youtube.com/perolike\nhttps://www.youtube.com/ladylike\n\nBuzzFeed Celeb\nShort, funny, original videos from the Buzzfeed crew about you and the things you like. Just like BuzzFeedVideo but popping harder.\n\nMUSIC\nSFX Provided By AudioBlocks\n(https://www.audioblocks.com)\n\nLicensed via Audio Network\n\nSTILLS\n/BuzzMoji",3,5,488,1345,22,1360210.0
_Iz83-Cmt6A,2017-11-16,2017-11-09,22,10,CMAVEVO,58135,519,69,65,False,False,11,True,Little Big Town with Jimmy Webb - Wichita Lineman (Live from the CMA Awards),Little|Big|Town|with|Jimmy|Webb|Wichita|Lineman|(Live|from|the|CMA|Awards)|Country|Music|Association|Classic,Music video by Little Big Town performing Little Big Town with Jimmy Webb - Wichita Lineman (Live from the CMA Awards). \n\nhttp://vevo.ly/YoYKZZ,3,7,171,515,17,66329.0
k29YnfttqEU,2017-11-14,2017-11-09,4,23,Jimmy Kimmel Live,1315873,9312,584,769,False,False,2,True,Mean Tweets – Country Music Edition #3,jimmy|jimmy kimmel|jimmy kimmel live|late night|talk show|funny|comedic|comedy|clip|comedian|mean tweets|country music|cma awards|Zac Brown Band|Cassadee Pope|Blake Shelton|Luke Combs|Randy Houser|Old Dominion|Trace Adkins|Darius Rucker|Dan + Shay|Jana Kramer|Chris Young|Florida Georgia Line|Lady Antebellum|Chris Stapleton|Jake Owen|Little Big Town|justin moore|twitter,"From time to time, we like to shine a light on the not so nice things people post on social media. In honor of the CMA Awards we present a special Country Music Edition of #MeanTweets featuring Zac Brown Band, Cassadee Pope, Blake Shelton, Luke Combs, Randy Houser, Old Dominion, Trace Adkins, Darius Rucker, Dan + Shay, Jana Kramer, Chris Young, Florida Georgia Line, Lady Antebellum, Chris Stapleton, Jake Owen, Little Big Town and Justin Moore. #MeanTweets\n\nJimmy Kimmel Supports TrumpCare https://youtu.be/vuXwD0NWixM\n \nSUBSCRIBE to get the latest #KIMMEL: http://bit.ly/JKLSubscribe\n \nWatch Mean Tweets: http://bit.ly/KimmelMT10\n \nConnect with Jimmy Kimmel Live Online:\n \nVisit the Jimmy Kimmel Live WEBSITE: http://bit.ly/JKLWebsite\nLike Jimmy Kimmel on FACEBOOK: http://bit.ly/KimmelFB\nLike Jimmy Kimmel Live on FACEBOOK: http://bit.ly/JKLFacebook\nFollow @JimmyKimmel on TWITTER: http://bit.ly/KimmelTW\nFollow Jimmy Kimmel Live on TWITTER: http://bit.ly/JKLTwitter\nFollow Jimmy Kimmel Live on INSTAGRAM: http://bit.ly/JKLInstagram\n \nAbout Jimmy Kimmel Live:\n \nJimmy Kimmel serves as host and executive producer of Emmy-winning Jimmy Kimmel Live, ABC's late-night talk show.\n\nJimmy Kimmel Live is well known for its huge viral video successes with 5.6 billion views on YouTube alone.\nSome of Kimmel's most popular comedy bits include - Mean Tweets, Lie Witness News, Jimmy's Twerk Fail Prank, Unnecessary Censorship, YouTube Challenge, The Baby Bachelor, Movie: The Movie, Handsome Men's Club, Jimmy Kimmel Lie Detective and music videos like I (Wanna) Channing All Over Your Tatum and a Blurred Lines parody with Robin Thicke, Pharrell, Jimmy and his security guard Guillermo.\nNow in its fifteenth season, Kimmel's guests have included: Johnny Depp, Meryl Streep, Tom Cruise, Halle Berry, Harrison Ford, Jennifer Aniston, Will Ferrell, Katy Perry, Tom Hanks, Scarlett Johansson, Channing Tatum, George Clooney, Larry David, Charlize Theron, Mark Wahlberg, Kobe Bryant, Steve Carell, Hugh Jackman, Kristen Wiig, Jeff Bridges, Jennifer Garner, Ryan Gosling, Bryan Cranston, Jamie Foxx, Amy Poehler, Ben Affleck, Robert Downey Jr., Jake Gyllenhaal, Oprah, and unfortunately Matt Damon.\n\nMean Tweets – Country Music Edition #3\nhttps://youtu.be/k29YnfttqEU",1,5,488,1688,31,11259007.0
_qSW96a2aKY,2017-11-15,2017-11-08,5,24,Keith Urban,878560,12961,1468,1788,False,False,3,True,Keith Urban - Female (Official Audio),Keith Urban|Female|New Music|Official|CMA Awards,Buy or stream Female now: www.smarturl.it/KU-Female\n\nJoin Keith's mailing list: https://keithurban.net/join\nJoin Keith's fan club: https://keithurban.net/theville\n\nConnect with Keith:\n\nFacebook: https://www.facebook.com/keithurban\nTwitter: https://twitter.com/KeithUrban\nInstagram: https://www.instagram.com/keithurban\nSnapchat: https://www.snapchat.com/add/keithurban,2,7,72,136,5,174968.0
mwpHSMv1pI4,2017-11-14,2017-11-09,1,23,MyHarto,359120,15130,223,1143,False,False,5,True,Girlfriend Gives Me A Surprise Makeover!? | Hannah Hart,hannah|hart|funny|hannah hart|harto|my drunk kitchen|buzzfeed|makeover|girlfriend|comedy|how to|buzzfeed ella|ella mielniczenko|relationships|buzzfeed video|ella|relationship|awkward|lgbt|buzzfeedvideo|violet|buzzfeed violet|couple|friends|love|dating|buzzfeedviolet|ashly perez|date|lesbian|dating advice|relationship advice|beauty|crush|couples|coming out|laugh|dating tips|boyfriend|dating coach|handcraft,"My girlfriend surprises me with a makeover! I'm on the fence about the results of my makeup transformation... \n\nThank you to Carsen (@labellssss) for doing that to my face! \n\nKITCHEN SWAGGAH: http://dftba.com/hannah\n\nThis is a truly wonderful time. These moments are treasures!\n\nLove,\nHannah\n\nsnapchat: @hartoooo\ntwittah: http://twitter.com/harto\ninstagram: http://instagram.com/myharto\ntumblr: http://mydrunkkitchen.tumblr.com\nfacebook: http://facebook.com/hannahhartofficial \nbuzzfeed funny comedy makeover",1,5,488,1622,41,2533984.0
9SK1I0V6U5c,2017-11-21,2017-11-14,18,23,Anwar Jibawi,2408682,105248,1205,5987,False,False,5,True,Lie Detector | Anwar Jibawi,lie detector|anwar|jibawi|lie|detector|the walking dead no mans land by anwar jibawi hannah stocking inanna sarkis|aladdin gets a car|alesso anitta is that for me anwar jibawi dance|The Walking Dead: No Man’s Land by Anwar Jibawi|Hannah Stocking & Inanna Sarkis|lelepons|hannahstocking|rudymancuso|inanna|sarkis|shots|shotsstudios|alesso|anitta|brazil,WATCH DOWNTOWN MUSIC VIDEO ▶ https://youtu.be/wlS6Ix7mA0w\nSUBSCRIBE ► https://www.youtube.com/channel/UCEr55381WIqO1w_IzgcI5DQ?sub_confirmation=1\n\nWATCH MY PREVIOUS VIDEO ▶ https://youtu.be/92-b5Su0bw8\n\nTHANKS FOR WATCHING! LIKE & SUBSCRIBE FOR MORE VIDEOS!\n-----------------------------------------------------------\nFIND ME ON: \nInstagram | http://instagram.com/anwar\nSnapchat | http://snapchat.com/add/anwar\nTwitter | http://twitter.com/anwar\n\nCAST:\nAnwar Jibawi | http://youtube.com/c/anwar\nAlpha Cat | https://youtube.com/alphacat\nAlessandro Chillé | https://instagram.com/alessandrochilleactor\n\nAssistant Director:\nAlessandro Chillé | https://instagram.com/alessandrochilleactor\n\nShots Studios Channels:\nLele Pons | http://youtube.com/c/lelepons\nAnwar Jibawi | http://youtube.com/c/anwar\nShots Studios | http://youtube.com/c/shots\nInanna Sarkis | http://youtube.com/c/inanna\nRudy Mancuso | http://youtube.com/c/rudymancuso\nHannah Stocking | http://youtube.com/c/hannahstocking\nAnitta | http://youtube.com/c/anitta\nAlesso | https://youtube.com/c/alesso\nMike Tyson | http://youtube.com/c/miketyson\nAwkward Puppets | http://youtube.com/c/awkwardpuppets\nMarshmello | http://youtube.com/c/marshemellomusic\nGhastly | http://youtube.com/c/ghastlymusic\nSlushii | http://youtube.com/c/slushiimusic\nOokay | http://youtube.com/c/ookaymusic\nJauz | http://youtube.com/c/jauzofficial\nMaejor | http://youtube.com/c/maejor\n\n#Anwar\n#AnwarJibawi\n#Alphacat,7,7,30,331,20,2613499.0
VsYmwBOYfW8,2017-11-15,2017-11-14,8,23,Jimmy Kimmel Live,2765121,35529,1705,2388,False,False,3,True,Mean Tweets – Jimmy Kimmel Edition,jimmy|jimmy kimmel|jimmy kimmel live|late night|talk show|funny|comedic|comedy|clip|comedian|mean tweets|Ray Romano|Michael Keaton|Halle Berry|Anthony Anderson|Howard Stern|David Spade|Chris Hemsworth|Kristen Bell|Jon Stewart|Tracy Morgan|Amy Schumer|Liam Neeson|Larry David|Mike Tyson|Jeff Bridges|Zach Galifianakis|Kim Kardashian West|Stephen Colbert|Jennifer Lawrence|David Letterman|will ferrell|twitter,"In honor of Jimmy’s 50th birthday, we surprised him with an all Jimmy Kimmel edition of Mean Tweets featuring Ray Romano, Michael Keaton, Halle Berry, Anthony Anderson, Howard Stern, David Spade, Chris Hemsworth, Kristen Bell, Jon Stewart, Tracy Morgan, Amy Schumer, Liam Neeson, Larry David, Mike Tyson, Jeff Bridges, Zach Galifianakis, Kim Kardashian West, Stephen Colbert, Jennifer Lawrence, David Letterman and Will Ferrell. #MeanTweets\n\nJimmy Kimmel Talks to Kellyanne Conway About Trump Putin Meeting https://youtu.be/B7aGYBaKe40\n \nSUBSCRIBE to get the latest #KIMMEL: http://bit.ly/JKLSubscribe\n \nWatch Mean Tweets: http://bit.ly/KimmelMT10\n \nConnect with Jimmy Kimmel Live Online:\n \nVisit the Jimmy Kimmel Live WEBSITE: http://bit.ly/JKLWebsite\nLike Jimmy Kimmel on FACEBOOK: http://bit.ly/KimmelFB\nLike Jimmy Kimmel Live on FACEBOOK: http://bit.ly/JKLFacebook\nFollow @JimmyKimmel on TWITTER: http://bit.ly/KimmelTW\nFollow Jimmy Kimmel Live on TWITTER: http://bit.ly/JKLTwitter\nFollow Jimmy Kimmel Live on INSTAGRAM: http://bit.ly/JKLInstagram\n \nAbout Jimmy Kimmel Live:\n \nJimmy Kimmel serves as host and executive producer of Emmy-winning Jimmy Kimmel Live, ABC's late-night talk show.\n\nJimmy Kimmel Live is well known for its huge viral video successes with 5.6 billion views on YouTube alone.\nSome of Kimmel's most popular comedy bits include - Mean Tweets, Lie Witness News, Jimmy's Twerk Fail Prank, Unnecessary Censorship, YouTube Challenge, The Baby Bachelor, Movie: The Movie, Handsome Men's Club, Jimmy Kimmel Lie Detective and music videos like I (Wanna) Channing All Over Your Tatum and a Blurred Lines parody with Robin Thicke, Pharrell, Jimmy and his security guard Guillermo.\nNow in its fifteenth season, Kimmel's guests have included: Johnny Depp, Meryl Streep, Tom Cruise, Halle Berry, Harrison Ford, Jennifer Aniston, Will Ferrell, Katy Perry, Tom Hanks, Scarlett Johansson, Channing Tatum, George Clooney, Larry David, Charlize Theron, Mark Wahlberg, Kobe Bryant, Steve Carell, Hugh Jackman, Kristen Wiig, Jeff Bridges, Jennifer Garner, Ryan Gosling, Bryan Cranston, Jamie Foxx, Amy Poehler, Ben Affleck, Robert Downey Jr., Jake Gyllenhaal, Oprah, and unfortunately Matt Damon.\n\nMean Tweets – Jimmy Kimmel Edition\nhttps://youtu.be/VsYmwBOYfW8",1,1,488,1812,33,11259007.0
5hEJsoDP2q4,2017-11-16,2017-11-14,17,24,todrickhall,209442,19069,289,836,False,False,6,True,"Justice League | “Come Together” | Todrick Hall, J.Fla, Mario Bautista, Samantha Harvey, Clara Marz",Todrick Hall|Pentatonix|GAY|lgbt|justice league|justice league movie|batman|wonder woman|cyborg|the flash|aquaman|j. Fla|j fla|samantha harvey|clara marz|mario bautista|Gary Clark Jr|come together|come together song|cover|come together cover|dc comics|super heros|dc entertainment|warner brothers|wb pictures|warner bros|musical|Beatles|Beatle cover|music video|sam harvey|alter ego|superhero|beyonce|taylor swift,A huge thank you to Warner Bros. for the incredible Justice League experience and for sponsoring this video #JusticeLeague  #WBSponsored\nJustice League is in theaters this week. Get your tickets now: https://goo.gl/TSCTsn\n\nI had so much fun channeling my inner Super Hero and assembling a squad of international creators to cover Gary Clark Jr.’s version of Come Together”—Music can save the world! \n\nFeatured Creators:\n J.Fla: Wonder Woman | http://youtube.com/c/jflamusic\n Clara Marz: Aquaman | http://bit.ly/claramarzofficial\n Todrick Hall: Cyborg | http://youtube.com/c/todrickhall\n Samantha Harvey: The Flash | http://bit.ly/misssamanthaharvey\n Mario Bautista: Batman | http://bit.ly/mariobautista\n\nAlso starring:\nGary Clark Jr. | http://bit.ly/GaryClarkJrYT \n\nProduced by Portal A\nMusic mix by the Gregory Brothers  | https://www.youtube.com/user/thegregorybrothers \n\nFollow Todrick:\nhttp://instagram.com/todrick\nhttp://facebook.com/toddyrockstar\nhttp://twitter.com/todrick\nhttp://todrickhall.com,2,2,57,337,36,2842339.0
8-Cjsnq8kVU,2017-11-23,2017-11-15,14,1,20th Century Fox,12382809,328876,7238,14836,False,False,1,True,Deadpool’s “Wet on Wet” Teaser,Trailer|Deadpool|20th Century Fox (Production Company)|Deadpool Movie|Ryan Reynolds (Celebrity)|Ed Skrein (Musical Artist)|T. J. Miller (TV Writer)|Gina Carano (Martial Artist)|Red band|Red band deadpool|Marvel|Marvel Comics|Comic Book (Comic Book Genre)|Dead pool|Deadpool green band|Deadpool red band|Action|Comedy|Action Comedy|X-Men (Award-Winning Work),"After surviving a near fatal bovine attack, a disfigured cafeteria chef (Wade Wilson) struggles to fulfill his dream of becoming Mayberry’s hottest bartender while also learning to cope with his lost sense of taste. Searching to regain his spice for life, as well as a flux capacitor, Wade must battle ninjas, the yakuza, and a pack of sexually aggressive canines, as he journeys around the world to discover the importance of family, friendship, and flavor – finding a new taste for adventure and earning the coveted coffee mug title of World’s Best Lover. \n\nIn Theaters June 1, 2018\n\nConnect with Deadpool Online: http://fox.co/DeadpoolMovieSite\nLike Deadpool on FACEBOOK: http://fox.co/DeadpoolFB\nFollow Deadpool on TWITTER: http://fox.co/DeadpoolTwitter\nFollow Deadpool on INSTAGRAM: http://fox.co/DeadpoolInstagram",8,8,441,732,20,2453494.0
C4YNcqNF4hg,2017-11-19,2017-11-15,12,23,Late Night with Seth Meyers,484287,7792,150,342,False,False,3,True,Joe Keery Talks About His Famous Hair,Late Night|Seth Meyers|Joe Keery|Talks About|Famous Hair|NBC|NBC TV|television|funny|talk show|comedy|humor|stand-up|parody|snl seth meyers|host|promo|seth|meyers|weekend update|news satire|satire|Stranger Things|Molly's Game|Slice|Chicago Fire|Empire|Steve Harrington|Ben Schwartz,"Stranger Things' Joe Keery discusses his famous hair, the perils of tight jeans in the '80s and the odd jobs he had in high school.\n» Subscribe to Late Night: http://bit.ly/LateNightSeth\n» Get more Late Night with Seth Meyers: http://www.nbc.com/late-night-with-seth-meyers/\n» Watch Late Night with Seth Meyers Weeknights 12:35/11:35c on NBC.\n\nLATE NIGHT ON SOCIAL\nFollow Late Night on Twitter: https://twitter.com/LateNightSeth\nLike Late Night on Facebook: https://www.facebook.com/LateNightSeth\nFind Late Night on Tumblr: http://latenightseth.tumblr.com/\nConnect with Late Night on Google+: https://plus.google.com/+LateNightSeth/videos\n\nLate Night with Seth Meyers on YouTube features A-list celebrity guests, memorable comedy, and topical monologue jokes.\n\nNBC ON SOCIAL \nLike NBC: http://Facebook.com/NBC\nFollow NBC: http://Twitter.com/NBC\nNBC Tumblr: http://NBCtv.tumblr.com/\nNBC Pinterest: http://Pinterest.com/NBCtv/\nNBC Google+: https://plus.google.com/+NBC\nYouTube: http://www.youtube.com/nbc\nNBC Instagram: http://instagram.com/nbctv\n\nJoe Keery Talks About His Famous Hair- Late Night with Seth Meyers\nhttps://youtu.be/C4YNcqNF4hg\n\n\nLate Night with Seth Meyers\nhttp://www.youtube.com/user/latenightseth",4,4,488,2201,29,1968678.0
